,Video Id,channelTitle,title,publishedAt,categoryId,description,viewCount,likeCount,favouriteCount,commentCount,duration
43,IU8NYOEL3aM,CNN,'Don't you dare speak for me': Berman fires back at Taylor Greene,2021-05-24T15:08:09Z,25,"CNN's John Berman reacts to comments made by Rep. Marjorie Taylor Greene (R-GA) comparing mask mandates to the treatment of the Jews during the Holocaust.

===
Marjorie Taylor Greene compares House mask mandates to the Holocaust
By Ryan Nobles, CNN

(CNN) Republican Rep. Marjorie Taylor Greene, during an interview on a conservative podcast this week, compared House Speaker Nancy Pelosi's decision to continue to require members of the House to wear masks on the chamber floor to steps the Nazis took to control the Jewish population during the Holocaust.

Greene, in a conversation with the Christian Broadcasting Network's David Brody Real America's Voice TV show ""The Water Cooler,"" attacked Pelosi and accused her of being a hypocrite for asking GOP members to prove they have all been vaccinated before allowing members to be in the House chamber without a mask.

""You know, we can look back at a time in history where people were told to wear a gold star, and they were definitely treated like second class citizens, so much so that they were put in trains and taken to gas chambers in Nazi Germany,"" Greene said. ""And this is exactly the type of abuse that Nancy Pelosi is talking about.""

Jewish groups were quick to condemn Greene's remarks. 

""You can never compare health-related restrictions with yellow stars gas chambers and other Nazi atrocities. Such comparisons demean the Holocaust and contaminate American political speech,"" the American Jewish Congress said in a tweet in response to Greene's comments. ""Rep. Marjorie Taylor Greene must immediately retract and apologize.""

Read more at: https://www.cnn.com/2021/05/21/politics/marjorie-taylor-greene-mask-mandates-holocaust/index.html
===

Marjorie Taylor Greene apologizes for 'offensive' Holocaust comparison after visiting Holocaust museum
https://www.cnn.com/2021/06/14/politics/marjorie-taylor-greene-holocaust-museum-apology/index.html",1784144,30384,,11282,PT5M49S
44,q5SoxUx_rYA,CNN,(2016) Pete Sampras: Why I won't coach on the pro tour,2016-03-18T21:37:14Z,25,"Tennis great evaluates his successors at the top of the men's game and tells Open Court why he's happy to stay at home.

Serena Williams announces she will 'evolve away from tennis' after upcoming US Open
By Ben Morse

Serena Williams has announced that she will ""evolve away from tennis"" after this year's US Open to focus on ""other things that are important to me.""

In an article in Vogue, the 23-time grand slam winner said that, although she will try to win at the US Open, it is time for her to move ""in a different direction.""
""There comes a time in life when we have to decide to move in a different direction,"" Williams posted on Instagram with a picture of herself on the cover of Vogue with the title: 'Serena's Farewell...I'm terrible at goodbyes.'

""That time is always hard when you love something so much. My goodness do I enjoy tennis. But now, the countdown has begun. I have to focus on being a mom, my spiritual goals and finally discovering a different, but just exciting Serena. I'm gonna relish these next few weeks.""

The announcement comes a day after the 40-year-old won her first singles match in 430 days.

She played her first singles match in over a year at Wimbledon in June, losing to France's Harmony Tan. Afterwards, she hinted that she could play on home soil at the US Open, which begins August 29.

Read more: https://www.cnn.com/2022/08/09/tennis/serena-williams-retirement-tennis-spt-intl/index.html

===
Novak Djokovic targets Pete Sampras' year-end world No. 1 record in Vienna
By George Ramsay

While unable to edge closer to Roger Federer and Rafael Nadal in the grand slam leaderboard in the second half of the tennis season, Novak Djokovic is chasing one record that could see him outstrip his rivals.

Djokovic needs to win just two matches at this week's Vienna Open to end the year as world No. 1 for the sixth time, equaling Pete Sampras' record set between 1993 and 1998.

The Serb is currently tied with Federer, Nadal -- whom he lost to in the final of the French Open earlier this month -- and Jimmy Connors on five year-ending No. 1 accolades, securing them in 2011, 2012, 2014, 2015 and 2018.

Read more: https://www.cnn.com/2020/10/27/tennis/novak-djokovic-pete-sampras-tennis-spt-intl/index.html",1761547,5858,,1391,PT5M16S
45,PCRC-3cLUhk,CNN,"Ivanka spent hours trying to persuade Trump to call off rioters, new book claims",2021-07-15T23:48:18Z,25,"Explosive revelations in an upcoming book obtained by CNN  detail the final days of former President Donald Trump's term. According to excerpts of ""I Alone Can Fix It,"" Ivanka Trump spent hours attempting to convince her father to call off the rioters behind the January 6 Capitol insurrection. CNN’s Victor Blackwell, Alisyn Camerota and Jamie Gangel discuss. 
#JamieGangel #CNN #Newsroom",1758039,23153,,9349,PT8M30S
46,ftObI-rx6P0,CNN,See what makes Sweden one of the top-ranked air forces,2022-05-23T16:11:58Z,25,CNN's Nina dos Santos takes a look at Sweden's armed forces and the ways its top-ranked air force could potentially benefit NATO. #CNN #News,1757559,17398,,3769,PT8M21S
47,LgmbgAIebw0,CNN,'This is bad news for Trump': Reporter reveals new Jan. 6 info,2022-01-03T15:56:39Z,25,"CNN Special Correspondent Jamie Gangel and CNN political commentator Scott Jennings react to new information that there are ""multiple sources"" with firsthand knowledge of former President Donald Trump's activities during the Capitol insurrection on January 6. #CNN #News",1727220,23471,,16571,PT8M52S
48,2eEcSEta1kA,CNN,Hear ex-Trump lawyer's stunning defense,2021-03-23T23:08:41Z,25,"Right-wing lawyer Sidney Powell is claiming in a new court filing that reasonable people wouldn't have believed her assertions of fraud as fact after the 2020 presidential election.

#CNN #News",1694313,22823,,12321,PT6M33S
49,oVEwNOInktY,CNN,Trudeau was asked about Trump.  See how long it took him to respond,2020-06-03T03:35:24Z,25,"A reporter asked Canadian Prime Minister Justin Trudeau about smoke canisters and pepper balls being used on US protesters so that President Trump could have a photo-op in front of a burned church near the White House.

#Trudeau #CNN #News",1671460,29196,,8740,PT7M18S
