,Video Id,channelTitle,title,publishedAt,categoryId,description,viewCount,likeCount,favouriteCount,commentCount,duration
0,thihXcZXOsU,CNN,Craziest moments at U.N. General Assembly,2014-09-23T01:20:03Z,25,"From Gadhafi to Ahmadinejad, Bush to Chavez: look back at memorable moments from past UNGA sessions. Richard Roth reports.

UN suspends Russia from Human Rights Council:
https://www.cnn.com/2022/04/07/politics/un-russia-human-rights/index.html

Biden's Middle East allies change tune on Ukraine war as conflict escalates:
https://www.cnn.com/2022/03/03/middleeast/russia-ukraine-gulf-unga-03-03-2022-intl/index.html",23148809,184078,,11960,PT1M48S
1,nGHhg-gj7PM,CNN,Jodi thought the camera was off,2013-04-30T02:42:15Z,25,"Dr. Drew takes a look at Jodi Arias' behavior when she thought the cameras were off in 2008. For more CNN videos, visit our site at http://www.cnn.com/video/",18860643,52419,,16686,PT2M54S
2,OvRNo3oP-S0,CNN,"Girl, 9, accidentially kills instructor in Uzi accident",2014-08-27T19:05:47Z,25,A 9-year-old girl learning to fire a gun accidentally killed her instructor at a shooting range and will not face charges.,13375648,75246,,46387,PT3M41S
3,z2bTymnb1uE,CNN,Meet the real woman behind the voice of Siri,2013-10-04T13:47:21Z,25,Susan Bennett reveals to the world that she's the voice behind Siri.,12383345,126938,,7746,PT2M34S
4,77pnVFLkUjM,CNN,Obama: 'We're building Iron Man',2014-02-25T23:27:05Z,25,"President Obama had some fun during a White House manufacturing innovation event, announcing an ""Iron Man"" development. More from CNN at http://www.cnn.com/

To license this and other CNN/HLN content, visit http://imagesource.cnn.com or e-mail cnn.imagesource@turner.com.",7887484,164138,,10178,PT50S
5,j0chL87gPag,CNN,New heart-stopping footage of massive great white shark attack,2022-07-24T11:22:58Z,25,"Jeff Kurr, the producer and director of Discovery's ""Shark Week,"" discusses footage his team captured of a great white shark destroying a diver's enclosure. Discovery and CNN share a corporate parent, Warner Bros. Discovery. 
#cnn #News",5865351,45575,,14554,PT7M50S
6,dt2L14RcWP0,CNN,'Picking them off': Petraeus explains how Ukrainians are taking out Russian generals,2022-03-21T00:15:08Z,25,"Retired US Army Gen. David Petraeus tells CNN's Jake Tapper how the Ukrainian people have aided their army in killing multiple Russian generals. CNN has not been able to confirm the killings.
#CNN #News

Putin spokesman refuses to rule out use of nuclear weapons if Russia faced an 'existential threat'
https://edition.cnn.com/2022/03/22/europe/amanpour-peskov-interview-ukraine-intl/index.html",5454471,47634,,11087,PT6M53S
7,jexFvTZW2-A,CNN,Ukrainian soldier uses Russian tank against Russian forces,2022-05-11T14:05:40Z,25,"Ukraine's army of volunteers includes a software engineer with a tank nicknamed ""Bunny."" CNN's Sam Kiley speaks to some of the volunteer soldiers about life on the front line. #CNN #News",5122656,56320,,6498,PT3M55S
8,GEARtTBHXEw,CNN,See where officials believe the coronavirus started,2020-01-21T02:47:47Z,25,"Scientists have identified a new coronavirus, which has infected more than two hundred people since the initial outbreak in Wuhan, China. CNN's Kristie Lu Stout reports on the origins of the mysterious SARS-like virus and the scientific race to control it. #CNN #News",4663934,44576,,22385,PT7M31S
9,xyXM4A1Zse4,CNN,'Could be a big problem for you': Security analyst's warning to Putin,2022-03-27T21:13:22Z,25,"CNN's Peter Bergen reviews the implication of the Soviet Union's invasion of and withdrawal from Afghanistan, and how it could draw parallels to Russia's war in Ukraine today. #CNN #News",3552161,26824,,7217,PT5M28S
10,u24kxNbqb-A,CNN,Analyst says Putin has a dark reason for keeping his daughters a secret,2022-04-07T12:49:59Z,25,CNN's Brian Todd speaks to Russian analysts after Western countries placed sanctions on Putin's daughters Mariya Putina and Katerina Tikhonova. #CNN #News,3443908,27281,,7561,PT10M8S
11,j_m7Fia_v5A,CNN,I'm black and I'm a member of the 1%,2016-10-14T19:40:53Z,25,"In the U.S. today, the average African-American household owns just 6 cents for every $1 of wealth held by the typical white household, and blacks make up just 1.7% of the top 1% of wealthy Americans. 

But there are black members of the 1% who are working to change that. Tanzina Vega investigates the historical and contemporary racial barriers to wealth creation in the U.S.

US Black-White inequality in 4 charts
https://www.cnn.com/2021/06/01/politics/black-white-racial-wealth-gap/index.html

3.5 million Black American households have a negative net worth, new study finds
https://www.cnn.com/2021/06/18/business/black-wealth-mckinsey-study/index.html

Here's how to propel 2 million Black Americans to the middle class
https://www.cnn.com/2021/06/18/perspectives/racial-disparities-wealth-income/index.html",3331640,70766,,8675,PT7M
12,306wDjZ99Fo,CNN,CNN gets first look at a captured Russian drone. See what was found inside,2022-07-21T23:11:40Z,25,"CNN's Nic Robertson shows how Western technology used in drones is helping Russia to track and kill Ukrainian forces.

Opinion: The American-made weapons that could change everything
by David A. Andelman

It seems that increasingly these days, the United States is letting Ukraine fight, valiantly, but is it with one hand tied behind its back?

The US and its allies have given the Ukrainians artillery systems, some of them quite advanced, but withheld those with the longest range or, as arms experts have suggested, the greatest sophistication.

In an address to Congress on Wednesday, Ukrainian first lady Olena Zelenska asked US lawmakers to send air defense systems to her country ""in order for rockets not to kill children in their strollers.""
Still, Ukrainian officials have expressed their public gratitude for weapons delivered so far. Ukranian President Voldymyr Zelensky, in his daily video message Monday, observed that his armed forces are now ""able to inflict significant logistical losses on the occupiers.""

Military observers tell me that Zelensky and his senior generals have expressed their delight in the new systems that are appearing, hoping that their words will encourage a greater willingness of the West to release even more advanced systems that could turn the tide of battle by leaps and bounds.

There is an electronic war that cries out to be fought -- drones that need to be jammed or flown to precise targets, long-range artillery with GPS targeting, enemy chatter that needs to be plucked from the skies. Some of these capabilities are increasing as the West gradually introduces new systems to the battlefield and trains Ukrainians to operate them.

Read more: https://www.cnn.com/2022/07/21/opinions/ukraine-war-american-weapons-andelman/index.html",3236160,20374,,4510,PT2M42S
13,JLmQTCbD-nA,CNN,"Keilar: After everything, Ted Cruz has the gall to say this ...",2021-01-08T21:06:16Z,25,"CNN's Brianna Keilar rolls the tape on all the times President Trump has embraced violence and the way Sen. Ted Cruz (R-TX) has tried to rewrite his past support of Trump since the riot at the Capitol.

#BriannaKeilar #CNN #News",3076390,44561,,11385,PT6M29S
14,1q1jqbJM2v4,CNN,Corporations halt donations to GOP who voted to overturn elections,2021-01-11T16:09:39Z,25,"Some of America's biggest companies are suspending donations to Republican Congress members who objected to the Electoral College's votes.
The growing list of those corporations, including BlueCross BlueShield, Citigroup (C), Commerce Bank and Marriott (MAR), comes after a pro-Trump mob breached the US Capitol last Wednesday to fight against the ceremonial counting of electoral votes that confirmed President-elect Joe Biden's win.
147 Republicans voted against certification of the electoral votes in a joint session of Congress last Wednesday evening. They included Missouri Sen. Josh Hawley, Kansas Sen. Roger Marshall, Texas Sen. Ted Cruz and Alabama Sen. Tommy Tuberville, among hundreds other congress members.
""At the Blue Cross Blue Shield Association, we continuously evaluate our political contributions to ensure that those we support share our values and goals,"" said Kim Keck, BlueCross BlueShield's president and CEO, in a statement. ""In light of this week's violent, shocking assault on the United States Capitol, and the votes of some members of Congress to subvert the results of November's election by challenging Electoral College results, BCBSA will suspend contributions to those lawmakers who voted to undermine our democracy.""
The health insurance company's BLUEPAC political action committee -- supported only by employee contributions -- donated $246,750 to Republican lawmakers during the 2020 cycle. That included $10,000 to Sen. Tuberville, $1,000 to Sen. Marshall and $500 to Sen. Hawley.
BlueCross BlueShield said it's stopping donations to all 147 Republicans who challenged the Electoral College results.
#CNN #ChristineRomans #FirstMove",2923310,42050,,11736,PT8M13S
15,rg1-MWAjqPU,CNN,Nurse reveals how she pranks Covid deniers who call her a crisis actor,2021-07-23T22:26:54Z,25,"Sunny, a nurse in Arkansas, shares the hate and struggle she has experienced throughout the coronavirus pandemic. CNN's Elle Reeve has more on the mindset of some around Covid-19 in Western Arkansas.

#CNN #News",2913551,55577,,26795,PT8M35S
16,OvamWlE_UMk,CNN,'Desperation': Ex-intelligence chief on Putin's decision,2022-03-05T22:41:09Z,25,"Former Director of National Intelligence James Clapper reacts to indications that Russia is poised to deploy up to 1,000 more mercenaries to Ukraine. #CNN #News",2906826,22997,,9684,PT5M50S
17,FccXlTghw_U,CNN,'Stop the Steal' organizer says GOP lawmakers helped him with rally,2021-01-13T17:50:50Z,25,"CNN's Drew Griffin reports the rhetoric of some GOP lawmakers are under scrutiny after the organizer of the January 6 rally that led to the siege on the Capitol says he got help from them.
#DrewGriffin #CNN #News",2903059,30578,,10776,PT10M46S
18,_B6tawcCwo0,CNN,Photographer snaps notes of MyPillow CEO after visiting Trump,2021-01-16T02:44:13Z,25,"A Trump ally's notes visible as he visited the West Wing revealed a suggestion to replace the current CIA director with the current acting chief of staff at the Pentagon.

#CNN #News",2791766,35495,,15948,PT9M27S
19,U46Kii49TsQ,CNN,US officials say this 'revealing moment' hints at morale problems in Russia's military,2022-03-24T10:50:17Z,25,"A rare face-to-face meeting between Russian and US military officials last week led to an ""outburst"" of emotion from a normally stoic Russian general, a ""revealing moment"" that the Americans present believe hinted at larger morale problems in Russia's military, according to a closely held US military readout of what transpired. CNN's Barbara Starr reports. #CNN #News",2623946,21850,,4047,PT5M44S
20,xidO3Mtu4BA,CNN,Trump lashes out at Fox News after report on Arizona's recount,2021-07-18T20:07:14Z,25,"Former President Donald Trump lashed out at Fox News in a written statement after the network reported that an Associate Press investigation found only 182 potentially fraudulent ballots out of 3 million votes cast in Arizona during the 2020 presidential election. Former Fox News political editor Chris Stirewalt shares what has surprised him the most about the reaction from Republicans and Trump supporters that Fox News called Arizona for President Joe Biden.
#JimAcosta #Newsroom #CNN",2571384,33101,,17446,PT9M6S
21,hQO9upB7kx8,CNN,CNN reporter shows Trump supporter her debunked Facebook posts. See her reaction,2021-09-10T00:48:12Z,25,"Mary Quintanilla, a Facebook user with over 3,000 friends, says she's been in ""Facebook jail"" over a dozen times. Despite the temporary restrictions, Quintanilla continues to share and post misinformation. CNN's Donie O'Sullivan sits down with Quintanilla and the two go through her Facebook feed together.

===
Nearly 80% of Americans have been exposed to Covid misinfo, and many don't know what to believe, survey says
By Brian Stelter and Virginia Langmaid, CNN Business

New York (CNN Business)The information landscape about Covid-19 is bewildering, with factual and fictional claims competing for attention. And most American adults have heard at least a couple of the fictions, according to new data from the Kaiser Family Foundation.

Kaiser, which is widely respected for its top-notch work on this subject, tested eight false statements about Covid. Nearly 80% of Americans surveyed said they had heard of at least one of the falsehoods and either believed it or are unsure whether it is true.

""Most commonly,"" the report's authors wrote, ""six in ten adults have heard that the government is exaggerating the number of Covid-19 deaths by counting deaths due to other factors as coronavirus deaths and either believe this to be true (38%) or aren't sure if it's true or false (22%).""

One-third of respondents ""believe or are unsure whether deaths due to the Covid-19 vaccine are being intentionally hidden by the government (35%),"" the authors wrote, ""and about three in ten each believe or are unsure whether Covid-19 vaccines have been shown to cause infertility (31%) or whether Ivermectin is a safe and effective treatment for COVID-19 (28%).""

The researchers also found that ""between a fifth and a quarter of the public believe or are unsure whether the vaccines can give you COVID-19 (25%), contain a microchip (24%), or can change your DNA (21%).""

Read more at: https://www.cnn.com/2021/11/09/media/kaiser-covid-misinformation/index.html

===
Bill Gates tells Anderson what surprised him about Covid misinformation
https://www.cnn.com/videos/health/2022/05/14/bill-gates-ac360-intv-covid-vaccine-sots-vpx.cnn",2476471,32282,,18608,PT5M40S
22,azI1vJH--i4,CNN,Farmer who voted for Trump: I'm not going to be quiet,2019-05-15T20:54:26Z,25,"Christopher Gibbs, an Ohio farmer who voted for President Donald Trump, tells CNN's Kate Bolduan he doesn't understand why farmers must make the sacrifices in the trade war with China. #CNN #News",2465479,22494,,10946,PT8M29S
23,sTVW-zKeXjc,CNN,Oil baron unleashes vast wealth to fight Putin,2022-05-05T11:17:14Z,25,"CNN's Nic Robertson speaks to Ukrainian oligarch Dmitry Firtash, a major contributor to the war effort against Russia, who is facing extradition to the US. #CNN #News",2277506,22831,,3795,PT5M4S
24,OQmXcIipr8M,CNN,Two former Trump officials react to Cassidy Hutchinson’s testimony,2022-06-28T20:26:22Z,25,Former Trump administration officials Alyssa Farah Griffin and Olivia Troye react to ex-White House aide Cassidy Hutchinson’s stunning testimony before the House select committee investigating January 6. #CNN #News,2255967,34116,,15322,PT9M30S
25,bm_BUaISFsc,CNN,Top US general: What's at stake is greater than Ukraine,2022-04-26T19:05:10Z,25,"General Mark Milley, chairman of the Joint Chiefs of Staff, discusses the stakes of the Russia-Ukraine conflict and the wider global implications with CNN's Jim Sciutto.  

Why Russia's Ukraine aggression matters to Americans
by Zachary B. Wolf

Nobody knows for sure exactly what Vladimir Putin is doing with around 100,000 Russian troops parked near the Russia-Ukraine border, but it's making the US and Europe extremely nervous.

President Joe Biden said this week he expected the Russians would ""move in"" and that a slight incursion would be met differently than a full-on invasion.

The US has spent the past few days cleaning up that remark and making clear any type of invasion is unacceptable.

Asked in Geneva by a reporter if he thought, like Biden, that an invasion was likely, Russian Foreign Minister Sergey Lavrov used some interesting language.

""Unless the United States doesn't go to bed with Ukraine, I don't think so,"" Lavrov said.
What does it mean for countries to 'go to bed'? All of this high-stakes geopolitical chess, then, comes down to how intimate the US gets with Ukraine in the eyes of Russia.

Read more at: https://www.cnn.com/2022/01/22/politics/russia-ukraine-us-what-matters/index.html

An important shift in Ukraine - and the US hopes more weapons will help
https://www.cnn.com/2022/04/20/politics/us-ukraine-weapons-what-matters/index.html

What does Putin want in Ukraine? The conflict explained
https://www.cnn.com/2022/02/24/europe/ukraine-russia-conflict-explainer-2-cmd-intl/index.html",2251049,24258,,9084,PT9M7S
26,QHvHMx0xzPo,CNN,See how US weapons are helping Ukraine's army,2022-03-17T18:02:46Z,25,"After Volodomyr Zelensky's US Congress address, President Joe Biden announced an additional $800 million in in new security aid for Ukraine. CNN's Fred Pleitgen looks as how the Ukrainian army is using US arms to hold up against the Russian invasion. #CNN #News",2181217,19677,,5471,PT2M35S
27,8F45FHLpKtI,CNN,Video shows helicopters attacking fuel depot inside Russia,2022-04-01T11:55:44Z,25,"Russian authorities say a fire broke out at a fuel depot in Belgorod, Russia, after an air strike coming from two helicopters belonging to the Ukrainian Armed forces. CNN is unable to verify this claim. #CNN #News",2166323,24706,,13995,PT5M21S
28,PDTpfSqgDZQ,CNN,Civil war expert reacts to Trump supporter. See her warning for the US,2022-01-26T12:38:42Z,25,"CNN's Donie O'Sullivan examines how lies about the 2020 election could undermine the future of American democracy. 

'I saw it on TV!': Why Trump supporter says she believes election lie
https://www.cnn.com/videos/media/2021/05/10/trump-voter-gaetz-rally-election-conspiracy-big-lie-o-sullivan-lkl-vpx.cnn",2120890,27337,,16085,PT5M11S
29,RKla75GvK6c,CNN,"Academy 'strongly considered' removing Will Smith from Oscars, source says",2022-03-28T19:23:43Z,25,"Academy of Motion Pictures Arts and Sciences leadership ""strongly considered"" removing Will Smith from the Oscars telecast Sunday night after the actor stormed the stage and slapped Chris Rock in the face, a source close to the situation tells CNN. #CNN #News",2112967,17885,,19880,PT4M59S
30,K4MQLLgjeF4,CNN,Ukrainian officials alarmed by discovery of Russian pontoon bridge,2022-05-10T15:31:35Z,25,"Ukrainian officials are raising the alarm about a Russian pontoon bridge in the country's Luhansk region. CNN's Tom Foreman explains the role this bridge could play in future combat.
#CNN #News",2112083,13927,,2213,PT2M41S
31,KQDBVyAOAHg,CNN,Keilar calls out Rubio for attacking Biden's Cabinet over their education,2020-11-25T20:59:20Z,25,"CNN's Brianna Keilar calls out Republicans for ""cynically poking"" at the Ivy League educations of President-elect Biden's Cabinet picks.

#CNN #News",2094644,27292,,9479,PT10M44S
32,HvRtp3N77ws,CNN,'Putin is frustrated': National security adviser on what military base attack reveals,2022-03-13T14:12:35Z,25,"US National Security Adviser Jake Sullivan says the deadly Russian airstrike on a large military base near Lviv, Ukraine, which was only miles from the Polish border, shows that Vladimir Putin is frustrated with his forces' progress.

#CNN #News",2071021,16098,,8363,PT10M52S
33,yVHctkpNu24,CNN,See former Russian colonel's big change after criticizing Putin's war on state TV,2022-05-19T12:10:56Z,25,"Mikhail Khodarenok, a former Russian colonel, criticized Putin's invasion of Ukraine on state TV but backtracked and had a remarkably different tone later. CNN's Matthew Chance reports. #CNN #News",2069082,17898,,4529,PT9M44S
34,fDObf2AeAP4,CNN,75 million Americans ordered to stay home,2020-03-21T01:07:50Z,25,"Connecticut, Illinois and New York joined California on Friday in ordering nonessential workers to remain at home to slow the spread of coronavirus, which means more than 1 in 5 Americans live in a state under general stay-at-home orders.

#CNN #News",2067208,14334,,7546,PT10M15S
35,wuooYaeY-YY,CNN,Keilar calls out Dr. Birx's post-Trump reputation rehab tour,2021-01-25T21:32:31Z,25,"Dr. Deborah Birx, former President Donald Trump's coronavirus task for coordinator, is making the rounds on television revealing the dysfunction in the Trump White House. CNN's Brianna Keilar rolls the tape on some of the times Birx could have spoken out about Trump but did not.
#BriannaKeilar #CNN #News",2062071,32285,,10231,PT10M48S
36,qJO-KM27R1M,CNN,See the question that made ex-Trump attorney leave interview,2021-09-02T04:40:38Z,25,"CNN's Randi Kaye takes a closer look at former Trump attorney Sidney Powell's bizarre interview with Australian TV reporter Sarah Ferguson. 

===
Right-wing lawyer Sidney Powell 'is cooperating' with federal criminal probe into fundraising
By Katelyn Polantz, CNN Reporter, Crime and Justice

A lawyer for Sidney Powell, a well-known, Trump-connected attorney, acknowledged that her organization's fundraising connected to the 2020 election is subject to an ongoing federal criminal investigation.

Powell's lawyer, Howard Kleinhendler, told CNN that his client ""is cooperating"" with the investigation into her organization, Defending the Republic, by the US Attorney's Office in the District of Columbia. That cooperation includes ""rolling productions"" of documents.

The Washington Post first reported details of the probe, including a grand jury subpoena for records related to it, in November.

Powell has not been charged with a crime. The investigation has continued this year, though two sources with knowledge of the probe tell CNN it's unclear when -- if ever -- any charges would be filed.

A spokesman for the DC US Attorney's Office declined to comment on Friday.
Powell's response to the federal investigators and to a major defamation lawsuit from the company Dominion Voting Systems comes into play as she now prepares to respond to the House select committee investigating January 6, which subpoenaed her this week.
Read more at:  https://www.cnn.com/2022/01/21/politics/sidney-powell-federal-criminal-probe-fundraising/index.html",2015647,23664,,12076,PT5M32S
37,90Otn4ybb-0,CNN,Trump says Obama left him an economic mess. Here are the facts,2020-02-18T06:23:24Z,25,"President Donald Trump slammed the economy under former President Barack Obama even though there are a lot of economic indicators that show similar results.
Don Lemon, Daniel Dale, Catherine Rampell and Rob Astorino discuss.

#Trump #CNN #News",1969786,19276,,14020,PT11M1S
38,btnBwUd3Fjw,CNN,"Ukrainian drone destroys two Russian patrol ships, says defense ministry",2022-05-02T13:49:48Z,25,"Two Russian Raptor patrol boats were destroyed near Snake Island by a Ukrainian Bayraktar drone, the Ukrainian Ministry of Defense reported, citing the head of the Armed Forces General. Video of the drone targeting one of the Raptor patrol boats near the island in the Black Sea was included in the MOD post. Moscow is yet to confirm or react to the claim. #CNN #News",1958986,20705,,4582,PT3M56S
39,j4nhZtXq1C4,CNN,How Ukraine is using kamikaze drones to turn the tables on Russia,2022-04-01T12:59:57Z,25,"CNN's Tom Foreman explains how kamikaze drones work, and how Ukrainian soldiers are using them to gain an advantage against Russia. #CNN #News",1940597,17152,,3280,PT4M
40,h3KUVrt3mII,CNN,'Chilling to hear': Tapper reacts to Pompeo's refusal to acknowledge Biden win,2020-11-10T23:13:12Z,25,"CNN's Jake Tapper reacts to Republicans' refusal to acknowledge President-elect Joe Biden's victory.

#CNN #News",1871014,25027,,15147,PT9M43S
41,hI7Wy786ozY,CNN,Parents of Russian sailors want answers after warship sinks,2022-04-20T13:14:38Z,25,"The Pentagon says it is unknown how many of the estimated 500 crew members on the Russian cruiser Moskva actually survived. The ship sunk after Ukraine struck it with two missiles, according to the US. This comes as the father of one Russian sailor aboard the Moskva is demanding answers about his son. CNN's Alex Marquardt has more. 

Russia invades Ukraine: Live Updates
https://www.cnn.com/europe/live-news/ukraine-russia-putin-news-04-21-22/index.html

Russian warship sinks in the Black Sea after Ukraine claims it was hit by a missile
By Brad Lendon, CNN

(CNN) One of the Russian Navy's most important warships has sunk in the Black Sea, a massive blow to a military struggling against Ukrainian resistance 50 days into Vladimir Putin's invasion of his neighbor.

Russian state news agency TASS reported Thursday evening that the guided-missile cruiser Moskva had sunk, citing a statement from the Russian Ministry of Defense.
""During the towing of the cruiser Moskva to the port of destination, the ship lost its stability due to hull damage received during a fire from the detonation of ammunition. In the conditions of stormy seas, the ship sank,"" the statement said, according to TASS.
Conflicting accounts have emerged about the incident.

Read more at: https://edition.cnn.com/2022/04/14/europe/russia-navy-cruiser-moskva-fire-abandoned-intl-hnk-ml/index.html",1817432,17122,,5040,PT2M37S
42,dgcj-4l_1C4,CNN,See Ted Cruz’s big flip on Jan. 6 after McConnell’s remark,2022-02-10T15:00:01Z,25,"Sen. Mitch McConnell (R-KY) called Jan. 6 a violent insurrection, but other lawmakers in his party are breaking with McConnell including Sen. Ted Cruz (R-TX). #CNN #News",1789330,20209,,8733,PT10M58S
