,Video Id,channelTitle,title,publishedAt,categoryId,description,viewCount,likeCount,favouriteCount,commentCount,duration
27,3aWHb8Mg1xg,DW News,Kyiv region: Are Russian troops retreating or preparing for another attack? | Ukraine latest,2022-04-03T15:45:01Z,25,"- Warning! This report contains images some may find disturbing. - 

Ukrainian forces say Russian troops have either withdrawn or been repelled from the entire region around Kyiv. But soldiers moving into villages and towns around the capital find scores of dead civilians. 

The defence ministry says its forces have retaken more than 30 towns and villages. For weeks, battles north of the capital region kept Russian forces from advancing. But now, some of the true cost of that resistance is becoming clear, as Ukrainian soldiers and members of the Red Cross enter these locations. 

Subscribe: https://www.youtube.com/user/deutschewelleenglish?sub_confirmation=1

For more news go to: http://www.dw.com/en/
Follow DW on social media:
►Facebook: https://www.facebook.com/deutschewellenews/
►Twitter: https://twitter.com/dwnews
►Instagram: https://www.instagram.com/dwnews
Für Videos in deutscher Sprache besuchen Sie: https://www.youtube.com/dwdeutsch
#Russia #WarInUkraine #Kyiv",1876632,12638,,3513,PT15M45S
28,1pgmvIB3Fjw,DW News,3 Months into Russia's war against Ukraine: What to expect for the upcoming battles? | DW News,2022-05-24T08:12:43Z,25,"Russia's invasion of Ukraine has surprised many military analysts - who expected fighting to be over very quickly. Instead, the three-month-old war has exposed unexpected weaknesses in Russia's forces. Heavy troop losses are reporttedly hurting morale even more, and the war's initial aims have been severely scaled back. So  just how - and why - has Russia's army performed so badly?

UK officials see Russia closing in on Luhansk
""Russia has increased the intensity of its operations in the Donbas as it seeks to encircle Severodonetsk, Lyschansk, and Rubizhne,"" the UK Ministry of Defense tweeted in In its latest intelligence update. At the same time, UK officials noted ""strong Ukrainian resistance with forces occupying well dug-in defensive positions."" ""Russia’s capture of the Severodonetsk pocket would see the whole of Luhansk Oblast placed under Russian occupation,"" they said. At the same time moving the frontline further west ""will extend Russian lines of communication and likely see its forces face further logistic resupply difficulties,"" according to the British ministry. Ex-Russian diplomat describes atmosphere in Russian Foreign Ministry Boris Bondarev, who until Monday was listed as the Counsellor to the UN at Russia's mission in Geneva, warned that his Russian colleagues were growing nonchalant when considering nuclear weapons' use. ""They think that if you hit some village in America with a nuclear strike, then the Americans will immediately get scared and run to beg for mercy on their knees,"" Bondarev told the The New York Times. ""That’s how many of our people think, and I fear that this is the line that they are passing along to Moscow,"" he added. Bondarev's job in Switzerland was focused mainly on arms control and disarmament issues.

Zaporizhzhia region to use the ruble, says Russian-backed Melitopol leader
The Russian-backed head of the military-civilian administration of occupied Melitopol, Galina Danilchenko, said that rubles will be the accepted in the Zaporizhzhia region, according to an interview cited by Russian state-run RIA news agency. Danilchenko noted that residents would be expected to exchange Ukrainian hryvnias for Russian currency. ""You can pay with rubles for all the services of enterprises, purchase raw materials for the production of your own products, ship products to the buyer and receive ruble proceeds to your current account,"" she said.

Subscribe: https://www.youtube.com/user/deutschewelleenglish?sub_confirmation=1

For more news go to: http://www.dw.com/en/
Follow DW on social media:
►Facebook: https://www.facebook.com/deutschewellenews/
►Twitter: https://twitter.com/dwnews
►Instagram: https://www.instagram.com/dwnews
Für Videos in deutscher Sprache besuchen Sie: https://www.youtube.com/dwdeutsch
#Ukraine #Russia #UkraineWar",1818242,16898,,3904,PT14M46S
29,Wc5tBB6Jgz4,DW News,"Russia attacks military base in western Ukraine, reportedly killing 35, injuring 134  | DW News",2022-03-13T12:55:26Z,25,"An area outside the major western Ukrainian city of Lviv was targeted by a missile attack early Sunday. Eight missiles are believed to have been fired at Ukraine's Center for International Peacekeeping and Security, according to Lviv's Regional Military Administration on Telegram. The center is located in Yavoriv, not far from the Polish border and some 40 kilometers (25 miles) northwest of Lviv. Lviv regional governor Maksym Kozytskyy said on Telegram that 35 people have died in the strike and a further 134 were injured. The strike on the military base could possibly be a Russian message intended for NATO. The US and other NATO countries previously conducted training exercises with the Ukrainian military at the center called Rapid Trident 21, according to the US Army website. A Ukrainian general cited by the US army website said the Rapid Trident 21 exercises held at the Yavoriv center were ""not just another stage of military skills improvement, but also an important step towards Ukraine's European integration."" Ukraine's defense minister said in a tweet that ""foreign instructors"" work at the training center. A NATO official told Reuters news agency that there were no alliance personnel at the base. The mayor of Ivano-Frankivsk, Ruslan Martsinkiv, said on Facebook that the western Ukrainian city's airport was also targeted in an attack early Sunday. 

A Russian airstrike in the southern city of Mykolaiv near Odesa left nine people dead, according to regional governor Vitaliy Kim. Mykolaiv serves as an important transportation hub within Ukraine.

The mayor of Dniprodrudne, Yevheniy Matvieyev, was kidnapped by Russian forces, according to Ukrainian officials such as Foreign Minister Dmytro Kuleba. Dniprorudne has around 20,000 inhabitants. Earlier, Russian troops kidnapped Melitopol Ivan Federov on Friday, Ukraine's parliament said.  

The UK's Defense Ministry (MOD) said Russian forces are attempting to ""envelop"" Ukrainian troops in the eastern parts of the country ""as they advance from Kharkiv in the north and Mariupol in the south."" 

Subscribe: https://www.youtube.com/user/deutschewelleenglish?sub_confirmation=1

For more news go to: http://www.dw.com/en/
Follow DW on social media:
►Facebook: https://www.facebook.com/deutschewellenews/
►Twitter: https://twitter.com/dwnews
►Instagram: https://www.instagram.com/dwnews
Für Videos in deutscher Sprache besuchen Sie: https://www.youtube.com/dwdeutsch

#Ukraine #Russia #UkraineWar",1785929,11355,,3674,PT21M16S
30,qmt94B5eQwg,DW News,Russian forces close in on Ukraine major cities | DW News,2022-02-25T08:11:57Z,25,"Ukrainian forces battled Russian troops on multiple fronts, including the outskirts of Kyiv.

Ukraine's border guard has said that males aged 18-60 are not allowed to leave the country in a statement posted on its Facebook account. The border guard said that this restriction will last for the duration of the period of martial law in Ukraine. Ukrainian President Volodymyr Zelenskyy declared martial law earlier on Thursday shortly after it was reported that Russia had attacked Ukraine.

Ukrainian Deputy Defense Minister Hanna Malyar has warned that Russian forces are poised to enter areas just outside the capital, Kyiv, on Friday. A government adviser, Anton Herashchenko, said the Russian troops planned to break through into the capital using tanks but that Ukrainian forces were ready to counter the attack with anti-tank missiles supplied by foreign allies.
Ukrainian President Volodymyr Zelenskyy had earlier said the government had information that ""subversive groups"" were moving on the city. This comes after a night of reported air raids in the city that were said by a DW correspondent to have set some residential buildings on fire. Many Kyiv residents have taken shelter in underground metro stations.

The Ukrainian general staff of the armed forces said Ukrainian troops were firmly resisting what he called ""Russian occupiers"" in the Kyiv area. Ukrainian airborne assault troops were reported in a statement to have stopped ""overwhelming enemy forces"" at the Teteriv River near the settlements of Dymer and Ivankiv, northwest of the capital. The statement said a bridge over the river was destroyed. ""The hardest day will be today. The enemy's plan is to break through with tank columns from the side of Ivankiv and Chernihiv to Kyiv,'' Interior Ministry adviser Anton Gerashchenko said on Telegram.

Subscribe: https://www.youtube.com/user/deutschewelleenglish?sub_confirmation=1

For more news go to: http://www.dw.com/en/
Follow DW on social media:
►Facebook: https://www.facebook.com/deutschewellenews/
►Twitter: https://twitter.com/dwnews
►Instagram: https://www.instagram.com/dwnews
Für Videos in deutscher Sprache besuchen Sie: https://www.youtube.com/dwdeutsch
#UkraineInvasion #Russia #Kyiv",1769303,11159,,4344,PT25M43S
31,f-KQftYx7sc,DW News,Russia attacks Ukraine: Latest developments | DW News,2022-02-24T13:40:34Z,25,"Russia launched a wide-ranging attack on Ukraine on Thursday, with explosions heard across the country and Russian tanks entering Ukrainian territories. Here's a look at the most significant developments from today and how the situation unfolded: 

In an unscheduled television address on Thursday, Russian President Vladimir Putin announced that he ""decided to conduct a special military operation."" Putin claimed the ""operation"" was to ""protect people who have been subjected to bullying and genocide ... for the last eight years,"" or since 2014, when Russia annexed Ukraine's Crimea. Moscow-backed separatists have fought the government's forces in eastern Ukraine ever since. 

The Russian government claimed hours earlier that separatist leaders had requested military help to fend off what they called Ukrainian ""aggression."" Putin said, ""We will strive for the demilitarization and denazification of Ukraine."" At an emergency UN Security Council meeting, Russia's envoy Vassily Nebenzia said the ""operation"" was targeting ""the junta"" in power in Kyiv. Ukrainian President Volodymyr Zelenskyy was elected to office in an election in 2019.

Air raid sirens sounded over the Ukrainian capital at the break of dawn.  The Ukrainian leadership said at least 40 soldiers had been killed so far by Russian airstrikes. Zelenskyy declared martial law and said Russia was attacking his country's ""military infrastructure."" Ukrainian Foreign Minister Dmytro Kuleba said, ""Putin has just launched a full-scale invasion of Ukraine. Peaceful Ukrainian cities are under strikes."" ""This is a war of aggression. Ukraine will defend itself and will win. The world can and must stop Putin. The time to act is now,"" he added. Ukraine's border guard reported that Russian tanks entered Ukraine in the Luhansk region and Crimea. Russia's Defense Ministry said it had neutralized Ukrainian military airbases and air defense systems.

#Russia #Ukraine #Invasion",1736665,12586,,4918,PT21M17S
32,JROVTwriXns,DW News,Ukraine-Russia talks end with no breakthrough | DW News,2022-02-28T21:49:54Z,25,"Russia and Ukraine broke off peace talks Monday on the Ukrainian-Belarusian border, according to both delegations. A follow-on round will take place in the coming days. Both delegations will return to their respective capitals for further consultations. 

Meanwhile the United Nations’ General Assembly met Monday for the first emergency session in decades. Nebenzya, Russia's ambassador to the UN, told the General Assembly that ""for us, Ukraine joining NATO is a red line."" Nebenzya laid the blame for the Russian invasion on Ukraine, saying that Kyiv had failed to stick to the Minsk agreement as well as claiming that Ukrainian forces carried out provocations against people in the regions of Donetsk and Luhansk where Russian-backed separatists have been fighting Ukrainian forces since 2014. Nebenzya also accused Ukraine's western partners, especially the US, of ""inciting Kyiv, egging it on, repeating the senseless mantra that their obligations to the Minsk agreements are not being complied with by the Russian Federation.""

Sergiy Kyslytsya, Ukraine's ambassador to the UN, warned the members of UN General Assembly of the consequences of Russia's invasion.
""Russia uses all its military potential to attack Ukraine and has begun redeploying reserve units on the border,"" he said. He also accused the Russian force of attacking civilian infrastructure as well as kindergartens and hospitals, which he called war crimes. 

Subscribe: https://www.youtube.com/user/deutschewelleenglish?sub_confirmation=1

For more news go to: http://www.dw.com/en/
Follow DW on social media:
►Facebook: https://www.facebook.com/deutschewellenews/
►Twitter: https://twitter.com/dwnews
►Instagram: https://www.instagram.com/dwnews
Für Videos in deutscher Sprache besuchen Sie: https://www.youtube.com/dwdeutsch

#Russia #Ukraine #Putin",1684560,10757,,3335,PT24M17S
33,sOUKc7KgJiU,DW News,"Ukraine forces push Russians out of Kharkiv as NATO, G7 hold talks on war | Ukraine Update",2022-05-14T10:05:17Z,25,"Russia's war on Ukraine is in the spotlight at high-level diplomatic talks in Germany. Foreign ministers from NATO countries are meeting over their long-term strategy. Ministers from Finland and Sweden are expected to meet their Turkish counterpart there, after Turkish President Recep Tayyip Erdogan indicated he may resist their bid to join the military alliance.
Meanwhile foreign ministers from Group of Seven nations are continuing their talks. They've pledged to support Ukraine ""until victory."" The spotlight there has been on food security concerns, with global supplies from Ukraine hit by Russian blockades.
German Foreign Minister Annalena Baerbock, who is hosting the G-7 meeting, said Russia was waging a ""food war"" on the world.
Ukrainian forces appear close to claiming victory over Russia's attempt to take the second largest city, Kharkiv. Western military analysts said Russian troops were withdrawing from areas around the city due to limited reinforcements and Ukrainian counterattacks. Despite the latest gains, President Volodomyr Zelenskyy used his nightly address to warn of a long war ahead. He said more than 1,000 settlements had now been deoccupied.
A Russian soldier has gone on trial in Kyiv, accused of committing war crimes during the first weeks of the invasion of Ukraine. The 21-year old is alleged to have shot an unarmed civilian in a car. It's the first trial of its kind, with Ukrainian prosecutors preparing cases against at least forty other soldiers and investigating thousands more possible war crimes.
Ukrainian and British officials say Russian forces have suffered heavy losses trying to cross a river in the Luhansk region of eastern Ukraine. Kyiv has released video it says shows the aftermath of a strike on a Russian pontoon bridge. Britain's defense ministry said Russia lost what it described as ""significant armored maneuver elements"" in the attack earlier this week.
Sweden's foreign minister says her country's accession to NATO would prevent conflicts in northern Europe. Ann Linde was presenting a parliamentary report on security as Sweden considers applying to join the alliance, in the face of Russia's invasion of Ukraine.


Subscribe: https://www.youtube.com/user/deutschewelleenglish?sub_confirmation=1

For more news go to: http://www.dw.com/en/
Follow DW on social media:
►Facebook: https://www.facebook.com/deutschewellenews/
►Twitter: https://twitter.com/dwnews 

►Instagram: https://www.instagram.com/dwnews
Für Videos in deutscher Sprache besuchen Sie: https://www.youtube.com/dwdeutsch


#Ukraine #Russia #NATO",1669357,10892,,4734,PT13M39S
34,0X3pKVOFqZc,DW News,Is Germany blocking Ukraine from defending itself against Russia? | DW News,2022-01-23T10:23:58Z,25,"The first shipment of additional US military aid has arrived in Ukraine, according to the US Embassy there. This is part of a package worth $200 million, promised to Kiev last week by US Secretary of State Antony Blinken. The initial delivery includes defensive weapons and ammunition as the country prepares for possible Russian aggression. Such a form of deterrence is not endorsed by Germany, which has refused to supply weapons to Ukraine. The Ukrainian Foreign Minister Dmytro Kuleba says he's disappointed in Germany.
Moscow has deployed some 100,000 troops along its border with Ukraine, but insists it has no plans to launch an attack.


Subscribe: https://www.youtube.com/user/deutschewelleenglish?sub_confirmation=1

For more news go to: http://www.dw.com/en/
Follow DW on social media:
►Facebook: https://www.facebook.com/deutschewellenews/
►Twitter: https://twitter.com/dwnews
►Instagram: https://www.instagram.com/dwnews
Für Videos in deutscher Sprache besuchen Sie: https://www.youtube.com/dwdeutsch


#Ukraine #Russia #Germany",1646279,15086,,8980,PT10M24S
35,zjWaXog1xDU,DW News,Ukraine says it repelled Russian forces at battle in Kyiv suburbs | Ukraine latest,2022-03-22T08:26:48Z,25,"Ukraine claims it has retaken strategically important Kyiv suburb. The Ukrainian military said its troops have driven Russian forces out of Makariv, a town about 60 kilometers (37 miles) west of Kyiv. 
The strategically important town was the scene of a fierce battle and has sustained significant damage from Russian shelling, the Ukrainian Defense Ministry said, adding its recapture prevents Russian forces from encircling the capital from the northwest. The ""state flag of Ukraine was raised over the city of Makariv"" as the Russians retreated, the ministry wrote in a post on Facebook. DW could not confirm the claim by the Ukraine forces.

President Volodymyr Zelensky said Ukraine was willing to consider dropping its demands for full NATO membership in exchange for security guarantees. ""It's a compromise for everyone: for the West, which doesn't know what to do with us with regard to NATO, for Ukraine, which wants security guarantees, and for Russia, which doesn't want further NATO expansion,"" Zelenskyy said late Monday in an interview with Ukrainian television channels. Ukraine is well aware it cannot be admitted to NATO at the moment because they ""do not want to fight with Russia,"" Zelenskyy said, adding, ""Okay, what other security guarantees are possible?"" Zelenskyy was adamant that he needed to talk to Russian President Vladimir Putinin order to understand whether Russia even intends to stop the war. Putin has so far ignored Zelenskyy repeated requests for direct talks. On Monday, Zelenskyy said again that he is ready to meet Putin ""in any format"" but would also not bow to ultimatums from Russia to surrender. The president also suggested that after a cease-fire agreement, Kyiv would be ready to discuss the status of Crimea and the eastern Donbas region held by Russian-backed separatists. However, Zelenskyy said he plans to put any agreements reached with Russia to a nationwide referendum for public approval.

Russia's Foreign Ministry says it has withdrawn from peace treaty negotiations with Japan, as a result of  sanctions imposed by Tokyo over the invasion of Ukraine. ""Under the current conditions Russia does not intend to continue negotiations with Japan on a peace treaty,"" the foreign ministry said and cited Japan's ""openly unfriendly positions and attempts to damage the interests of our country."" Last week Japan announced plans to revoke Moscow's trade status and expand freezing of assets against Russian individuals. Russia and Japan have not officially ended World War II hostilities due to a dispute over islands north of Hokkaido. And Japanese Prime Minister Fumio Kishida hit back at Russia's decision to withdraw from the peace treaty. ""The latest situation occurred as a result of Russia's aggression against Ukraine, and Russia's attempt to shift the issue to Japan-Russia relations is extremely unjustified and absolutely unacceptable,"" he said in parliament. Japan ""strongly protests,"" he added, condemning Russia for its actions to ""unilaterally change the status quo by force.""

Ukrainian President Volodymyr Zelenskyy said again that he is ready to meet Russian leader Vladimir Putin ""in any format"" but would also not bow to ultimatums from Russia to surrender. Russian publication Komsomolskaya Pravda briefly published a casualty figure of nearly 10,000 deaths of Russian soldiers since the invasion of Ukraine on February 24 began, but then deleted it. US President Joe Biden says Vladimir Putin is considering the use of biological and chemical weapons as a false flag attack, based on US intelligence assessments. The Pentagon has accused Russian forces of committing war crimes in Ukraine and said it would help gather evidence of them. The European Union's foreign policy chief Josep Borrell said on Monday that Russia's attacks on the Ukrainian coastal city of Mariupol amount to a ""war crime."" German Christian Democratic Union (CDU) lawmaker Michael Brand called for sanctions against former Chancellor Gerhard Schröder over his strong links with Russia. Humanitarian organization Save the Children said upwards of 6 million children are in imminent danger as a growing number of hospitals and schools come under attack during Russia's ongoing invasion of Ukraine. A Moscow court ruled in favor of Russia's FSB intelligence services on Monday, agreeing to label the US internet giant Meta (formerly Facebook) an ""extremist organization.""

Subscribe: https://www.youtube.com/user/deutschewelleenglish?sub_confirmation=1

For more news go to: http://www.dw.com/en/
Follow DW on social media:
►Facebook: https://www.facebook.com/deutschewellenews/
►Twitter: https://twitter.com/dwnews
►Instagram: https://www.instagram.com/dwnews
Für Videos in deutscher Sprache besuchen Sie: https://www.youtube.com/dwdeutsch
#Ukraine #Russia #Kyiv",1606263,12074,,2815,PT24M32S
36,QrBP3sydgXg,DW News,Russian forces take control over Europe's largest nuclear power plant | DW News,2022-03-04T07:55:48Z,25,"Russian forces have entered the site of Europe's largest nuclear power plant after a fire broke out there during Russian shelling. Ukrainian authorities say no radiation leaks have been detected.

Ukrainian authorities say Russian forces have taken control of the Zaporizhzhia nuclear power plant in the countries southeast. A fire broke out at one of the reactors at the site after Russian shelling overnight. ""Operational personnel are monitoring the condition of power units,"" the regional authority said on social media. It added that it sought to ensure the operations were in line with safety requirements.

Russian authorities have moved to restrict access to a number of international media websites, including that of Deutsche Welle, that they accuse of providing false information about Russia's attack on Ukraine. Websites of the BBC, the independent news website Meduza and the Russian-language website of the US-funded Radio Free Europe/Radio Liberty, Svoboda, were also ""limited"" following a request from prosecutors, according to Russian media watchdog Roskomnadzor. Deutsche Welle has been able to confirm that access to its website from Russia has been blocked since early Friday morning, and that its services can be used only by employing a VPN or circumvention tool.

The Ukrainian Embassy in Berlin has requested the German government provide Kyiv with tanks and warships to face down a Russian invasion. Additional items on Ukraine's list of requests include infantry fighting vehicles, artillery systems, such as self-propelled howitzers, air defense systems, combat and support helicopters, reconnaissance and combat drones and transport aircraft. Ukraine's formal request to the Chancellery, the Foreign Ministry and Defense Ministry read in part, ""In view of the extremely tense security situation because of the ongoing Russian aggression, the Ukrainian government is seeking that this request be processed and favorably reviewed as quickly as possible."" The note adds Putin started a ""war of annihilation"" against Ukraine. Berlin reversed its defense and Russia policy of many decades seemingly overnight following Russia's invasion of Ukraine. Germany has already provided 1,000 anti-tank weapons and 500 Stinger surface-to-air missiles after initially promising just 5,000 helmets.

Subscribe: https://www.youtube.com/user/deutschewelleenglish?sub_confirmation=1

For more news go to: http://www.dw.com/en/
Follow DW on social media:
►Facebook: https://www.facebook.com/deutschewellenews/
►Twitter: https://twitter.com/dwnews
►Instagram: https://www.instagram.com/dwnews
Für Videos in deutscher Sprache besuchen Sie: https://www.youtube.com/dwdeutsch
#Russia #Ukraine #UkraineInvasion",1601761,10657,,3387,PT40M22S
