,title,episodes,status,theme,demographic,genres,type,favorites,popularity,rank,score,members,synopsis,aired,duration,premiered,studios
71,Nat-chan no Akai Tebukuro,1,Finished Airing,Historical,Kids,Unknown,Movie,0,#18277,#18572,N/A,242,"Based on a book by Nishino Ayako.

A story about the atomic bomb dropping on Hiroshima. Elementary schooler Nat-chan moved to Hiroshima and was knitting red gloves her male friend Shun-chan. The bomb hits and she dies. Shun-chan now an adult reunites with Nat-chan's remains via her shadow (nuclear shadow that is, where her body vaporized leaving an outline).","Jun 6, 1987",18 min.,Unknown,"None found, add some"
72,Natsu wo Yarinaosu,1,Finished Airing,School,Unknown,Unknown,Movie,2,#11876,#18573,N/A,"1,320","Under the scorching summer sun, the chirping of cicadas can be heard at a school building. A young girl is crouching down with her back turned to you. The girl notices you there, stands up, and starts talking to you. ""Ever since that summer, I've been waiting for you..."" The truth about ""that summer"" slowly becomes clear as she speaks. The person I wanted to see was the person I must not see... An original short work created for VR. The theme song, ""Having Summer Again,"" is by the three-piece band Kerakera (Universal Music Japan), which is quickly gaining popularity.

(Source: Official Site)","Jul 2, 2018",5 min.,Unknown,"None found, add some"
73,Naughty Nuts,26,Finished Airing,Anthropomorphic,Unknown,"Comedy,",TV,0,#22443,#18574,N/A,57,No synopsis information has been added to this title. Help improve our database by adding a synopsis here.,"Feb 28, 2017 to May 23, 2017",11 min. per ep.,Winter 2017,"None found, add some"
74,Naze Ikiru: Rennyo Shounin to Yoshizaki Enjou,1,Finished Airing,Historical,Unknown,Unknown,Movie,0,#12782,#18575,N/A,977,"Ryouken, a young man who hates temples and monks, laments his misfortunes but finds hope in his soon-to-be-born child. An unfortunate accident took everything from Ryouken. In the days of self-abandonment and suffering in darkness, Ryouken finds the teachings of the high priest Rennyo. In it, he finds answers to the question ""Why live"" as explained by the sage Shinran. As he is drawn into the teachings and no longer hesitates, Ryouken becomes Rennyo's apprentice. The number of worshippers increase, but the Honganji temple becomes a target of the other sects, forcing Ryouken and Rennyo to flee from Kyoto. In order to find a new place to teach, they arrive in Yoshizaki (now in Fukui Prefecture) in the Hokuriku region.","May 21, 2016",1 hr. 26 min.,Unknown,Studio Deen
75,Naze Nani!? Asterisk,8,Finished Airing,Unknown,Unknown,"Fantasy,",ONA,0,#18463,#18576,N/A,232,No synopsis information has been added to this title. Help improve our database by adding a synopsis here.,"Jan 15, 2016 to Mar 4, 2016",1 min. per ep.,Unknown,"None found, add some"
76,Nazotoki-hime wa Meitantei♥,6,Finished Airing,Unknown,Shoujo,"Mystery,",OVA,0,#14107,#18577,N/A,647,"The story centers around Hinami, a bookish, eyeglasses-wearing girl, and her two friends. When there is a mystery to solve, she transforms into the clever Nazotoki-hime (literally, Princess Mystery Time). 

(Source: ANN) ","Aug 3, 2012 to Dec 27, 2013",12 min. per ep.,Unknown,SynergySP
77,"Nee, Koko ni Iru.",1,Finished Airing,Unknown,Unknown,"rde,",Movie,0,#24090,#18578,N/A,40,An experimental film by Takahiro Shibata.,2016,9 min.,Unknown,"None found, add some"
78,Negibouzu no Asatarou,48,Finished Airing,Historical,Unknown,"Adventure,Comedy,",TV,0,#15527,#18579,N/A,446,Based on a picture book about a onion-headed samurai named Asatarou.,"Oct 12, 2008 to Sep 27, 2009",20 min. per ep.,Fall 2008,Toei Animation
79,Nekketsu Jinmen Inu: Life Is Movie,3,Finished Airing,Parody,Unknown,"Comedy,Mystery,",OVA,4,#13570,#18580,N/A,774,"The ""Life Is Movie"" featuring indie animator Junichi Yamamoto and Flash animator Tokumaru Naoko reintroducing the Hidenori Takahashi voiced passionate human-faced dog NEET/would be detective will be released as OVA and online on the Bandai Channel later this summer.

(Sourced: Crunchyroll)","Jul 11, 2014 to Sep 26, 2014",16 min. per ep.,Unknown,"None found, add some"
80,Neko Enikki,13,Finished Airing,Pets,Unknown,"Comedy,fe,",TV,0,#15695,#18581,N/A,432,"The autobiographical manga utilizes both drawings and photos of cats to chronicle the life of a woman who lives by herself in order to live with her cats. She is described as a ""himono-onna,"" a Japanese slang word that means ""a woman who is proper in public but lazy at home.""

(Source: ANN)","Aug 2, 2015 to Sep 24, 2015",Unknown,Summer 2015,Kachidoki Studio
81,Neko Jockey,4,Finished Airing,Unknown,Kids,"Comedy,",TV,0,#18017,#18582,N/A,257,No synopsis information has been added to this title. Help improve our database by adding a synopsis here.,"May 6, 2021 to May 27, 2021",2 min. per ep.,Spring 2021,DLE
82,Neko Jockey 2nd Season,4,Finished Airing,Unknown,Kids,"Comedy,",TV,2,#18638,#18583,N/A,220,Second season of Neko Jockey.,"Nov 4, 2021 to Nov 25, 2021",2 min. per ep.,Fall 2021,DLE
83,Neko Kikaku,1,Finished Airing,Unknown,Unknown,"Comedy,",Movie,0,#17307,#18584,N/A,303,"The ""hyper black comedy"" anime takes place in Nyagoya City, a trendy town where cats live. In this peaceful town, many of the cats are suddenly disappearing. The NEET cat Takumi must save his father, who is wrapped up in the incident. The anime will feature the characters speaking in Nagoya dialect, and will feature famous sightseeing spots such as Nagoya Castle. 

(Source: ANN)","Nov 30, 2018",37 min.,Unknown,"None found, add some"
84,Neko Konogoro,50,Finished Airing,Unknown,Unknown,"Comedy,",TV,1,#12016,#18585,N/A,"1,252",Based on the characters created by Study.,"Jun 8, 2016 to Oct 5, 2016",1 min. per ep.,Summer 2016,Kachidoki Studio
85,Neko Neko Gong Show,6,Finished Airing,Unknown,Kids,Unknown,ONA,0,#18789,#18586,N/A,210,"A collaboration between Kihara Yousuke and studio dwarf. Kihara is most famous for being the head artist for the PS2/GameCube game Ribbit King and the anime Nikoniko♪Connie-chan. Neko Neko Gong Show is a talent show for cats, where if their skits are bad, get a gong (made from a cat food tin can lid) hit to boot them off.","Aug 13, 2015 to Nov 16, 2015",1 min. per ep.,Unknown,dwarf
86,Neko Neko Nihonshi 4th Season,32,Finished Airing,Unknown,Kids,Unknown,TV,0,#15567,#18587,N/A,444,Fourth season of Neko Neko Nihonshi.,"Apr 3, 2019 to Feb 26, 2020",9 min. per ep.,Spring 2019,"None found, add some"
87,Neko Neko Nihonshi 5th Season,32,Finished Airing,Unknown,Kids,Unknown,TV,0,#16001,#18588,N/A,401,Fifth season of Neko Neko Nihonshi.,"Apr 8, 2020 to Mar 3, 2021",9 min. per ep.,Spring 2020,"None found, add some"
88,Neko Neko Nihonshi Movie: Ryouma no Hachamecha Time Travel ze yo!,1,Finished Airing,Unknown,Kids,Unknown,Movie,0,#16419,#18589,N/A,368,No synopsis information has been added to this title. Help improve our database by adding a synopsis here.,"Feb 22, 2020",2 hr.,Unknown,"None found, add some"
89,Neko no Dayan,52,Finished Airing,Anthropomorphic,Kids,"Fantasy,",TV,0,#14046,#18590,N/A,663,"Dayan the cat came to Wachi Field from the Earth through Snow magic.  Wachi Field was originally part of the Earth, but separated by Snow God because of the War between Gods and Titans, which destroyed the land.  After the war, the Earth's time flow faster than Wachi Field, which the life is slow with animals and fairies and full of mischief.","Apr 26, 2014 to Apr 25, 2015",3 min. per ep.,Spring 2014,Kachidoki Studio
90,Neko no Dayan (2017),30,Finished Airing,Unknown,Kids,Unknown,TV,0,#17841,#18591,N/A,267,Fourth season of Dayan the Cat.,"Oct 14, 2017 to May 3, 2018",3 min. per ep.,Fall 2017,"None found, add some"
91,Neko no Dayan: Fushigi Gekijou,30,Finished Airing,Unknown,Kids,Unknown,TV,0,#16489,#18592,N/A,363,"Third season of Dayan the Cat. The shorts will be ""theatrical-style,"" with a curtain opening on the everyday adventures of Dayan and his friends.","Oct 1, 2016 to Apr 20, 2017",3 min. per ep.,Fall 2016,Kachidoki Studio
92,Neko no Dayan: Nihon e Iku,12,Finished Airing,Anthropomorphic,Kids,"Fantasy,",TV,0,#16226,#18593,N/A,384,"Second season of Dayan the Cat. 

The titular character and his friends energetically explore Japan.

(Source: LiveChart) ","Oct 17, 2015 to Jan 9, 2016",3 min. per ep.,Fall 2015,Kachidoki Studio
93,Neko no Kuni no Kenpou,1,Finished Airing,Historical,Unknown,Unknown,OVA,0,#19877,#18594,N/A,148,An educational film about the formation of the Constitution of Japan simplified extremely under the guise of a country of cats meant for a young audience.,Not available,14 min.,Unknown,"None found, add some"
94,Neko no Nyagh: Nya Misérables,25,Finished Airing,Unknown,Kids,Unknown,TV,0,#15055,#18595,N/A,499,"TV adaptation of Cocone Corporation's mobile puzzle game app.

Discover the adventures of the cat painter, Vincent van Meowogh who lives in a mansion in Paris surrounded by his quirky friends. Let's give him a spark of inspiration for his painting by completing puzzle stages, buy back the furniture and restore his home to its former glory!

(Source: ANN)","Apr 3, 2019 to Sep 18, 2019",1 min. per ep.,Spring 2019,"TMS Entertainment,       Jinnis Animation Studios"
95,Neko no Robu,10,Finished Airing,Unknown,Unknown,"Comedy,fe,",TV,0,#11950,#18596,N/A,"1,281","The series stars a cat with a lack of energy who speaks while lying down, yet has a thorough personality.  He thinks various things and has fun watching humans.","May 6, 2017 to Mar 16, 2018",1 min. per ep.,Spring 2017,Kachidoki Studio
96,Neko no Sumu Shima,1,Finished Airing,Unknown,Unknown,"Drama,",Special,0,#15782,#18597,N/A,423,"Neko no Sumu Shima (The island where the cats live) takes place in Tashiro-jima, a place called ""Island of the cats,"" which was severely damaged by the March 11 earthquake and tsunami. This 5-minutes episode follow the story of cats after the disaster.","Mar 18, 2012",5 min.,Unknown,"None found, add some"
97,Neko Pitcher,51,Finished Airing,Unknown,Kids,"Comedy,Sports,",TV,1,#14051,#18598,N/A,662,A story about Cat pitcher Mi-Tarou's actions. It is a 23-koma that serialized in Yomiuri Shimbun Sunday.,"May 3, 2014 to Mar 29, 2016",2 min. per ep.,Spring 2014,"None found, add some"
98,Neko to Mata,88,Finished Airing,Unknown,Unknown,"Supernatural,",TV,0,#14215,#18599,N/A,627,"The series centers around two cats: a younger sister named Neko, and an older brother named Mata. Neko is a nekomata (a mythical two-tailed cat), innocently selfish, and spoiled by her brother. Mata is a neighborhood cat with an eartipped mark as a sign of being neutered. They meet under a streetlight in the city at night to talk.

(Source: ANN)","Apr 21, 2017 to Sep 17, 2020",42 sec. per ep.,Spring 2017,"None found, add some"
99,Neko to Nezumi,1,Finished Airing,Unknown,Unknown,"Comedy,",Movie,1,#15114,#18600,N/A,493,It is most likely a short story about a cat and a mouse.,"Jul 4, 1917",Unknown,Unknown,"None found, add some"
