,title,episodes,status,theme,demographic,genres,type,favorites,popularity,rank,score,members,synopsis,aired,duration,premiered,studios
755,Lockdown,1,Finished Airing,Music,Unknown,Unknown,Music,1,#19659,N/A,N/A,162,"Music video animated by omy for the song Lockdown by PIKASONIC and Tatsunoshin featuring virtual singer NEONA.

(Source: Anilist)","May 25, 2021",3 min.,Unknown,"None found, add some"
756,LOL: Lots of Laugh,1,Finished Airing,Music,Unknown,Unknown,Music,1,#19882,N/A,N/A,147,"LOL: Lots of Laugh is an electropop song sung by Hatsune Miku. In the song, Miku and a stuffed rabbit explore a surreal wonderland with lots of candy. It is heavily implied that Miku has simply lost her sense of reality or has fallen asleep (possibly both) while on her computer late at night.

(Source: Vocaloid Wiki)","Aug 25, 2009",3 min.,Unknown,"None found, add some"
757,Long Wu,1,Not yet aired,Unknown,Unknown,"Fantasy,",Movie,0,#18352,N/A,N/A,239,No synopsis information has been added to this title. Help improve our database by adding a synopsis here.,Not available,Unknown,Unknown,"None found, add some"
758,Losin' My Way,1,Finished Airing,Music,Unknown,"rde,",Music,0,#20744,N/A,N/A,97,Music video for the song Losin' My Way by Captain Funk.,2005,4 min.,Unknown,"None found, add some"
759,Lost My Mind,1,Finished Airing,Music,Unknown,Unknown,Music,0,#22767,N/A,N/A,53,Music video animated by omy for the song Lost My Mind by PIKASONIC featuring singer nakotanmaru.,"Apr 1, 2022",3 min.,Unknown,"None found, add some"
760,Love (2020),1,Finished Airing,Music,Unknown,Unknown,Music,0,#19784,N/A,N/A,154,No synopsis information has been added to this title. Help improve our database by adding a synopsis here.,"Jul 9, 2020",1 min.,Unknown,"None found, add some"
761,Love Live! Nijigasaki Gakuen School Idol Doukoukai Movie,3,Not yet aired,Unknown,Unknown,"fe,",Movie,10,#9400,N/A,N/A,"3,146",A three-part theatrical screening of Love Live! Nijigasaki High School Idol Club.,2024 to ?,Unknown,Unknown,"None found, add some"
762,Love Live! Superstar!! 3rd Season,Unknown,Not yet aired,Unknown,Unknown,"fe,",TV,26,#6844,N/A,N/A,"7,491","Everyone has a dream they strive to achieve, and so does the musically talented Kanon Shibuya. However, due to her stage fright, Kanon fails to make it into Yuigaoka Girls' High School's music program and instead ends up in the general curriculum. Even though Kanon makes the conscious decision to quit music altogether, her classmate Tang Keke rekindles Kanon's passion for music with her own: a passion for school idols.

Although Keke and Kanon try to form a school idol group, their effort meets strong objections from Ren Hazuki, the daughter of the school's director. Even so, the girls soon visit the director, who allows them to set up their school idol club under one condition—they must win first place at the Yoyogi School Idol Festival.

The resilience of these aspiring idols is put to the test as they face the challenges that come their way. Throughout their journey, the girls make new friends and meet new members that join them to become the dazzling idols others can only imagine.

 [Written by MAL Rewrite]",Not available,Unknown,?,Sunrise
763,Love My Friends,1,Finished Airing,Music,Unknown,Unknown,Music,0,#20923,N/A,N/A,89,Music video for the song love my friends by MindaRyn.,"Apr 13, 2021",3 min.,Unknown,"None found, add some"
764,Love: Sayonara wa Iwanai,1,Finished Airing,Music,Unknown,Unknown,Music,0,#19126,N/A,N/A,191,Music video for the song Love: Sayonara wa Iwanai by Marie Ishikawa. The video was animated by Aya Shiroi.,"Jul 27, 2010",5 min.,Unknown,"None found, add some"
765,Lower One's Eyes,1,Finished Airing,Music,Unknown,Unknown,Music,1,#20767,N/A,N/A,96,No synopsis information has been added to this title. Help improve our database by adding a synopsis here.,"Nov 11, 2021",3 min.,Unknown,"None found, add some"
766,Lu La La,1,Finished Airing,Music,Kids,Unknown,Music,0,#19145,N/A,N/A,190,A man receives a strange egg for Christmas which hatches a heart creature. ,"Dec 2, 1996",2 min.,Unknown,"None found, add some"
767,Lucy Far,1,Finished Airing,Music,Unknown,"rde,",Music,0,#20872,N/A,N/A,91,"Music video for the song lucy far by Serph from his album ""nirva"".","Apr 21, 2022",4 min.,Unknown,"None found, add some"
768,Luster,1,Finished Airing,Music,Unknown,Unknown,Music,0,#19412,N/A,N/A,175,Music video for the song Luster by nonoc.,"Jan 20, 2023",3 min.,Unknown,Geek Toys
769,Lycoris Recoil (Shinsaku Animation),Unknown,Not yet aired,Unknown,Unknown,"Action,",Unknown,88,#3793,N/A,N/A,"30,727","Lycoris Recoil new anime project.

",Not available,Unknown,Unknown,"None found, add some"
770,M,1,Finished Airing,Unknown,Unknown,"rde,",Music,0,#19919,N/A,N/A,145,"Music video by Densuke28 for the song M from the ninth album ""KNO WHERE"" by OKAMOTO'S.","Oct 19, 2021",4 min.,Unknown,"None found, add some"
771,Machibouke,1,Finished Airing,Music,Kids,Unknown,Music,0,#18974,N/A,N/A,200,"There was a tree stump at the corner of a farmer's field. A speeding rabbit broke its neck and died on it. Rabbits make for a great meal and sell well on the market so the farmer decided to give up farming and just wait for more rabbits to come hit the stump and die again. But he waited and waited and no new rabbits came. Leaving his crops to fail and himself rabbit-less. The song is supposed to teach the lesson of waiting in vain. It's okay to have an optimistic view on something but do not idly sit around waiting for it to happen because it might not. Similar to the Western adage ""don't count your chickens before they hatch.""","Aug 16, 1973",2 min.,Unknown,"None found, add some"
772,Macross (Shinsaku Animation),Unknown,Not yet aired,Unknown,Unknown,"Action,Romance,Sci-Fi,",Unknown,0,#18105,N/A,N/A,251,No synopsis information has been added to this title. Help improve our database by adding a synopsis here.,Not available,Unknown,Unknown,Sunrise
773,Mad Love,1,Finished Airing,Music,Unknown,Unknown,Music,0,#19492,N/A,N/A,171,Music video directed and animated by Ryoji Yamada for the song Mad Love by Keita Sano.,"Jul 12, 2017",3 min.,Unknown,"None found, add some"
774,Made in Abyss: Retsujitsu no Ougonkyou (Zoku-hen),Unknown,Not yet aired,Unknown,Unknown,"Adventure,Drama,Fantasy,Mystery,Sci-Fi,Suspense,",Unknown,56,#4421,N/A,N/A,"22,020",A sequel to Made in Abyss: The Golden City of the Scorching Sun.,Not available,Unknown,Unknown,"None found, add some"
775,Mado (Music),1,Finished Airing,Music,Kids,Unknown,Music,0,#18254,N/A,N/A,243,Open the windows of your mind. The scenery of the world is irreplaceable and while you may love the past but you shouldn't let it cloud what you see in front of you right this very moment.,"Apr 2, 2018",4 min.,Unknown,Shirogumi
776,Madogiwa no Totto-chan,1,Not yet aired,Unknown,Unknown,"Drama,",Movie,0,#16798,N/A,N/A,340,"This engaging series of childhood recollections tells about an ideal school in Tokyo during World War II that combined learning with fun, freedom, and love. This unusual school had old railroad cars for classrooms, and it was run by an extraordinary man-its founder and headmaster, Sosaku Kobayashi--who was a firm believer in freedom of expression and activity.

(Source: Kodansha)","Dec 8, 2023",Unknown,Unknown,Shin-Ei Animation
777,Magic Door,1,Finished Airing,Unknown,Unknown,Unknown,Music,0,#23008,N/A,N/A,50,"Every dreamer has their own magic door.

(Source: BTS's YouTube Channel)","Aug 8, 2020",2 min.,Unknown,"None found, add some"
778,Mahou no Uta,1,Finished Airing,Music,Unknown,Unknown,Music,0,#19909,N/A,N/A,146,Music video animated for the song Mahou no Uta by PEOPLE 1.,"Nov 24, 2021",3 min.,Unknown,"None found, add some"
779,Mahou Shoujo Ikusei Keikaku: Restart,Unknown,Not yet aired,Unknown,Unknown,"Action,Fantasy,Suspense,",Unknown,1,#11073,N/A,N/A,"1,776","The deadly game is back!

Once again, sixteen Magical Girls have been assembled for a high-stakes challenge. Every three days, their Magical Phone pulls them into an RPG-like simulation where they have to work together to fight enemies, solve puzzles, and earn Magical Candy to advance. A staggering ten billion yen reward awaits them at the end—but only for the players who land the finishing blow. With such a tantalizing prize on the line, it's only a matter of time before the girls turn on each other—and if their hit points drop to zero, a game over will be the least of their worries... 

(Source: Mahou Shoujo Ikusei Keikaku Wiki, edited)",Not available,Unknown,Unknown,"None found, add some"
780,Mahou Shoujo Madoka★Magica Movie 4: Walpurgis no Kaiten,1,Not yet aired,Unknown,Unknown,"Drama,Mystery,Supernatural,Suspense,",Movie,256,#2805,N/A,N/A,"54,247",No synopsis information has been added to this title. Help improve our database by adding a synopsis here.,Not available,Unknown,Unknown,Shaft
781,Mahou Shoujo ni Akogarete,Unknown,Not yet aired,Unknown,Unknown,"Action,Comedy,Fantasy,",TV,23,#9011,N/A,N/A,"3,580","Hiiragi Utena has always looked up to magical girls and fantasized about transforming into a cool heroine who fights evil. So, when a doll-like figure approaches her one evening, claiming that she has magical power lying dormant within, she trembles in excitement. But her colorful dream is quickly shattered in an ironic turn of events when she transforms into a villain!

Disinterested in associating with the forces of evil, she tries to quit when a group of magical girls appear and declare war. A battle ensues and Hiiragi soon discovers that she enjoys inflicting pain on others as her true nature starts to emerge.

Mahou Shoujo ni Akogarete follows Hiiragi as she begins her new life as the leader of villains, fighting against magical girls and indulging in her newfound sadistic nature to her heart's content.

[Written by MAL Rewrite]",2024 to ?,Unknown,?,"None found, add some"
782,Mahouka Koukou no Rettousei (Zoku-hen),Unknown,Not yet aired,School,Unknown,"Action,Fantasy,Romance,Sci-Fi,",Unknown,58,#4029,N/A,N/A,"26,950",No synopsis information has been added to this title. Help improve our database by adding a synopsis here.,Not available,Unknown,Unknown,"None found, add some"
783,Mahoutsukai ni Narenakatta Onnanoko no Hanashi.,Unknown,Not yet aired,School,Unknown,"Drama,Fantasy,",TV,6,#6768,N/A,N/A,"7,743","Kurumi Mirai is in the first year of high school.

She has enrolled in junior high section of the Redrun Magic School, the world's only facility for mages that approved by International Mage League and able to work under royal families when graduates, and she was always top of the class. However, when she applies for the high school section and took the examination to get into a mage training class ""Ma-gumi (Mage Class)"", she wasn't able to get in in spite having full scores and was top of the class for the whole three years.

There are some students in the class next to her that takes that class. Among that there's someone she admires. How will Kurumi Mirai who has extraordinary brain but didn't get in to be a mage candidate try to overcome and grow up? What is the aim for Minami Suzuki, a loyal mage who suddenly appears to be the homeroom teacher? This is a relaxing story of her growth.

(Source: MAL News)",Not available,Unknown,?,J.C.Staff
784,Mahoutsukai no Yome Season 2 Part 2,Unknown,Not yet aired,Mythology,Shounen,"Drama,Fantasy,Romance,",TV,30,#4200,N/A,N/A,"24,760",Part 2 of Mahoutsukai no Yome Season 2,"Oct 5, 2023 to ?",Unknown,Fall 2023,Studio Kafka
785,Mahoutsukai no Yoru,1,Not yet aired,Unknown,Unknown,"Mystery,Supernatural,",Movie,66,#5347,N/A,N/A,"13,833","Set near the end of the Showa period in the late 1980s, an old mansion in Misaki Town is rumored to be the home of a witch.

Aoko abruptly enters the world of magi after her grandfather suddenly decides to have Aoko become the Aozaki family's successor. Since then, Aoko moves into the Kuonji Mansion and begins to learn magecraft from the young magus Alice Kuonji, the rumored witch of the mansion. After witnessing the two using magecraft, Soujuurou Shizuki is also forced to live with them until a rune to remove his memories is discovered. 

(Source: Type-Moon Fandom Wiki)",2023,Unknown,Unknown,ufotable
786,Mahoutsukai Precure! 2,Unknown,Not yet aired,Mahou Shoujo,Unknown,"Action,Fantasy,",TV,4,#12503,N/A,N/A,"1,063",Second season of Mahoutsukai Precure!,2024 to ?,Unknown,?,Toei Animation
787,Mai Mai Mai,1,Finished Airing,Music,Unknown,Unknown,Music,0,#19920,N/A,N/A,145,Song performed at the 2020 Bilibili New Year Gala.,"Jan 28, 2020",4 min.,Unknown,"None found, add some"
788,Majimag Kalchum,1,Finished Airing,Music,Unknown,"Action,Fantasy,",Music,0,#19010,N/A,N/A,198,Music video for the song Last Sword Dance by Jo Gwangil. Serves as a promo for Return of the Blossoming Blade manhwa.,"Aug 10, 2022",3 min.,Unknown,"None found, add some"
789,Majo to Yajuu,Unknown,Not yet aired,Adult Cast,Seinen,"Action,Fantasy,",TV,9,#9579,N/A,N/A,"3,094","Guideau: a feral girl with long fangs and the eyes of a beast. Ashaf: a soft-spoken man with delicate features and a coffin strapped to his back. This ominous pair appears one day in a town that's in thrall to a witch, who has convinced the townsfolk she's their hero. But Ashaf and Guideau know better. They have scores to settle, and they won't hesitate to remove anyone in their way...

(Source: Kodansha USA)",Jan 2024 to ?,Unknown,Winter 2024,"None found, add some"
790,Make a Girl,1,Not yet aired,Unknown,Unknown,"Romance,Sci-Fi,",Movie,0,#16245,N/A,N/A,382,"The story follows a high school boy named Akira, who scientifically creates an ""artificial girlfriend"" named No. 0.

(Source: ANN)",2024,1 hr. 30 min.,Unknown,"None found, add some"
791,Malta no Utaou,6,Finished Airing,Unknown,Kids,Unknown,Music,0,#19910,N/A,N/A,146,A musical rendition of the Malta no Bouken franchise. Each episode is a music video facilitating healthy habits (eg. episode 1 is an enka song about brushing teeth).,"Jun 13, 2019 to Dec 15, 2019",2 min. per ep.,Unknown,"None found, add some"
792,Mama no Earring,1,Finished Airing,Music,Kids,Unknown,Music,0,#18807,N/A,N/A,209,A little girl adores her mother's pearl earrings.,"Oct 2, 1990",2 min.,Unknown,"None found, add some"
793,Mama no Kekkon,1,Finished Airing,Music,Kids,Unknown,Music,0,#19127,N/A,N/A,191,A young girl sings about her mother's re-marriage and how happy she feels that her mom found love.,"Jun 1, 2002",4 min.,Unknown,"None found, add some"
794,Managarmr,1,Finished Airing,Music,Unknown,Unknown,Music,0,#22343,N/A,N/A,59,Music video for the song Managarmr by Kankan and FAKE TYPE.,"Apr 29, 2022",3 min.,Unknown,"None found, add some"
795,Manatsu no Namida,1,Finished Airing,Music,Unknown,"Supernatural,",Music,0,#18270,N/A,N/A,242,Music video for the song Manatsu no Namida by Kitsunetsuki.,"Aug 9, 2019",5 min.,Unknown,Pmats9 studio
796,Mangetsu no Fortune,1,Finished Airing,Music,Unknown,"rde,",Music,0,#21039,N/A,N/A,85,Music video for song Mangetsu no Fortune by Yumi Matsutoya.,"Nov 23, 1990",4 min.,Unknown,"None found, add some"
797,Mannequin,1,Finished Airing,Music,Unknown,"Romance,",Music,0,#20190,N/A,N/A,130,Music video for the song ' Mannequin by DECO*27 feat. Hatsune Miku.,"Mar 9, 2023",3 min.,Unknown,OTOIRO
798,Manyan Sinian,1,Finished Airing,Music,Unknown,Unknown,Music,0,#22406,N/A,N/A,58,Music video for the song Manyan Sinian by Tingyi Chan.,"Mar 18, 2021",3 min.,Unknown,Slow Studio
799,Maou 2099,Unknown,Not yet aired,Unknown,Unknown,"Action,Fantasy,Sci-Fi,",Unknown,2,#11473,N/A,N/A,"1,514","​The cyberpunk metropolis Shinjuku—a massive city-state bedecked with neon signs, towering skyscrapers, and the latest cutting-edge technology. It is here, in year 2099 of the Fused Era, where the legendary Demon Lord Veltol has his second coming five centuries in the making. But this landscape is nothing like the one he conquered all those years ago, for the fusion of magic and engineering has elevated civilization to dazzling, unprecedented heights. Veltol may have been reduced to a historical footnote, but make no mistake...this brave new world will be his for the taking!

(Source: Yen Press)",Not available,Unknown,Unknown,"None found, add some"
800,"Maou Gakuin no Futekigousha: Shijou Saikyou no Maou no Shiso, Tensei shite Shison-tachi no Gakkou e Kayou II Part 2",Unknown,Not yet aired,Unknown,Unknown,"Action,Fantasy,",TV,382,#2262,N/A,N/A,"78,997","Second half of Maou Gakuin no Futekigousha: Shijou Saikyou no Maou no Shiso, Tensei shite Shison-tachi no Gakkou e Kayou II.",Not available,Unknown,?,SILVER LINK.
801,"Maou no Ore ga Dorei Elf wo Yome ni Shitanda ga, Dou Medereba Ii?",Unknown,Not yet aired,Unknown,Unknown,"Action,Fantasy,Romance,",Unknown,9,#9179,N/A,N/A,"3,372","When the sorcerer Zagan decides to participate in an auction selling the goods of the now dead Archdemon Marchosias, he expects to find items of untold power. What he finds instead is a rare white-haired slave elf named Nephilia, and he immediately spends all his money to purchase her, much to the bewilderment of those around him. However, the secret reason behind Zagan's investment was that he had actually fallen in love with her at first sight.

Unfortunately, Zagan has a problem: he is socially inept and has no idea how to express his true feelings, leading to many misunderstandings between him and his new companion. But slowly, the two begin to understand each other, and love begins to bloom.

[Written by MAL Rewrite]",Not available,Unknown,Unknown,"None found, add some"
802,Maou no Yakata wa Oosawagi,1,Finished Airing,Music,Unknown,Unknown,Music,0,#20999,N/A,N/A,86,Music video for the song Maou no Yakata wa Oosawagi by Meychan.,"Jan 26, 2017",5 min.,Unknown,"None found, add some"
803,Maru-neun Gangjwi (Music),1,Finished Airing,Unknown,Unknown,"Fantasy,",Music,0,#20780,N/A,N/A,95,"Music video for the song ""Maru-neun Gangjwi"" by Pododang.","Feb 9, 2023",1 min.,Unknown,"None found, add some"
804,Mashle 2nd Season,Unknown,Not yet aired,Unknown,Unknown,"Action,Comedy,Fantasy,",TV,57,#3433,N/A,N/A,"37,834",Second season of Mashle.,Jan 2024 to ?,Unknown,Winter 2024,A-1 Pictures
805,Mask Danshi wa Koishitakunai noni,1,Not yet aired,School,Unknown,"ve,",OVA,36,#8188,N/A,N/A,"4,821","The famous cheerful guy, Saikawa had tried to rip off the gloomy kid, Sayama's mask. After that day, he had captured Saikawa's attention and Saikawa had volunteered to teach him for the upcoming examination but with one condition, Saikawa can do whatever he wants with what is hiding under Sayama's mask. He hates it when people touch his bare face, lips and inside his mouth, but he cannot say anything when Saikawa touches them. With the combination between Saikawa's harassment and the awkward mask boy's behavior, this manga will be packed with sexual tension between these two.

(Source: Libre, translated)","Oct 20, 2023",Unknown,Unknown,Studio Fusion
806,Masquerade,1,Finished Airing,Music,Unknown,Unknown,Music,0,#23374,N/A,N/A,46,Music video for the song Masquerade by FAKE TYPE.,"Apr 14, 2023",3 min.,Unknown,"None found, add some"
807,Matasaburou,1,Finished Airing,Music,Unknown,Unknown,Music,0,#20387,N/A,N/A,119,Music video for the song Matasaburou by Yorushika.,"Jun 7, 2021",3 min.,Unknown,THINKR
808,Matenrou to Rinkai-ten,1,Finished Airing,Music,Unknown,"Action,Fantasy,",Music,1,#19835,N/A,N/A,150,Music video for the song Matenrou to Rinkai-ten by Sayonara Ponytail.,"Feb 9, 2018",3 min.,Unknown,"None found, add some"
809,Mato Seihei no Slave,Unknown,Not yet aired,Harem,Shounen,"Action,Fantasy,Ecchi,",TV,410,#3494,N/A,N/A,"36,500","When entrances to a different dimension known as the ""Mato"" emerge all over Japan, a new resource known as ""Peaches"" are discovered which give unique abilities only to women. However, dangerous monsters called ""Yomotsu Shuuki"" also roam throughout the Mato and have been responsible for various disasters ever since. To combat them, the government formed the Anti-demon Corps, an elite group of women who have received power from the Peaches.

One day, a high school student named Yuuki Wakura was walking home from school when he suddenly got lost in a Mato entrance. When he calls for help, he is immediately rescued by Kyouka Uzen, the chief of the Seventh Unit of the Anti-demon Corps. Recognizing his potential while also needing him to make her Peach power more effective, she asks that Yuuki join the Anti-demon Corps by becoming her slave, a position he might find more enjoyable than he initially would have thought... 

(Source: MU, edited)",Jan 2024 to ?,Unknown,Winter 2024,Seven Arcs
810,Mattaku Mi ni Naranai Hibi,1,Finished Airing,Music,Unknown,Unknown,Music,0,#20139,N/A,N/A,132,"Music video for the song Mattaku Mi ni Naranai Hibi, performed by Kiyo and Retort.","Jan 8, 2018",4 min.,Unknown,"None found, add some"
811,Mattaku Mi ni Naranai Kiseki,1,Finished Airing,Music,Unknown,Unknown,Music,0,#20632,N/A,N/A,104,"Music video for the song Mattaku Mi ni Naranai Kiseki, performed by Kiyo and Retort.","Dec 1, 2020",5 min.,Unknown,"None found, add some"
812,Mattaku Mi ni Naranai Song,1,Finished Airing,Music,Unknown,Unknown,Music,0,#20685,N/A,N/A,100,"Music video for the song Mattaku Mi ni Naranai Song by Kiyo, Retort and Arawato. The vocals are by the Vocaloid Yuzuki Yukari.","Mar 12, 2015",4 min.,Unknown,"None found, add some"
813,Maware Troika,1,Finished Airing,Music,Kids,Unknown,Music,0,#18898,N/A,N/A,204,"A song about a man who grew up eating conveyor belt sushi. The title formally means toro (tuna) and ika (squid) but makes a pun with troika, a traditional Russian harness driving combination, using three horses abreast, usually pulling a sleigh. ","Oct 1, 2013",2 min.,Unknown,"None found, add some"
814,Mayday,1,Finished Airing,Music,Unknown,Unknown,Music,0,#22344,N/A,N/A,59,Music video for the song Mayday by Tsukuyomi.,"Feb 24, 2022",3 min.,Unknown,"None found, add some"
815,Mayuge Dance,1,Finished Airing,Music,Kids,Unknown,Music,0,#18765,N/A,N/A,211,An eyebrows appreciation music video.,"Dec 1, 2016",2 min.,Unknown,Oddjob
816,Mayuge no Uta,1,Finished Airing,Music,Kids,Unknown,Music,0,#19389,N/A,N/A,177,A song about a dog with large eyebrows and his summer beach vacation.,"Aug 1, 1999",2 min.,Unknown,"None found, add some"
817,Möbius Dust,Unknown,Not yet aired,Strategy Game,Kids,"Action,",TV,9,#8890,N/A,N/A,"3,722","On February 29, 2000, the Möbius meteorites fell on Earth. These meteorites brought a new form of matter known as Möbius Dust to Earth. The dust permeated Earth's atmosphere, leading to a miracle. The day the meteorites fell, nicknamed ""2.29,"" accelerated the economic disparity in Japan.

Before long, the Bloody War Alliance, discontent with this disparity, began committing acts of terrorism. Amidst all this, the police established the anti-RC special mobile unit and a joint anti-RC training school for the initial training of the unit members.

(Source: ANN)",Not available,Unknown,?,Doga Kobo
818,Mecha-ude (TV),Unknown,Not yet aired,Mecha,Unknown,"Action,Sci-Fi,",TV,9,#9501,N/A,N/A,"3,048","Long ago, alien lifeforms came to Earth, fusing with people on the planet. Due to their appearance, they were dubbed ""Mecha-ude,"" as when fused, they bore a striking resemblance to mechanized limbs.

Through an involuntary partnership, average middle schooler Hikaru Amatsuga works alongside the Mecha-ude Arma, who is an extremely rare and special existence. To protect Arma, the resistance group ARMS assigns the dual Mecha-ude user Aki Murasame to follow him wherever he goes. However, she is also looking for a mysterious Snake-Type Mecha-ude wielder, who has put many of her comrades in a critical state.

Behind the scenes, an organization known as the Kagami Group is searching for the mythical ""Trigger Arm,"" a Mecha-ude said to grant unlimited power. When Aki's life is threatened by this group, Hikaru must team up with Arma to find the coursage to fight back and, along the way, learn that his life will never be ordinary again. 

[Written by MAL Rewrite]",Not available,Unknown,?,TriF Studio
819,Medalist,Unknown,Not yet aired,Performing Arts,Seinen,"Drama,Sports,",TV,1,#10988,N/A,N/A,"1,844","Becoming an ice dancer was not what Tsukasa Akeuraji had aimed for when he decided to take on the figure skating world. However, it is where he ended up as he ""started too late"" to follow his true solo-skating dreams.

For years, he was content with being a shell of his former ambitions—that is, until he met a little girl in whom he saw himself. Inori Yuitsuka, a fifth-grader so desperate to skate that she practiced in secret, had visited Tsukasa's rink with her mother to ask for lessons. She was branded as useless by everyone around her, told it was ""too late"" for her to begin, and that catching up to other skaters was impossible.

With a newfound conviction and unwillingness to let another passionate skater go down the same road as him, Tsukasa takes on the responsibility of coaching her and promises to make Inori a medalist.

[Written by MAL Rewrite]",Not available,Unknown,?,ENGI
820,Meeting Place,1,Finished Airing,Music,Unknown,Unknown,Music,0,#20421,N/A,N/A,117,"Music video directed by Shuta Hasunuma with art from Masanao Hirayama for the song Meeting Place from the second album ""ANTHROPOCENE"" by the Shuta Hasunuma Philharmonic Orchestra.","Jul 5, 2018",8 min.,Unknown,"None found, add some"
821,Megami no Café Terrace Season 2,Unknown,Not yet aired,Harem,Shounen,"Comedy,Romance,Ecchi,",TV,50,#5543,N/A,N/A,"12,618",Second season of Megami no Café Terrace.,2024 to ?,Unknown,?,Tezuka Productions
