,title,episodes,status,theme,demographic,genres,type,favorites,popularity,rank,score,members,synopsis,aired,duration,premiered,studios
0,Zatsu Tabi: That's Journey,Unknown,Not yet aired,Unknown,Seinen,"Adventure,fe,",Unknown,1,#14189,N/A,N/A,632,No synopsis information has been added to this title. Help improve our database by adding a synopsis here.,Not available,Unknown,Unknown,"None found, add some"
1,Zero,1,Finished Airing,Music,Unknown,Unknown,Music,0,#23059,N/A,N/A,49,Music video for the song Zero by PinnochioP featuring Miku Hatsune.,"Mar 19, 2019",4 min.,Unknown,"None found, add some"
2,Zero Seiki Movie 1: Emeraldas,1,Not yet aired,Unknown,Unknown,"Action,Adventure,Sci-Fi,",Movie,0,#9788,N/A,N/A,"2,713",An anime movie that was announced at Japan Expo and was supposed to air in 2020.,Not available,Unknown,Unknown,"Production GoodBook,       Gainax Kyoto"
3,Zero Seiki Movie 2: Herlock,1,Not yet aired,Unknown,Unknown,"Action,Adventure,Sci-Fi,",Movie,0,#11188,N/A,N/A,"1,698",An anime movie that was announced at Japan Expo which will air in 2023.,Not available,Unknown,Unknown,"None found, add some"
4,Zero Seiki Movie 3: Maetel,1,Not yet aired,Unknown,Unknown,"Action,Adventure,Sci-Fi,",Movie,0,#11718,N/A,N/A,"1,397",An anime movie that was announced at Japan Expo which will air in 2026.,Not available,Unknown,Unknown,"None found, add some"
5,Zetsubou-san,1,Finished Airing,Music,Unknown,Unknown,Music,0,#20082,N/A,N/A,135,"Music video for the song Zetsubou-san, performed by Meychan.","Jun 27, 2022",2 min.,Unknown,"None found, add some"
6,Zhen Hun Jie 3rd Season,16,Not yet aired,Unknown,Unknown,"Action,Fantasy,Supernatural,",ONA,0,#15382,N/A,N/A,461,The third season of Zhen Hun Jie.,"Jul 29, 2023 to ?",20 min. per ep.,Unknown,L²Studio
7,Zigi,1,Finished Airing,Music,Unknown,Unknown,Music,0,#20442,N/A,N/A,116,Music video for Jin's song Zigi.,"May 5, 2022",3 min.,Unknown,"None found, add some"
8,Zipangu,1,Finished Airing,Music,Unknown,Unknown,Music,0,#22925,N/A,N/A,51,"Music video for the song Zipangu by Ryujin Kiyoshi from his sixth album ""WORK"".","Oct 23, 2013",3 min.,Unknown,"None found, add some"
9,Zombieland Saga Movie,1,Not yet aired,Unknown,Unknown,"Comedy,Supernatural,",Movie,70,#4068,N/A,N/A,"26,537",No synopsis information has been added to this title. Help improve our database by adding a synopsis here.,Not available,Unknown,Unknown,"None found, add some"
10,Zou da Zou,1,Finished Airing,Music,Kids,Unknown,Music,0,#18864,N/A,N/A,206,Music video for the song Zou da Zou by Isao Sasaki that was featured on NHK's Minna no Uta program. The video was animated by Toshikatsu Wada.,"Feb 1, 2004",2 min.,Unknown,"None found, add some"
11,Zurui Maboroshi,1,Finished Airing,Music,Unknown,Unknown,Music,0,#19945,N/A,N/A,143,"Music video for the song Zurui Maboroshi, performed by Meychan.","Feb 22, 2022",3 min.,Unknown,StudioXD
12,"""Oshi no Ko"" Season 2",Unknown,Not yet aired,Unknown,Seinen,"Drama,Supernatural,",TV,583,#2180,N/A,N/A,"83,492","Second season of ""Oshi no Ko"".",Not available,Unknown,?,Doga Kobo
13,#Compass 2.0: Sentou Setsuri Kaiseki System,Unknown,Not yet aired,Unknown,Unknown,Unknown,Unknown,1,#18937,N/A,N/A,202,No synopsis information has been added to this title. Help improve our database by adding a synopsis here.,2025 to ?,Unknown,Unknown,"None found, add some"
14,100 Manten☆Pax Salomena,1,Finished Airing,Music,Unknown,Unknown,Music,0,#21627,N/A,N/A,71,Music video for the song 100 Manten☆Pax Salomena by Hyakumantenbara Salome.,"May 21, 2023",3 min.,Unknown,"None found, add some"
15,12-wol,1,Finished Airing,Music,Unknown,Unknown,Music,0,#20373,N/A,N/A,119,Music video for the song December by Jang Heewon.,"Dec 2, 2021",3 min.,Unknown,"None found, add some"
16,16bit Sensation: Another Layer,Unknown,Not yet aired,Unknown,Unknown,"Comedy,",TV,3,#11003,N/A,N/A,"1,826","Devote your youth to developing a lovely bishoujo game that will make players fall in love!""

Meiko Uehara, a college student, began working part-time at a computer store in 1992. However, behind the scenes, the shop was an erotic game maker specializing in bishoujo games. Meiko, a talented artist, is suddenly hired as a substitute graphic designer after the staff flees, even though she has never drawn an R-18 illustration before.

Will she be able to complete the eroge successfully?! With a 16-bit PC as her partner, her career as a creator begins

(Source: MAL News)",Not available,Unknown,?,"None found, add some"
17,1985,1,Finished Airing,Music,Unknown,"rde,",Music,0,#20705,N/A,N/A,99,Music video for MOHOME's song 1985.,"Mar 21, 2023",6 min.,Unknown,"None found, add some"
18,2.5-jigen no Ririsa,Unknown,Not yet aired,Unknown,Shounen,"Comedy,Ecchi,",TV,31,#6990,N/A,N/A,"7,126","""I have no interest in real girls!"" So claims Okumura, the president of the school's manga club. He's your typical otaku, obsessed with a sexy (fictional) 2D manga character known as Lilliel. Then the new school year starts, and a (real!) 3D girl named Lilysa whose passion is cosplay joins the club. Lilysa convinces Okumura to become her photographer—and guess who her favorite manga character is? Not only that, but Lilysa is into modeling the fetishy stuff! The boundaries between 2D and 3D start to blur as this hot-blooded romantic comedy unfolds.

(Source: Seven Seas Entertainment)",Not available,Unknown,?,"None found, add some"
19,2005,1,Finished Airing,Music,Unknown,"rde,",Music,0,#19843,N/A,N/A,150,Music video for the song 2005 by dj newtown.,"Feb 13, 2022",6 min.,Unknown,Mimoid
20,21 Seiki,1,Finished Airing,Music,Kids,Unknown,Music,0,#19155,N/A,N/A,189,Animated music video that aired as part of TV Asahi's Pika Pika Ongakukan program.,1989,25 sec.,Unknown,"None found, add some"
21,3-nen Z-gumi Ginpachi-sensei,Unknown,Not yet aired,School,Shounen,"Comedy,",Unknown,97,#5210,N/A,N/A,"14,677",The spin-off anime to Gintama follows Ginpachi Sakata as a teacher in Gintama High School.,Not available,Unknown,Unknown,"None found, add some"
22,32,1,Finished Airing,Music,Unknown,"rde,",Music,0,#20370,N/A,N/A,120,Music video for the song 32 by Kouji Takahashi.,"Feb 14, 2021",1 min.,Unknown,"None found, add some"
23,3341,1,Finished Airing,Music,Kids,Unknown,Music,0,#20495,N/A,N/A,112,Music video for the song 3341 by Ami Sakaguchi that was featured on NHK's Minna no Uta program.,"Oct 1, 2018",2 min.,Unknown,"None found, add some"
24,39 Music!,1,Finished Airing,Music,Unknown,Unknown,Music,0,#20083,N/A,N/A,135,"Official music video for the event Magical Mirai 2016, with art by Mago and music by Mikito-P, performed by Miku Hatsune.","Jun 29, 2016",4 min.,Unknown,"None found, add some"
25,9-gatsu,1,Finished Airing,Music,Unknown,Unknown,Music,0,#22926,N/A,N/A,51,Music video for the song 9-gatsu by RIM.,"Jun 9, 2021",4 min.,Unknown,Mimoid
26,90's Love (SQUAR Remix),1,Finished Airing,Music,Unknown,Unknown,Music,0,#22119,N/A,N/A,63,Music video for the song 90's Love (SQUAR Remix) by NCT U.,"Dec 17, 2020",2 min.,Unknown,"None found, add some"
27,A Doodlin' Song,1,Finished Airing,Music,Unknown,"rde,",Music,0,#20257,N/A,N/A,126,"Directed and animated by Sawako Kageyama, music and song performance by Haruomi Hosono and Tomoyo Harada.","Oct 6, 2020",1 min.,Unknown,"None found, add some"
28,A Walk With the Colors,1,Finished Airing,Music,Unknown,Unknown,Music,0,#20258,N/A,N/A,126,Music video for the song A walk with the colors by PHONO TONES.,"Jul 14, 2022",2 min.,Unknown,"None found, add some"
29,Aa Okashii ne,1,Finished Airing,Music,Kids,Unknown,Music,0,#20814,N/A,N/A,94,Music video for the song Aa Okashii ne by NHK Tokyo Children's Choir that was featured on NHK's Minna no Uta program.,"Jun 1, 1985",2 min.,Unknown,"None found, add some"
30,Abyssal Zone,1,Finished Airing,Music,Unknown,Unknown,Music,0,#21430,N/A,N/A,75,Music video for the song Abyssal Zone by Nornis.,"Jun 22, 2022",3 min.,Unknown,"None found, add some"
31,Acnes no Uta,1,Finished Airing,Music,Unknown,"rde,",Music,0,#20158,N/A,N/A,131,A commercial by Meiyo for Rohto Pharmaceutical's Acnes wash.,"May 10, 2022",1 min.,Unknown,EDP graphic works
32,Acro Trip,Unknown,Not yet aired,Unknown,Shoujo,"Comedy,",TV,3,#11150,N/A,N/A,"1,723","Chizuko Date is an otaku girl who lives in a city in Niigata Prefecture. Chizuko is obsessed with Berry Blossom, the magical girl who protects the city. However, Chroma — the leader of the local evil organization Fossa Magna — is inept and weak, so hardly anyone else cares about Berry Blossom and Chroma's frequent battles anymore. Chizuko vows to shine a light on the magical girl's exploits — and this fervent desire takes this seemingly shy middle school girl down a dark path filled with strange folks...

(Source: ANN)",2024 to ?,Unknown,?,Voil
33,After Man,1,Finished Airing,Music,Kids,Unknown,Music,0,#19477,N/A,N/A,172,Music video for a song After Man by Akemi Okamura shown in the NHK's program Minna no Uta.,Oct 1994,2 min.,Unknown,"None found, add some"
34,Ai Datta n da yo,1,Finished Airing,Music,Kids,Unknown,Music,0,#20221,N/A,N/A,128,A music video for the song Ai Datta n da yo by Kouji Tamaki that was featured on NHK's Minna no Uta program.,Aug 1998,4 min.,Unknown,"None found, add some"
35,Ai ga Oshigoto,1,Finished Airing,Music,Kids,Unknown,Music,0,#21107,N/A,N/A,82,Music video for the song Ai ga Oshigoto by Misato Watanabe that was featured on NHK's Minna no Uta program.,"Aug 1, 2022",2 min.,Unknown,"None found, add some"
36,Ai ga Tarinai yo,1,Finished Airing,Music,Unknown,"Romance,",Music,1,#20884,N/A,N/A,91,Music video for the song Ai ga Tarinai yo by SONOMI.,"Sep 8, 2010",4 min.,Unknown,"None found, add some"
37,Ai W-kun,1,Finished Airing,Music,Kids,Unknown,Music,0,#21175,N/A,N/A,80,Music video for the song Ai W-kun by Sky Peace that was featured on NHK's Minna no Uta program.,"Dec 1, 2020",2 min.,Unknown,"None found, add some"
38,Ai wo Kite,1,Finished Airing,Music,Kids,Unknown,Music,0,#21079,N/A,N/A,83,Music video for the song Ai wo Kite by Koresawa that was featured on NHK's Minna no Uta program.,"Feb 1, 2021",2 min.,Unknown,"None found, add some"
39,Aigatari na Itte,1,Finished Airing,Music,Unknown,Unknown,Music,0,#19347,N/A,N/A,179,Animated music video for the song Aigatari na Itte by souzoucity.,"Dec 18, 2020",5 min.,Unknown,"None found, add some"
40,Aimai na Mama,1,Finished Airing,Music,Unknown,"Drama,",Music,0,#20942,N/A,N/A,88,Music video for the song Aimai na Mama by RIF.,"Feb 2, 2015",5 min.,Unknown,"None found, add some"
41,Ain't Seen Nothing Like This,1,Finished Airing,Music,Unknown,"Action,",Music,0,#20496,N/A,N/A,112,Music video for the song Ain't Seen Nothing Like This by Rad Cat. The song was made for Arknights to commemorate the release of Dossoles Holiday in the global server.,"Jan 20, 2022",2 min.,Unknown,ARCUS
42,Air Folktale,1,Finished Airing,Music,Unknown,Unknown,Music,0,#20159,N/A,N/A,131,"Music video for the song Air Folktale, performed by Gero.","Aug 1, 2020",3 min.,Unknown,"None found, add some"
43,Aishang Zhi Di,1,Finished Airing,Music,Unknown,"rde,",Music,0,#22808,N/A,N/A,52,Music video for the song Aishang Zhi Di by ALIS HOWS (TzChien).,"Jun 1, 2022",3 min.,Unknown,Slow Studio
44,Aishiteru,1,Finished Airing,Music,Kids,Unknown,Music,0,#20238,N/A,N/A,127,Animated music video that aired as part of TV Asahi's Pika Pika Ongakukan program.,Apr 1989,2 min.,Unknown,"None found, add some"
45,Aisu,1,Finished Airing,Unknown,Unknown,"Adventure,Comedy,Drama,Romance,Sci-Fi,",Music,0,#19156,N/A,N/A,189,Animated music video for the song Aisu by CreepHyp.,"Dec 11, 2019",4 min.,Unknown,"None found, add some"
46,Akai Fuusen,1,Finished Airing,Music,Kids,Unknown,Music,0,#21158,N/A,N/A,81,Music video for the song Akai Fuusen by Kanako Momota that was featured on NHK's Minna no Uta program.,"Oct 3, 2022",2 min.,Unknown,"None found, add some"
47,Akai Hoshi Aoi Hoshi: Tenmon Carat no Hoshi kara,1,Finished Airing,Music,Kids,Unknown,Music,0,#18878,N/A,N/A,205,Music video for the song Akai Hoshi Aoi Hoshi: Tenmon Carat no Hoshi kara by Saori Yuki that was featured on NHK's Minna no Uta program. The video was animated by Toshio Nishiuchi.,"Jun 2, 1995",2 min.,Unknown,"None found, add some"
48,Akaito,2,Finished Airing,Music,Unknown,"Drama,Romance,",Music,0,#19425,N/A,N/A,175,"""Akaito"" is the sequel to Sarishinohara and Yonjuunana, being the third song in the series.","Feb 27, 2015",5 min. per ep.,Unknown,"None found, add some"
49,Akashi,1,Finished Airing,Unknown,Kids,Unknown,Music,0,#20311,N/A,N/A,123,Music video for the song Akashi by flumpool that was featured on NHK's Minna no Uta program.,Aug 2011,2 min.,Unknown,"None found, add some"
50,Aki Monogatari,1,Finished Airing,Music,Kids,Unknown,Music,1,#20259,N/A,N/A,126,Music video for the song Aki Monogatari by Kiyohiko Ozaki that was featured on NHK's Minna no Uta program.,Oct 1977,2 min.,Unknown,"None found, add some"
51,Akira (Shin Anime),Unknown,Not yet aired,Unknown,Seinen,"Action,Sci-Fi,Supernatural,",TV,34,#4049,N/A,N/A,"26,738","A new anime adaptation for Otomo's highly acclaimed post-apocalyptic cyberpunk manga series Akira.

(Source: MAL News)",Not available,Unknown,?,Sunrise
52,"Akkenaku, Sekai wa",1,Finished Airing,Music,Unknown,Unknown,Music,0,#22148,N/A,N/A,62,"Music video for the song Akkenaku, Sekai wa by Ryo Ryo.","May 17, 2023",3 min.,Unknown,"None found, add some"
53,Akogare,1,Finished Airing,Music,Unknown,Unknown,Music,0,#22693,N/A,N/A,54,Music video for the song Akogare by Shugo Tokumaru. Serves as a promotion for Hyuga City which is a small port city located in Miyazaki Prefecture.,"Jun 17, 2021",2 min.,Unknown,"None found, add some"
54,Akubi Neko,1,Finished Airing,Music,Kids,Unknown,Music,0,#21080,N/A,N/A,83,Music video for the song Akubi Neko by Youmou & Ohana that was featured on NHK's Minna no Uta program.,"Feb 1, 2010",2 min.,Unknown,"None found, add some"
55,Akubi wo Suru ni wa Wake ga Aru,Unknown,Not yet aired,Unknown,Unknown,"Drama,Sports,",Unknown,0,#11284,N/A,N/A,"1,634","The pamphlet for the project describes the setting as Japan in 2093. A rural town that used to be the most prestigious town in the world has long since sunk 30 meters under the ocean's surface. The story is a tale of a girl who takes part in free diving (diving without the aid of equipment to breathe), and the emotional growth she experiences. 

(Source: ANN)",Not available,Unknown,Unknown,Gaina
56,Akui Sensou,1,Finished Airing,Unknown,Unknown,Unknown,Music,0,#20374,N/A,N/A,119,Music video for the song Akui Sensou by Maiban Yurete Skirt.,"Jun 15, 2022",3 min.,Unknown,"None found, add some"
57,Akuma-kun (ONA),Unknown,Not yet aired,Mythology,Unknown,"Horror,Supernatural,Suspense,",ONA,5,#10243,N/A,N/A,"2,340","When Mr. Satou, a company employee at the world's largest electronics company, is called upon by his boss to tutor his only son in exchange for a high ranking position within the organization, things couldn't have been peachier. At least, that's what he thought...

Little did he know that his student was Ichirou Matsushita, a young boy with the mind of a genius and a terrifying hidden agenda. It doesn't take long for Satou to realize that he is the second home tutor in as many weeks that has been sent to teach the little boy. What's even more unnerving is that the previous Tutor's whereabouts appear to be a mystery...

The little boy's true identity is revealed when he puts Satou under a curse, turning him into a lizard man and making him one of servants. Little Ichirou Matsushita is none other than ""Akuma-kun"" boy genius and master of black magic. His goal? To open the portal between hell and earth, summon forth hell's most powerful demons, and enlist their help in taking over the world!",2023 to ?,Unknown,Unknown,Encourage Films
58,Akuyaku Reijou Level 99: Watashi wa Ura-Boss desu ga Maou dewa Arimasen,Unknown,Not yet aired,Unknown,Shoujo,"Fantasy,",TV,24,#8133,N/A,N/A,"4,913","A certain otome RPG takes place in the Varschein Kingdom, where dark hair is stigmatized to an abnormal degree. Eumiella Dolkness is the daughter of a count, hated from birth due to her pitch-black locks—and she is also the hidden boss! In a twist of fate, at five years of age, Eumiella recalls memories of her past life in Japan. Uninterested in the romance aspect of the original game, she begins to dedicate herself to training her rare dark-type magic.

Despite this, Eumiella's goals are clear: avoid becoming the hidden boss and stay out of the limelight. Upon entering the magic academy, however, she shakes the foundation of the kingdom when her level 99 status comes to light. Whether a physical brawl or magic duel, her abilities are unmatched, and coupled with her black hair, she sticks out like a sore thumb. To make matters worse, the original heroine begins suspecting she is the demon lord! Can the deadpan noble girl achieve her wish of a peaceful life?

[Written by MAL Rewrite]",Not available,Unknown,?,"None found, add some"
59,Albino,1,Finished Airing,Music,Unknown,Unknown,Music,0,#23206,N/A,N/A,48,Music video for the song albino by DUSTCELL.,"Nov 10, 2021",3 min.,Unknown,"None found, add some"
60,Alche Miss Katrina,1,Finished Airing,Music,Unknown,Unknown,Music,0,#20086,N/A,N/A,135,No synopsis information has been added to this title. Help improve our database by adding a synopsis here.,"Nov 26, 2022",3 min.,Unknown,"None found, add some"
61,Algernon,1,Finished Airing,Music,Unknown,"rde,",Music,0,#20980,N/A,N/A,87,Music video for the song Algernon by Yorushika.,"Mar 17, 2023",4 min.,Unknown,"None found, add some"
62,Alice no Kisetsu,1,Finished Airing,Music,Kids,"Fantasy,",Music,1,#19271,N/A,N/A,184,Music video for the song Alice no Kisetsu by Chikaco Sawada that was featured on NHK's Minna no Uta program. The song and video animated by Tsutomu Shibayama were inspired by Alice in Wonderland.,"Apr 5, 1988",2 min.,Unknown,"None found, add some"
63,Alice to Therese no Maboroshi Koujou,1,Not yet aired,Unknown,Unknown,"Drama,",Movie,313,#2615,N/A,N/A,"62,195","Masamune, a third-year middle school student, lives in a town where all the exits have been sealed off due to a sudden explosion at a steel mill, causing time to stand still. Residents are forbidden from making any changes and spend their suffocating days in the hopes of returning to normalcy someday.

One day, Masamune's mysterious classmate Mutsumi guides him to the fifth furnace of the steel mill, where they encounter a girl who cannot speak and resembles a wild wolf. The meeting between the two girls and Masamune disrupts the balance of the world, and the unstoppable ""impulse of love"" from boys and girls tired of their daily lives begins to destroy the world.

(Source: MAL News)","Sep 15, 2023",Unknown,Unknown,MAPPA
64,Alien Stage,Unknown,Currently Airing,Unknown,Unknown,"Drama,Sci-Fi,Suspense,",Music,5,#19132,N/A,N/A,191,"Alien Stage, a reality audition program, has taken the alien world by storm, and its upcoming season is planned to be just as exciting. Contestants must sing for their survival, as the loser faces on-the-spot termination. As the competition heats up, a mysterious girl emerges, whose involvement may hold the key to humanity's fate...

(Source: Alien Stage Wiki)","Sep 7, 2022 to ?",3 min.,Unknown,LICO
65,All the Little Things,1,Finished Airing,Music,Unknown,Unknown,Music,0,#22511,N/A,N/A,56,"A music video for the song All the Little Things illustrated by Yuko and animated by Ryoko for Yuko Ando's album ""Kongtong Recordings"".","Nov 17, 2021",5 min.,Unknown,"None found, add some"
66,Aloha Edamame,1,Finished Airing,Music,Kids,Unknown,Music,0,#24814,N/A,N/A,27,"Music video for the song Aloha Edamame by Haru & Chicchi Kazoku that was featured on NHK's Minna no Uta program.
","Aug 1, 2008",2 min.,Unknown,"None found, add some"
67,Alone,1,Finished Airing,Music,Unknown,"rde,",Music,0,#22694,N/A,N/A,54,Music video for the song Alone by BONZIE.,"Sep 15, 2020",3 min.,Unknown,"None found, add some"
68,Amagami,1,Finished Airing,Music,Unknown,Unknown,Music,0,#20851,N/A,N/A,92,Music video for the original song Amagami by Kuzuha.,"Feb 25, 2022",3 min.,Unknown,"None found, add some"
69,Amagami-san Chi no Enmusubi,Unknown,Not yet aired,Harem,Shounen,"Comedy,Romance,",TV,13,#9158,N/A,N/A,"3,401","Uryuu Kamihate has had a rough start to life, but plans to forget it all by achieving his dream—matriculating into medical school. But when he arrives at his new foster home, a working shrine, his dream of a quiet place to study goes up in smoke. Not only will he be living with the three beautiful, lively Amagami sisters—but he learns that he must marry one of them and take over the temple!

(Source: Kodansha USA)",Not available,Unknown,?,"None found, add some"
70,Amai Koibito,1,Finished Airing,Music,Unknown,Unknown,Music,0,#21025,N/A,N/A,86,Music video for the song Amai Koibito by MISIA. It was included on the CD EXTRA of her Greatest Hits album and features her original character Melon Panda.,"Mar 3, 2002",3 min.,Unknown,"None found, add some"
71,Ame ga Sora kara Fureba,1,Finished Airing,Music,Kids,Unknown,Music,0,#20146,N/A,N/A,132,A music video for the song Ame ga Sora kara Fureba by Komuro Hitoshi that was featured on NHK's Minna no Uta program.,Oct 1976,2 min.,Unknown,"None found, add some"
72,Ame no Uta,1,Finished Airing,Music,Unknown,Unknown,Music,0,#21227,N/A,N/A,79,"An animation based on the world created by artist Takae Koyanagi. It is a music video animation that pursues the beauty of rain to match a beautiful song.

(Source: Official website)","Oct 24, 2020",3 min.,Unknown,Decovocal
73,Ame yo Ame yo Fure,1,Finished Airing,Music,Unknown,Unknown,Music,0,#22810,N/A,N/A,52,Music video for the song Ame yo Ame yo Fure by 100kaiOuto.,"Dec 29, 2021",3 min.,Unknown,"None found, add some"
74,Amefuri Kuma no Ko,1,Finished Airing,Music,Kids,Unknown,Music,0,#18307,N/A,N/A,240,"A song by Tomoyo Harada & Keiichi Suzuki.

""Rain falls in the mountain, dancing on the ground.
Forming a small stream of water a mischievous bear runs by the stream. Silently he looks down at the water, and wonders if there is a fish…""

(Source: Yamamura Animation)
",2010,3 min.,Unknown,"None found, add some"
75,An Atheist's Christmas,1,Finished Airing,Music,Unknown,"Comedy,",Music,0,#20931,N/A,N/A,89,"Music video for the song An Atheist's Christmas from the album ""NMA Christmas.""","Dec 5, 2013",3 min.,Unknown,Next Media Animation
76,An Enormous Delta,1,Finished Airing,Music,Unknown,Unknown,Music,0,#21067,N/A,N/A,84,Music video directed by Aya Takano for the song An Enormous Delta by Joseph Nothing.,2010,50 sec.,Unknown,"None found, add some"
77,Anaphylaxis,1,Finished Airing,Music,Unknown,Unknown,Music,0,#23503,N/A,N/A,44,Music video for the song Anaphylaxis by Yuuri Kuriyama.,"Oct 22, 2021",3 min.,Unknown,"None found, add some"
78,Anata ga Mieru,1,Finished Airing,Music,Kids,Unknown,Music,0,#19320,N/A,N/A,181,Music video for the song Anata ga Mieru by TEA FOR THREE that was featured on NHK's Minna no Uta program. The video features artwork by Kiyoshi Nakashima.,"Feb 1, 1997",2 min.,Unknown,"None found, add some"
79,Anata Yuzuri,1,Finished Airing,Music,Unknown,Unknown,Music,0,#20815,N/A,N/A,94,"Music video for the song Anata Yuzuri by Penthouse from their EP ""Living Room"".","Dec 7, 2021",4 min.,Unknown,"None found, add some"
80,Ane Naru Mono,Unknown,Not yet aired,Unknown,Unknown,"Horror,Romance,Supernatural,Ecchi,",OVA,50,#5132,N/A,N/A,"15,221","Since the death of his parents, young Yuu has suffered considerably from neglect and abuse at the hands of his adoptive relatives, who leave him to his own resources to survive. Fortunately, a girl named Chiyo comes to his aid and offers to take care of Yuu while acting as his older sister. However, Chiyo is not what she seems, and Yuu knows all too well that her intentions are far from innocent. In exchange for her generosity, Yuu must supply Chiyo with his ""life potential.""

[Written by MAL Rewrite]",Not available,Unknown,Unknown,"None found, add some"
81,Anemone (Music),1,Finished Airing,Music,Unknown,Unknown,Music,0,#23812,N/A,N/A,42,Music video for the song Anemone by DUSTCELL.,"May 20, 2020",3 min.,Unknown,"None found, add some"
82,Anhe Zhuan,26,Not yet aired,Unknown,Unknown,Unknown,ONA,0,#18636,N/A,N/A,220,"Anhe, the most mysterious killer organization in the world, is composed of the three surnames Su, Xie, and Mu. Everyone was poisoned, and their lives were at stake. After learning the news, the three forces of the Anhe River took the opportunity to launch a rebellion. Su Muyu, as the leader of Spider Shadow's guard group, brought in Bai Hehuai, the genius doctor of Medicine King Valley, to heal the elders, while repelling the killers and protecting the elder Zhouquan. At this time, his friend Su Changhe in Anhe, but on behalf of the Su family joined the operation to assassinate the patriarch.

(Source: Youku, translated)",2023 to ?,Unknown,Unknown,"None found, add some"
83,Anime Douyou,30,Finished Airing,Music,Kids,Unknown,Music,1,#17825,N/A,N/A,267,A series of animated videos for various children's songs.,1988,5 min. per ep.,Unknown,"None found, add some"
84,"Another Day, Another Place",1,Finished Airing,Music,Unknown,"rde,",Music,0,#23335,N/A,N/A,46,"Music video for the song Another day, another place by Mellowhead.","Jun 23, 2004",4 min.,Unknown,"None found, add some"
85,Antenna,1,Finished Airing,Music,Unknown,Unknown,Music,0,#22812,N/A,N/A,52,Music video for the song Antenna featuring vocals from Hatsune Miku.,"Feb 18, 2021",4 min.,Unknown,"None found, add some"
86,Anthracite,1,Finished Airing,Music,Unknown,Unknown,Music,0,#23336,N/A,N/A,46,Music video for the song Anthracite by UMI☆KUUN.,"Jul 23, 2020",3 min.,Unknown,"None found, add some"
87,Antihero,1,Finished Airing,Music,Unknown,Unknown,Music,0,#22376,N/A,N/A,58,Music video for the song Antihero by DUSTCELL.,"Jan 26, 2023",2 min.,Unknown,"None found, add some"
