,title,episodes,status,theme,demographic,genres,type,favorites,popularity,rank,score,members,synopsis,aired,duration,premiered,studios
506,Hikousen,1,Finished Airing,Music,Unknown,"Fantasy,",Music,0,#19689,N/A,N/A,160,"Animated music video for the song Hikousen by Cidergirl.

Cidergirl were selected as the third artists in the Universal Music Group and DHL music collaboration DHL FAST-TRACK.","May 20, 2022",3 min.,Unknown,Rabbit Machine
507,"Himesama ""Goumon"" no Jikan desu",Unknown,Not yet aired,Mythology,Shounen,"Comedy,Fantasy,Gourmet,",TV,6,#10471,N/A,N/A,"2,183","The princess who's been held captive by the Demon Lord's army is scheduled to be executed by the Demon Lord's relentless torture!

(Source: MU)",Jan 2024 to ?,Unknown,Winter 2024,PINE JAM
508,Hina,Unknown,Not yet aired,Unknown,Unknown,Unknown,Movie,0,#14128,N/A,N/A,645,"The ""highly entertaining action drama"" is set in Izu, Japan, where men are fighting over a woman called Hina. What is it exactly that makes Hina mislead men? As the men try to reveal their true feelings for Hina, strong, muscly men also get involved and the sound of the festival drum signals the start of a confrontation. 

(Source: Variety, edited)",Not available,Unknown,Unknown,"None found, add some"
509,Hitoribocchi no Uta,1,Finished Airing,Music,Kids,Unknown,Music,0,#21700,N/A,N/A,70,Music video for the song Hitoribocchi no Uta by Kuni Kawachi that was featured on NHK's Minna no Uta program.,"Jun 2, 1984",2 min.,Unknown,"None found, add some"
510,Hitotsu dake Kaeta,1,Finished Airing,Music,Unknown,Unknown,Music,0,#19727,N/A,N/A,158,Music video directed and animated by Ryoji Yamada for the song Hitotsu dake Kaeta by Kicell.,"Feb 6, 2018",5 min.,Unknown,"None found, add some"
511,Hitotsu no Doa,1,Finished Airing,Music,Kids,Unknown,Music,0,#19644,N/A,N/A,163,Music video for the song Hitotsu no Doa by Yui Komuro that was featured on NHK's Minna no Uta program. The video was animated by Keizou Kira.,"Feb 1, 1999",2 min.,Unknown,"None found, add some"
512,Hiyoko Buta no Theme Part 2.,1,Finished Airing,Music,Kids,"Romance,",Music,0,#19343,N/A,N/A,180,Music video for the song Hiyoko Buta no Theme Part 2. by Cocco (Tomoko Maki) that was featured on NHK's Minna no Uta program. The video features clay animation by Yuuichi Itou.,"Aug 2, 2001",2 min.,Unknown,"None found, add some"
513,Hizukuri,1,Not yet aired,Unknown,Unknown,"Adventure,Sci-Fi,",ONA,0,#7806,N/A,N/A,"5,418","In a city of a parallel world. A boy finds a pair of broken scissors from his father's belongings after he passed away. And a boy's mother tells him that his father had been a gardener in the past. Then he figures out the scissors were made by Sasuke, who is an artisan living in a foreign country. The boy travels all the way to a place where Sasuke lives in order to get his scissors fixed.

(Source: Official site)",Not available,Unknown,Unknown,"None found, add some"
514,Hokkyoku Hyakkaten no Concierge-san,1,Not yet aired,Unknown,Seinen,"Fantasy,",Movie,3,#11686,N/A,N/A,"1,411","Akino works in the most exclusive department store in the city as a concierge: his job is to take care of customers and understand their needs. But there is a peculiarity: the customers are all... animals! Many of them are also Very Important Animals; they are extinct or almost extinct! 

(Source: Baka-Updates)",2023,1 hr. 10 min.,Unknown,Production I.G
515,Holding Hands,1,Finished Airing,Music,Unknown,"rde,",Music,0,#22958,N/A,N/A,51,Music video for the song Holding Hands by The Charm Park.,"Sep 4, 2015",3 min.,Unknown,"None found, add some"
516,Holy Angel's Carol,1,Finished Airing,Unknown,Unknown,Unknown,Music,0,#19243,N/A,N/A,185,"A music video for one of Ensemble Star's units, fine, of their song Holy Angel's Carol.","Dec 13, 2019",2 min.,Unknown,"None found, add some"
517,Honky Tonk Women,1,Finished Airing,Music,Unknown,"Action,",Music,0,#19524,N/A,N/A,170,"A music video for Qing Yong All Stars' Chinese rendition of the song ""Honky Tonk Women.""","Jan 26, 2015",3 min.,Unknown,"None found, add some"
518,Honky Tonky Night feat. Kankan,1,Finished Airing,Music,Unknown,Unknown,Music,0,#22327,N/A,N/A,59,"Music video for the song Honky Tonky Night by FAKE TYPE., featuring Kankan.","Jun 26, 2023",3 min.,Unknown,"None found, add some"
519,Hopeless Romantic,1,Finished Airing,Music,Unknown,Unknown,Music,0,#23228,N/A,N/A,48,Music video for the song Hopeless Romantic by SIRUP,"Jun 27, 2020",4 min.,Unknown,"None found, add some"
520,Horoscope: Anata no Seiza,1,Finished Airing,Music,Kids,Unknown,Music,0,#17762,N/A,N/A,273,Music video for the song by Sakakibara Ikue that was featured on NHK's Minna no Uta program.,"Dec 7, 1978",2 min.,Unknown,"None found, add some"
521,Hoshi Akari no Concert: Seiza ga Kanaderu Yozora,1,Finished Airing,Unknown,Unknown,Unknown,Music,1,#18441,N/A,N/A,233,A short music video produced as part of Planetarium Starry Cafe's Hoshi Akari no Concert: Seiza ga Kanaderu Yozora winter program.,"Dec 15, 2012",2 min.,Unknown,"None found, add some"
522,Hoshi to Niji to,1,Finished Airing,Music,Kids,Unknown,Music,0,#18829,N/A,N/A,208,Stars twinkling in the sky and a bright rainbow crossing the sky. There's no need for tears with a world so beautiful. The music video invokes these thoughts through stop-motion paper cut-outs with a shadow puppet flair.,"Oct 5, 1972",2 min.,Unknown,"None found, add some"
523,Hoshikuzu Telepath,Unknown,Not yet aired,School,Unknown,"Comedy,ve,Supernatural,",TV,46,#5690,N/A,N/A,"11,810","Fifteen-year-old Umika Konohoshi is having a hard time socializing at school, but she hopes her words will someday reach other people. When self-proclaimed alien Yuu Akeuchi enters her life, Umika will learn more about being open.

(Source: MAL News)",Oct 2023 to ?,Unknown,Fall 2023,Studio Gokumi
524,Hoshizora no Orgel,1,Finished Airing,Unknown,Kids,Unknown,Music,0,#18756,N/A,N/A,212,A little boy who is having trouble sleeping meets with the constellations and listens to their soothing music.,"Apr 1, 1996",2 min.,Unknown,"None found, add some"
525,Hot Babe,1,Finished Airing,Music,Unknown,Unknown,Music,0,#22837,N/A,N/A,52,Music video for the song Hot Babe by SUPER JUNIOR-D&E.,"May 30, 2018",4 min.,Unknown,"None found, add some"
526,Houkiboshi (2012),1,Finished Airing,Unknown,Kids,"Sci-Fi,",Music,0,#19325,N/A,N/A,181,Music video for the song Houkiboshi by Japanese vocal group AJI (As Juvenile Innocence) that was featured on NHK's Minna no Uta program. The video was animated by Taku Furukawa.,"Jun 4, 2012",2 min.,Unknown,"None found, add some"
527,How Low Sympathy,1,Finished Airing,Music,Unknown,Unknown,Music,0,#18892,N/A,N/A,204,"Official music video for Scenarioart's How Low Sympathy a part of their 1st mini Album titled night walking.

This is ""Queen"" and ""Spot"" story.
Queen is the sun. Spot is the universe.
Queen is energy. Spot is source.
Queen is power. Spot is a moment and eternity, ALL.
Queen noticed. She was perfect all. All the time.

Presence, anxiety, conflict. Body feel the emotion.
Joy of the queen is ""I remember all"".

(Source: Official site)","Jan 13, 2014",3 min.,Unknown,Decovocal
528,Howl,1,Finished Airing,Music,Unknown,Unknown,Music,0,#22307,N/A,N/A,60,Music video for the song Howl by Ayaka Ohashi.,"Dec 13, 2020",3 min.,Unknown,OTOIRO
529,Human Lost feat. J. Balvin,1,Finished Airing,Music,Unknown,"Sci-Fi,",Music,0,#19898,N/A,N/A,147,"Music video for the song HUMAN LOST by m-flo, featuring J. Balvin. It was featured as the ending song for Human Lost: Ningen Shikkaku.","Oct 10, 2019",3 min.,Unknown,Polygon Pictures
530,Humanity!,1,Finished Airing,Music,Unknown,Unknown,Music,0,#20272,N/A,N/A,125,Official music video for the song Humanity! by Sambomaster.,"Jul 6, 2021",3 min.,Unknown,"None found, add some"
531,Humming Bird,1,Finished Airing,Music,Unknown,Unknown,Music,0,#20794,N/A,N/A,95,Music video for the song humming Bird by Strange Reitaro.,"Apr 8, 2021",3 min.,Unknown,"None found, add some"
532,Hyena Shinsho,1,Finished Airing,Music,Unknown,Unknown,Music,0,#19769,N/A,N/A,155,"The official music video for the song Hyena Shinsho by ShishiShishi, sung by the vocaloid Hatsune Miku.

This song was featured in the album ""Yura Yura"", and a self-cover of the song has been uploaded the same day of the original's upload as well.","Sep 8, 2021",3 min.,Unknown,"None found, add some"
533,Hyohakusha,1,Finished Airing,Music,Unknown,Unknown,Music,2,#19852,N/A,N/A,149,Music video directed by Ray Wakui for the song Hyohakusha by DUSTCELL.,"Aug 23, 2022",3 min.,Unknown,THINKR
534,Hypnosis Mic: Division Rap Battle - Rhyme Anima +,Unknown,Not yet aired,Unknown,Unknown,"Action,Sci-Fi,",TV,23,#8749,N/A,N/A,"3,941",Second season of Hypnosis Mic: Division Rap Battle - Rhyme Anima.,Oct 2023 to ?,Unknown,Fall 2023,A-1 Pictures
535,I Got Socks for Christmas,1,Finished Airing,Music,Unknown,"Comedy,",Music,0,#21473,N/A,N/A,74,"Music video for the song I Got Socks for Christmas from the album ""NMA Christmas"".","Nov 29, 2013",3 min.,Unknown,Next Media Animation
536,I Love Tofu,1,Finished Airing,Music,Kids,Unknown,Music,0,#19680,N/A,N/A,161,Music video for the song I Love Tofu by Shouji Koganezawa that was featured on NHK's Minna no Uta program. The video was animated by Hiroshi Kuzuoka.,"Jun 1, 1994",2 min.,Unknown,"None found, add some"
537,I Nolael Deul-eoyo,1,Finished Airing,Music,Unknown,"rde,",Music,0,#23003,N/A,N/A,50,Music video for the song I Nolael Deul-eoyo by Kassy.,"Nov 19, 2017",4 min.,Unknown,"None found, add some"
538,I Wanna Be Free,1,Finished Airing,Music,Unknown,Unknown,Music,0,#21077,N/A,N/A,84,Music video for the song I Wanna Be Free by PEOPLE 1.,"Dec 27, 2019",3 min.,Unknown,"None found, add some"
539,I'll Take You Anywhere,1,Finished Airing,Music,Unknown,Unknown,Music,0,#18887,N/A,N/A,205,"Official music video for Bearwear's I'll Take You Anywhere song a part of their ""Dreaming In."" album being released October 24th. The music video is a live-action, stop-motion, and standard animation hybrid creation.","Sep 21, 2018",3 min.,Unknown,"None found, add some"
540,i☆Ris the Movie: Full Energy!!,1,Not yet aired,Unknown,Unknown,Unknown,Movie,0,#18799,N/A,N/A,209,A movie inspired by the 10th anniversary celebrations of i☆Ris voice actress idol unit.,2024,Unknown,Unknown,"None found, add some"
541,Ice Cream,1,Finished Airing,Music,Unknown,"rde,",Music,0,#20127,N/A,N/A,133,"Music video directed and animated by Makoto Kubota for the original song Ice Cream by Yoh Kamiyama.

(Source: AniList)","Sep 25, 2019",4 min.,Unknown,"None found, add some"
542,Ichiban Kirei na Hoshi,1,Finished Airing,Music,Kids,Unknown,Music,0,#19294,N/A,N/A,183,"A song about the most beautiful star in the sky and how it encourages people to ""wish upon"" it.","Oct 3, 1989",2 min.,Unknown,"None found, add some"
543,Ichigo no Hanayome-san,1,Finished Airing,Music,Kids,Unknown,Music,0,#19526,N/A,N/A,170,Music video for the song Ichigo no Hanayome-san by Maro and Kuni Kawachi that was featured on NHK's Minna no Uta program. The video was animated by Seiichi Hayashi.,"Jun 2, 1977",2 min.,Unknown,"None found, add some"
544,Idol Shineitai,1,Finished Airing,Music,Unknown,Unknown,Music,0,#19326,N/A,N/A,182,"Idol Shineitai is an original song available to play in ""Project SEKAI: Colorful Stage"", and is associated with the unit MORE MORE JUMP!. The song is produced, composed and written by Mitchie M and features two versions, one by MORE MORE JUMP! and a VOCALOID version that includes modified backup lyrics and features vocals by Hatsune Miku, Kagamine Rin, Megurine Luka and MEIKO.

(Source:  Project SEKAI Wiki)","Sep 9, 2020",3 min.,Unknown,"None found, add some"
545,Idomo,1,Not yet aired,Unknown,Unknown,"Adventure,Fantasy,",ONA,0,#13633,N/A,N/A,761,"The story starts in a mysterious place in the future where ""boys and girls meet.""

(Source: ANN)",Not available,Unknown,Unknown,Twin Engine
546,Iikaereba,1,Finished Airing,Music,Unknown,"Romance,",Music,0,#19595,N/A,N/A,166,"A minimalist animated lyric video for the song Iikaereba by Japanese music unit Every Little Thing on their 46th single ""ANATA TO"".","Apr 21, 2015",3 min.,Unknown,"None found, add some"
547,Iiwake Bunny,1,Finished Airing,Music,Unknown,Unknown,Music,0,#19977,N/A,N/A,142,Music video for the song Iiwake Bunny by Usada Pekora.,"Dec 3, 2022",3 min.,Unknown,OTOIRO
548,Ima,1,Finished Airing,Music,Unknown,Unknown,Music,0,#19681,N/A,N/A,161,Music video for Ima by Nozaki Ricon.,Jun 2017,4 min.,Unknown,"None found, add some"
549,Ima demo Senchou to Yobarete Iru Senchou no Yoru,1,Finished Airing,Music,Kids,Unknown,Music,0,#18620,N/A,N/A,221,A sea captain enjoys a nice night slumber at home. But he ponders about all the adventures he'd had before finally drifting off.,"Dec 3, 1971",2 min.,Unknown,"None found, add some"
550,Ima,1,Finished Airing,Music,Unknown,Unknown,Music,0,#19681,N/A,N/A,161,Music video for Ima by Nozaki Ricon.,Jun 2017,4 min.,Unknown,"None found, add some"
551,Ima demo Senchou to Yobarete Iru Senchou no Yoru,1,Finished Airing,Music,Kids,Unknown,Music,0,#18620,N/A,N/A,221,A sea captain enjoys a nice night slumber at home. But he ponders about all the adventures he'd had before finally drifting off.,"Dec 3, 1971",2 min.,Unknown,"None found, add some"
552,Ima ni Mitero yo!,1,Finished Airing,Music,Unknown,Unknown,Music,0,#19951,N/A,N/A,143,"Music video for the song Ima ni Mitero yo!, performed by Meychan.","Aug 4, 2022",3 min.,Unknown,"None found, add some"
553,In Motion,1,Finished Airing,Music,Unknown,"Action,",Music,0,#20752,N/A,N/A,97,Music video for the song In Motion by hide.,"Jul 10, 2002",4 min.,Unknown,"None found, add some"
554,Ina,1,Finished Airing,Unknown,Unknown,"fe,",Music,0,#21117,N/A,N/A,82,"Animated music video for mino's single ""Ina.""","Feb 23, 2021",3 min.,Unknown,"None found, add some"
555,Innocent Black,1,Finished Airing,Music,Unknown,Unknown,Music,0,#23856,N/A,N/A,42,Music video for the song INNOCENT BLACK by Kankan.,"Jun 24, 2022",1 min.,Unknown,"None found, add some"
556,Inochi,1,Finished Airing,Music,Unknown,"Drama,fe,",Music,0,#18484,N/A,N/A,231,An official music video for the musician Hiwa. It was also shown later at the 2015 Kyoto International Art and Film Festival.,"Sep 5, 2015",4 min.,Unknown,"None found, add some"
557,Inochi no Yukue,1,Finished Airing,Music,Unknown,Unknown,Music,0,#23004,N/A,N/A,50,Music video for the song Inochi no Yukue by DUSTCELL.,"Apr 21, 2021",3 min.,Unknown,Flat Studio
558,Inochi wa Dare no Mono,1,Finished Airing,Music,Unknown,Unknown,Music,0,#19899,N/A,N/A,147,"Animated music video for the song Inochi wa Dare no Mono by Kamisama, Boku wa Kizuite Shimatta. ","Jan 21, 2022",3 min.,Unknown,Calf Studio
559,Inochikaragara,1,Finished Airing,Music,Unknown,Unknown,Music,0,#20500,N/A,N/A,111,"Music video for Nilfruit's song ""Inochikaragara.""","Feb 10, 2023",3 min.,Unknown,"None found, add some"
560,Inori wa Karappo,1,Finished Airing,Music,Unknown,Unknown,Music,0,#19428,N/A,N/A,175,Music video for the song Empty Prayer by nulut featuring Yukari Yuzuki and flower.,"Dec 13, 2019",3 min.,Unknown,"None found, add some"
561,Inside,1,Finished Airing,Music,Unknown,"rde,",Music,0,#19563,N/A,N/A,168,Music video for the song Inside by DUSTCELL.,"Apr 28, 2022",3 min.,Unknown,Mimoid
562,Inside Night Looper,1,Finished Airing,Music,Unknown,Unknown,Music,0,#20863,N/A,N/A,92,No synopsis information has been added to this title. Help improve our database by adding a synopsis here.,"Aug 23, 2020",3 min.,Unknown,"None found, add some"
563,Intergalactia,1,Finished Airing,Music,Unknown,Unknown,Music,0,#20940,N/A,N/A,89,Music video for the song Intergalactia by IA GLOWB.,"Apr 26, 2023",3 min.,Unknown,"None found, add some"
564,Internet Overdose,1,Finished Airing,Music,Unknown,Unknown,Music,2,#20073,N/A,N/A,136,Music video for the song Internet Overdose by Aiobahn feat. KOTOKO made to promote the game NEEDY GIRL OVERDOSE.,"Apr 28, 2021",3 min.,Unknown,"None found, add some"
565,Into the Blue's,1,Finished Airing,Music,Unknown,Unknown,Music,0,#18539,N/A,N/A,227,Music video for the song Into the Blue's by ACCAMER.,"May 22, 2020",4 min.,Unknown,"None found, add some"
566,Iroha Matsuri,1,Finished Airing,Music,Kids,Unknown,Music,0,#19900,N/A,N/A,147,Music video for the song Iroha Matsuri by Japanese singer Miyuki Mori and the Hibari Children Chorus that was featured on NHK's Minna no Uta program. The video was animated by Fumio Ooi.,"Dec 1, 1987",2 min.,Unknown,"None found, add some"
567,Irony,1,Finished Airing,Music,Unknown,Unknown,Music,0,#19952,N/A,N/A,143,"The song vaguely shows that the girl in the song has troubles of trying to fit in,while this is the main part of the song there are other messages that can be shown such as time goes on.

(Source: Vocaloid Wikia)","May 24, 2012",4 min.,Unknown,"None found, add some"
568,Isekai de Mofumofu Nadenade suru Tame ni Ganbattemasu.,Unknown,Not yet aired,Unknown,Shoujo,"Adventure,Fantasy,fe,",TV,15,#8345,N/A,N/A,"4,591","Akitsu Midori (27 years old), ends up in another world after dying from overwork?! I got reincarnated in another world after God blessed me with a special ability. This ability is ""to be loved by non-human beings."" Huh?! Meaning that humans might not like me, but all the fluffy animals will love me? Whoaaa! I get to pet a white tiger and dragons to my heart's [content]! After being reborn as Néma, the youngest daughter of a top class noble family, I'm doing my best for the survival of humanity (?) while enjoying this world's fluffiness.

(Source: Coolmic)",2024 to ?,Unknown,?,EMT Squared
569,Isekai Kongou Dai Butoukai (feat. Obake),1,Finished Airing,Music,Unknown,Unknown,Music,0,#20357,N/A,N/A,121,No synopsis information has been added to this title. Help improve our database by adding a synopsis here.,"Jul 17, 2022",4 min.,Unknown,"None found, add some"
570,Isekai Shikkaku,Unknown,Not yet aired,Isekai,Unknown,"Adventure,Comedy,Fantasy,",TV,30,#6831,N/A,N/A,"7,545","An adventure in another world with cute girls by your side and video game-like powers—sounds like an anime fan's dream, right? Not so for melancholic author Osamu Dazai, who would quite literally prefer to drop dead. Video games haven't even been invented yet when he gets yanked into another world in 1948. Really, all the fantastical adventure he keeps running into is just getting in the way of his poetic dream of finding the perfect place to die. But no matter how much he risks his hide, everything seems to keep turning out okay. Follow a miserable hero like no other in this cheerfully bleak isekai comedy!

(Source: Seven Seas Entertainment)",2024 to ?,Unknown,?,"None found, add some"
571,Ishura,Unknown,Not yet aired,Unknown,Unknown,"Action,Adventure,Fantasy,",TV,25,#7883,N/A,N/A,"5,307","In a world where the Demon King has died, a host of demigods capable of felling him have inherited the world. A master fencer who can figure out how to take out their opponents with a single glance; a lancer so swift they can break the sound barrier; a wyvern rogue who fights with three legendary weapons at once; an all-powerful wizard who can speak thoughts into being; an angelic assassin who deals instant death. Eager to attain the title of ""True Hero,"" these champions each pursue challenges against formidable foes and spark conflicts among themselves. The battle to determine the mightiest of the mighty begins.

(Source: Yen Press)",Not available,Unknown,?,"None found, add some"
572,Island,1,Finished Airing,Music,Unknown,"rde,",Music,0,#23232,N/A,N/A,48,Music video for the song Island by Primary & OHHYUK.,"Mar 25, 2015",3 min.,Unknown,"None found, add some"
573,Island Island,1,Finished Airing,Music,Unknown,"fe,",Music,0,#21808,N/A,N/A,69,"Animated music video for the song ""Island Island"" by Bye Bye Badman.","Mar 5, 2017",4 min.,Unknown,"None found, add some"
574,Issho ni Utaou! Suku & Iku no Uta,24,Finished Airing,Music,Kids,Unknown,Music,0,#21618,N/A,N/A,72,A series of animated music videos featuring the mascot characters Suku & Iku.,"Jun 7, 2019 to Dec 25, 2019",1 min. per ep.,Unknown,"None found, add some"
575,It's a Small World,1,Finished Airing,Music,Unknown,Unknown,Music,0,#19057,N/A,N/A,196,"Music video directed by Ryo Hirano for the song It's a Small World by Japanese rock band OverTheDogs. The track is included on their second studio album ""Tokemeguru"".","Mar 9, 2012",2 min.,Unknown,"None found, add some"
576,It's All About You feat. Sirup,1,Finished Airing,Music,Unknown,Unknown,Music,0,#21036,N/A,N/A,85,"Music video for the song It's all about you by Ovall, featuring SIRUP.","Jan 19, 2022",3 min.,Unknown,"None found, add some"
577,It's Been A Long Time,1,Finished Airing,Music,Unknown,Unknown,Music,0,#20464,N/A,N/A,114,Commercial animated by Studio 4°C for Aaliyah's self-titled 2001 album's streaming release honoring the 20th anniversary of the artist's death.,"Sep 10, 2021",1 min.,Unknown,Studio 4°C
578,Ithna,1,Finished Airing,Music,Unknown,Unknown,Music,0,#21532,N/A,N/A,73,Official music video for the song Ithna by Miyashita Yuu.,"Sep 6, 2019",4 min.,Unknown,"None found, add some"
579,Itsumo no Egao de,1,Finished Airing,Music,Kids,Unknown,Music,0,#21897,N/A,N/A,67,Music video for the song Itsumo no Egao de by Saeko Shu that was featured on NHK's Minna no Uta program.,"Apr 3, 1995",2 min.,Unknown,"None found, add some"
580,Ivy,1,Finished Airing,Music,Unknown,"Romance,",Music,0,#19295,N/A,N/A,183,A music video for the song Ivy from the second album Alstroemeria by Kano.,"Dec 20, 2017",4 min.,Unknown,"None found, add some"
581,Izqnqi,1,Finished Airing,Music,Unknown,Unknown,Music,0,#23666,N/A,N/A,43,Music video for the song izqnqi by DUSTCELL.,"Oct 27, 2021",3 min.,Unknown,"None found, add some"
582,I~ya I~ya I~ya,1,Finished Airing,Music,Unknown,Unknown,Music,0,#21324,N/A,N/A,77,"Whatever whatever whatever is an original song by Neru and z'5. It was uploaded to bilibili on November 11, 2017. The boy in the video is named I, and the girl in the video is named Yaya.

This song quickly became popular, entering the Hall of Fame just a few days after its upload. It also entered the Hall of Legend, exceeded over 5 million YouTube views, and exceeded over 100,000 bilibili views. Hence, this is one of Neru's most notable songs, and one of the Kagamines' most notable duet songs.

(Source: Vocaloid Wikia)","Nov 10, 2017",3 min.,Unknown,"None found, add some"
583,Jagaimo Jaguar,1,Finished Airing,Music,Kids,Unknown,Music,0,#23910,N/A,N/A,41,A music video that aired as part of NHK's Minna no Uta program. The song is by Seiji Tanaka and the members of the Tokyo Broadcasting Children's Chorus.,Dec 1991,2 min.,Unknown,"None found, add some"
584,Jaku-Chara Tomozaki-kun 2nd Stage,13,Not yet aired,School,Unknown,"Drama,Romance,",TV,193,#3357,N/A,N/A,"39,167",Second season for Jaku Chara Tomozaki-kun.,Jan 2024 to ?,Unknown,Winter 2024,Project No.9
585,Jakusha no Sengen,1,Finished Airing,Music,Unknown,Unknown,Music,0,#20501,N/A,N/A,112,"Music video for the song Jakusha no Sengen, performed by Gero.","Jul 14, 2017",4 min.,Unknown,"None found, add some"
586,Jashin-chan Dropkick: Seikimatsu-hen,1,Not yet aired,Unknown,Unknown,"Comedy,Supernatural,",Special,14,#9057,N/A,N/A,"3,524","Objects falling from space have reduced Jinbouchou to ruins. Jashin-chan, guided by the stars, heads south to defeat Yurine Hanazono, the ruler of this violent town. When she arrives in Takamori, at the foot of the beautiful Aso mountain range, she finds...

(Source: MAL News)","Dec 27, 2023",Unknown,Unknown,Makaria
587,Jian Wang 3: Xia Gan Yi Dan Shen Jianxin 3rd Season Part 2,12,Not yet aired,Unknown,Unknown,"Action,Adventure,Comedy,",ONA,0,#19527,N/A,N/A,170,No synopsis information has been added to this title. Help improve our database by adding a synopsis here.,2023 to ?,Unknown,Unknown,Shengying Animation
588,Jibaku Shounen Hanako-kun (Anime Shin Project),Unknown,Not yet aired,Unknown,Shounen,"Supernatural,",Unknown,68,#6442,N/A,N/A,"8,664",Anime Project Restart of Toilet-bound Hanako-kun,Not available,Unknown,Unknown,"None found, add some"
589,Jidousha ni Natta Kame no Uta,1,Finished Airing,Music,Kids,Unknown,Music,0,#21450,N/A,N/A,75,Music video for the song Jidousha ni Natta Kame no Uta by Seiji Tanaka and Sakamoto Children's Choir. Aired as part of NHK's Minna no Uta program.,"Aug 1, 1973",2 min.,Unknown,"None found, add some"
590,Jigokuraku 2nd Season,Unknown,Not yet aired,Unknown,Shounen,"Action,Adventure,Fantasy,",TV,107,#2953,N/A,N/A,"49,986",Second season of Jigokuraku.,Not available,Unknown,?,MAPPA
591,Jigueseo Chikyuu no Sora no Shita de,1,Finished Airing,Music,Kids,Unknown,Music,0,#19528,N/A,N/A,170,Music video for the song Jigueseo Chikyuu no Sora no Shita de by Korean singer-songwriter and composer Yoo Hae Jun that was featured on NHK's Minna no Uta program. The video was animated by Azuru Isshiki and features photography by Ken Domon and Kim Ki-chan. It was also released on DVD by Pony Canyon that same month.,"Apr 1, 2006",4 min.,Unknown,Enjin Productions
592,Jiiji no e Tegami: Grandfather's Letter,1,Finished Airing,Music,Kids,Unknown,Music,0,#19060,N/A,N/A,196,A young boy receives colorful fun letters from his grandfather with hand drawn pictures.,"Dec 2, 2007",2 min.,Unknown,"None found, add some"
593,Jikan wo Sutete,1,Finished Airing,Music,Unknown,Unknown,Music,0,#19483,N/A,N/A,172,"Stop motion music video by ONIONSKIN for the song Jikan wo Sutete by Japanese rock band CARD. The song is featured on their third album ""Tunnel Vision"".","Sep 24, 2019",3 min.,Unknown,Onionskin
594,Jirijiri,1,Finished Airing,Music,Unknown,Unknown,Music,0,#18670,N/A,N/A,218,"A music video for Umineco Sounds' song ""Jirijiri.""","Apr 25, 2012",4 min.,Unknown,"None found, add some"
