,title,episodes,status,theme,demographic,genres,type,favorites,popularity,rank,score,members,synopsis,aired,duration,premiered,studios
702,Dr. Slump Movie 04: Arale-chan Hoyoyo! Nanaba Shiro no Hihou,1,Finished Airing,Gag Humor,Shounen,"Comedy,Sci-Fi,",Movie,1,#11284,#7703,6.25,"1,631","Dr. Slump found the secret treasure named “Eye of Rainbow” of legendary Nanaba Castle in the mountain. This treasure makes every dream come true. When the robbery gang of Arale, Ga-chan tried to steal this treasure, Bisna who is the descendant of Nanaba Kingdom took the treasure. Bisna wanted to revive the devil and Nanaba Kingdom. Arale and her friends went towards the secret Nanaba Castle to get back the treasure. 

(Source: Official Website)","Dec 22, 1984",48 min.,Unknown,Toei Animation
703,Dragon Quest: Dai no Daibouken Buchiyabure!! Shinsei 6 Daishougun,1,Finished Airing,Unknown,Shounen,"Action,Adventure,Fantasy,",Movie,1,#10242,#7704,6.25,"2,336","The third Dragon Quest Dai no Daibouken movie. The story takes place between episode 35 and 36 of the TV series.

After yet again defeating some of Hadlar's (the leader of the Great Demon King's Army) warriors and saving the princess, Dai and his fellow adventurers are relaxing and helping with rebuilding the island village. Unbeknownst to them Hadlar was usurped by a new demon lord called Galbus, who immediately sets forth to once and for all destroy Dai, using his own sextet of champions. During the initial surprise attack Dai's friend Maam's soul is taken and in order to get it back Dai and his friends must attack Galbus on his chosen batlleground. Will Dai survive this?

(Source: Macros74)","Jul 11, 1992",40 min.,Unknown,Toei Animation
704,Eureka Seven AO: Jungfrau no Hanabana-tachi,1,Finished Airing,Mecha,Unknown,"Action,Adventure,Drama,Sci-Fi,",OVA,2,#5913,#7705,6.25,"10,695","An original video anime, released on Blu-ray in a combined Hybrid Disc that also hold an Eureka Seven AO game for the PlayStation 3. 

The OVA is set between episodes eight and nine of the series. ","Sep 20, 2012",31 min.,Unknown,Bones
705,Goblin Slayer: Bouken Kiroku Youshi - Adventure Sheet,1,Finished Airing,Unknown,Unknown,"Action,Adventure,Fantasy,",Special,26,#3006,#7706,6.25,"47,719",Recap of the first 10 episodes of Goblin Slayer.,"Dec 16, 2018",23 min.,Unknown,White Fox
706,Hanamaru Youchien Special Preview,1,Finished Airing,School,Unknown,"Comedy,",Special,0,#9844,#7707,6.25,"2,663",Preview for Hanamaru Kindergarten with a few scenes not included (or different) in the anime.,"Oct 16, 2009",4 min.,Unknown,Gainax
707,Hungry Days: Aoharu ka yo.,11,Finished Airing,Music,Unknown,"Romance,",Special,3,#6889,#7708,6.25,"7,336","Kiki is a 17-year-old high school witch living in Yokohama. In that town, she lives peacefully with her black cat Jiji. She has faint feelings for her childhood friend Tombo who attends the same school as her. One day, by chance, she sees Tombo being confessed to by a junior, and she feels a tug in her heart. Will Kiki be able to deliver her feelings?

(Source: MAL News)","Jun 7, 2017 to Feb 7, 2020",30 sec. per ep.,Unknown,"Shaft,       Tatsunoko Production"
708,Inazma Delivery,10,Finished Airing,Unknown,Unknown,"Action,Comedy,Sci-Fi,",TV,2,#12053,#7709,6.25,"1,239","Inazma Delivery is set in the town of Babiden City, where everything runs on electricity. Hemingway is an earnest young man who works at the delivery company Inazma, which promises to deliver any package to its proper destination. One day, an extraterrestrial lost child in a shark costume named Bytheway appears and asks to be delivered to its home planet, and soon Hemingway and Bytheway are embroiled in all sorts of adventures.

(Source: Crunchyroll)","Dec 9, 2016 to Feb 10, 2017",2 min. per ep.,Winter 2017,Kanaban Graphics
709,AD Police,3,Finished Airing,Unknown,Unknown,"Action,Adventure,Horror,Mystery,Sci-Fi,Suspense,",OVA,22,#4883,#7710,6.24,"17,523","The year is 2027 in MegaTokyo, six years before the Knight Sabers will make their debut. Boomers (artificial humans) are still a relatively new advancement, and the implementation and integration of boomers into society is still a bit buggy -- sometimes fatally so. Whenever a boomer incident occurs, though, there is the Advanced Police, a special force trained to deal with boomer crimes.

Leon McNichol is a rookie in the AD Police, and is just starting to become exposed to the horrors and tragedies one finds every day in MegaTokyo. He and his veteran partner, Gina Marceau, slowly learn about the ever-fading line that separates man from machine. ","May 25, 1990 to Nov 22, 1990",27 min. per ep.,Unknown,"AIC,       Artmic"
710,Ancien to Mahou no Tablet: Mou Hitotsu no Hirune Hime,2,Finished Airing,Unknown,Unknown,"Drama,Fantasy,",ONA,3,#9263,#7711,6.24,"3,290","The story will center on the adventure of Ancien, a girl that keeps appearing in Kokone's dreams. The story of the dream is one that Kokone's father told her as a mysterious fairy tale when she was little. 

(Source: ANN)","Mar 10, 2017 to Mar 17, 2017",12 min. per ep.,Unknown,Signal.MD
711,Boku no Marie,3,Finished Airing,Unknown,Seinen,"Comedy,Romance,Sci-Fi,Ecchi,",OVA,11,#7982,#7712,6.24,"5,121","Ever met the perfect girl? Did she have the perfect boyfriend? Feel like you can't compete? Why not build your own? When an amateur mad scientist attempts to build a robotic duplicate of this dream girl, Marie is the result. Of course, there are the usual unexpected complications. He built her so well that Marie has a mind of her own and a whole host of questions to go with it. The same questions that each of us ask of life. Where did I come from? Why am I here? Why do I look just like that girl over there?! Well, perhaps we don’t all have to worry about that, but Marie does!","Mar 6, 1996 to Aug 21, 1996",28 min. per ep.,Unknown,Pierrot
712,Bouken Yuuki Pluster World,52,Finished Airing,Unknown,Unknown,"Action,Adventure,Sci-Fi,",TV,3,#12503,#7713,6.24,"1,062","According to the legend, the once peaceful ""Pluster World"" plunged into chaos and darkness due to the manifestation of the evil MINASUTA. At that time, selected Plusters were combined with humans, and successfully sealed away the evil MINASUTA. It was then believed that the peace which had returned would continue forever. Greenery and trees filled the land, flowers bloomed everywhere, living creatures soar in the blue sky, run on the land, and swim in the seas.

However, this peacefulness was once again lost due to reappearance of the MINASUTA... Now, the fusion of Plusters and Humans once again opens the door for a hot adventure! 

(Source: aniDB)","Apr 3, 2003 to Mar 25, 2004",24 min. per ep.,Spring 2003,"Actas,       Brain's Base"
713,Buttobi!! CPU,3,Finished Airing,Unknown,Seinen,"Comedy,Sci-Fi,Ecchi,",OVA,19,#6208,#7714,6.24,"9,524","Embarrassed to be the only member of the Electric Brain Study Society who doesn’t own a computer, Akira Takaoka is thrilled when an electronics store advertises a PC9821 for only ninety-eight thousand yen. The deal is limited to the first five customers; unfortunately, by the time Akira gets there, the PCs are sold out. However, a mysterious man in the back alley offers him the exact same deal. Akira takes the deal, only to realize that this PC is not a 9821 version, but a 2198 version instead. It turns out that the PC2198 is an advanced bio-type computer that needs a nearly constant input of sperm to function!

The PC2198, named Mimi, now has to defend Akira from the evil Apple Nacintosh sisters who want to take over the entire Japanese PC market. Will the embarrassed Akira be able to supply Mimi with what she needs to win?

[Written by MAL Rewrite]","Apr 25, 1997 to Sep 26, 1997",27 min. per ep.,Unknown,OLM
714,Captain Tsubasa no Koutsuu Anzen,1,Finished Airing,Educational,Kids,"Sports,",OVA,0,#13477,#7715,6.24,796,"An education film for children starring the Captain Tsubasa cast, it teaches traffic safety specifically around playing near streets.",1987,14 min.,Unknown,"None found, add some"
715,Cinderella Girls Gekijou: Kayou Cinderella Theater 4th Season,7,Finished Airing,Unknown,Unknown,"Comedy,fe,",ONA,0,#9825,#7716,6.24,"2,678",Bonus segments of Cinderella Girls Gekijou 4th Season streamed on The iDOLM@STER Cinderella Girls Mobage following the television broadcast.,"Apr 2, 2019 to Jun 25, 2019",1 min. per ep.,Unknown,"Gathering,       Lesprit"
716,Future GPX Cyber Formula Graffiti,1,Finished Airing,Racing,Unknown,"Action,Sci-Fi,",OVA,0,#13837,#7717,6.24,709,"Short video diary of the original TV series.

(Source: AniDB)","Aug 5, 1992",30 min.,Unknown,Sunrise
717,Fuuma no Kojirou: Fuuma Hanran-hen,1,Finished Airing,Martial Arts,Shounen,"Action,Fantasy,",OVA,5,#11573,#7718,6.24,"1,467","After the Chaos war, Kojiro and Ryouma return to earth only to find their clan members killing off each other. 
","Nov 21, 1991",49 min.,Unknown,animate Film
718,Fuuma no Kojirou: Seiken Sensou-hen,6,Finished Airing,Martial Arts,Shounen,"Action,Fantasy,",OVA,3,#11024,#7719,6.24,"1,806","Hakuo Gakuin used to be a prestigious high school, and famous for martial arts. However, because its rival school; Seishikan, has been cowardly luring it's superior students, Hakuo was going to decline. 

In order to recover from the situation, the acting principal of Hakuo; Hojo Himeko, sends Yagyu Ranko to the Fuma Village in search of the famous Fuma ninja clan for assistance. The leader of the Fuma sent Kojiro to Hakuo, there he faces the notorious Yasha clan who fights for Seishikan lead by Asuka Musashi. 

Soon Kojiro's comrades arrive and an all-out ninja war postponed for 500 years begins between the 2 clans. (Source: d-addicts)","Sep 21, 1990 to Dec 1, 1990",25 min. per ep.,Unknown,animate Film
719,Genei wo Kakeru Taiyou: Fumikomenai Kokoro,1,Finished Airing,Mahou Shoujo,Unknown,Unknown,Special,5,#7007,#7720,6.24,"7,047","Unaired 14th episode of Genei wo Kakeru Taiyou, broadcast on Nico Nico and included in the 4th Blu-ray and DVD volumes. It shows Akari and Fuyuna's lives prior to the main series as well as how Luna got started as a magical girl.","Nov 16, 2013",24 min.,Unknown,AIC
720,Getter Robo Go,50,Finished Airing,Unknown,Shounen,"Action,Adventure,",TV,3,#10072,#7721,6.24,"2,465",A new Getter robot is piloted by three youth as they combat the evil terrors that plague the world.,"Feb 11, 1991 to Jan 27, 1992",24 min. per ep.,Winter 1991,Toei Animation
721,Guskou Budori no Denki (2012),1,Finished Airing,Anthropomorphic,Kids,"ning,Drama,Fantasy,fe,",Movie,10,#7355,#7722,6.24,"6,259","The fairy tale follows a young man named Budori Gusuko in the Tohoku forests of northeastern Japan in the 1920s. After an onslaught of droughts and natural disasters, Budori is forced to leave his home and search for a better life elsewhere. Budori joins a group of scientists at the Ihatov Volcano Department, which deals with the same natural disasters that drove Budori from his home.

(Source: ANN)","Jul 7, 2012",1 hr. 46 min.,Unknown,Tezuka Productions
722,Heibai Wushang 2nd Season,12,Finished Airing,Unknown,Unknown,"Action,Comedy,Supernatural,",ONA,6,#8948,#7723,6.24,"3,661","The opposite bank of Lethe River is Boundary Realm with all night along, keeping the balance of the world’s deaths by ghost messengers. Black and White Warriors are ghost messengers collecting spirits from the Human Realm. Xiaohei and Xiaobai, a pair of Black and White Warriors at the bottom, whose relationship became delicate after experiencing the incident happened inside One Hundred Ghost Great Seal. At the same time, Xiaobai’s true identity began to surface…","Aug 5, 2017 to Oct 14, 2017",15 min. per ep.,Unknown,Wawayu Animation
723,Ikemen Sengoku: Toki wo Kakeru ga Koi wa Hajimaranai,12,Finished Airing,Historical,Unknown,"Romance,",TV,41,#6424,#7724,6.24,"8,727","""Sasuke Sarutobi"" is an average college student at Kyoto University studying time slips as a hobby until the day he falls into a time slip himself, transporting him to the Sengoku Period. Upon arrival, Sasuke encounters several warlords he could only ever dream of meeting: Toyotomi Hideyoshi, Tokugawa Ieyasu, and the famous ""Demon King of the Sixth Heaven"" Oda Nobunaga, who takes him in as a vassal. Introducing several modern concepts to the warlords varying from playing tennis to sending chain letters, Sasuke finds his place in an old but utterly new world. 

[Written by MAL Rewrite]
","Jul 12, 2017 to Sep 27, 2017",3 min. per ep.,Summer 2017,"TMS Entertainment,       Jinnis Animation Studios"
724,Ikkyuu-san (1978),26,Finished Airing,Unknown,Shounen,"Sports,",TV,2,#13887,#7725,6.24,698,"High-school student Ikkyuu knows nothing about baseball, but his talents are recognized by the manager of the baseball club, and he takes up this enchanting sport. While his ignorance of the game leads him to make many mistakes, Ikkyuu - who is in fact a descendant of ninja - displays his superhuman abilities and leads the team to the High School Baseball Championships.

(Source: Nippon Animation)","Apr 10, 1978 to Oct 23, 1978",24 min. per ep.,Spring 1978,Nippon Animation
725,Isuca: Gokuraku,1,Finished Airing,Unknown,Seinen,"Comedy,Romance,Supernatural,Ecchi,",OVA,10,#4419,#7726,6.24,"22,031","Shinichirou Asano, Sakuya Shimazu, and their friends arrive at one of the Shimazu family's private islands for a vacation. However, what starts as a fun and relaxing outing soon takes a turn for the supernatural when the group heads into the island's forest. As their companions mysteriously vanish one after the other, Shinichirou and Sakuya quickly find themselves all alone on a seemingly uninhabited island.

[Written by MAL Rewrite]","Aug 26, 2015",23 min.,Unknown,Arms
726,The iDOLM@STER SideM: Wake Atte Mini!,12,Finished Airing,Idols (Male),Unknown,"Comedy,fe,",TV,7,#8943,#7727,6.24,"3,667",No synopsis information has been added to this title. Help improve our database by adding a synopsis here.,"Oct 9, 2018 to Dec 25, 2018",3 min. per ep.,Fall 2018,Zero-G
727,Tom to Jerry (2022),Unknown,Currently Airing,Unknown,Kids,"Comedy,",Special,2,#12919,#7728,6.24,936,"To celebrate ""Cheese Day,"" (November 11 in Japan), Cartoon Network Japan aired an anime spin on Tom and Jerry that combines the fast-paced humor of the original with a cute, ""pop"" worldview. The pair are joined by the diaper-wearing Tuffy Mouse, another recurring character from the classic cartoon.

(Source: Crunchyroll)","Nov 11, 2022 to ?",1 min.,Unknown,"Fanworks,       Studio Nanahoshi"
728,Urusei Yatsura x Onitsuka Tiger Collaboration CM,1,Finished Airing,Unknown,Unknown,"Comedy,Romance,Sci-Fi,Supernatural,",Special,2,#11147,#7729,6.24,"1,721","A collaboration commercial between the shoe brand Onitsuka Tiger and Urusei Yatsura. It features Ataru and Lum shopping at the real life Onitsuka Tiger store, where Lum attacks Ataru after he hits on the shop attendant.","Oct 20, 2022",1 min.,Unknown,David Production
729,"Wake Up, Girls! Deai no Kiroku: A Brief Recording",1,Finished Airing,Unknown,Unknown,Unknown,OVA,2,#10014,#7730,6.24,"2,519","Special animation disc sold to advance ticket buyers of a Wake Up, Girls! preview event at Akihabara UDX. It contains audition footage of the main characters of the series that is not included in the movie.","Dec 29, 2013",6 min.,Unknown,Ordet
730,"Kawaru Machi, Kawareru Machi, Ishinomaki feat. Jun",1,Finished Airing,Psychological,Unknown,"Drama,Fantasy,",ONA,4,#13761,#7731,6.24,728,"The Ishinomori Manga Museum released an animated short directed by Takuya Inaba based on Shotaro Ishinomori's semi-autobiographical and wordless manga Jun: Shotaro no Fantasy World. The short was inspired by Ishinomori's hometown of Ishinomaki wishing to pay tribute to the work while also paying tribute to the ongoing rebuilding and recovery of Ishinomaki from the Tohoku earthquake and tsunami of March 2011.

(Source: Crunchyroll, edited)
","Feb 11, 2022",9 min.,Unknown,Robot Communications
731,Ketsuekigata-kun! 3,12,Finished Airing,Unknown,Unknown,"Comedy,",TV,2,#8964,#7732,6.24,"3,633","Which type is the best at convincing a father for his daughter's hand in marriage? How does each type behave during a blackout? Whether they are getting rejected by the love of their life, solving a murder mystery, or preparing for an overseas vacation, these stereotypical representations of the four blood types always find a way to make things lively.

[Written by MAL Rewrite]","Oct 13, 2015 to Dec 29, 2015",2 min. per ep.,Fall 2015,"feel.,       Zexcs,       Assez Finaud Fabric"
732,Kishin Heidan,7,Finished Airing,Unknown,Unknown,"Adventure,Sci-Fi,",OVA,2,#10069,#7733,6.24,"2,469","October 1941, as the second World War threatens to destroy the civilized world, an unforeseen complication suddenly occurs. An alien invasion! Despite the sudden appearance of these extraterrestrial aggressors, the Axis and Allies continue their destructive conflict. Only the Kishin Corps and their giant Geo-Armor Robots (a.k.a.: Kishin), developed from a captured alien robot soldier, stand between the Earth and total annihilation!

A teenager, named Taishi, suddenly finds himself at the center of a struggle over a mysterious black attaché case entrusted to him by his father, Professor Tokamura. The case contains the controlling mechanism for one of the giant Geo-Armor Robots, and the Japanese Kanto Army, the alien invaders, and the Kishin Corps all want to recover the device! Between the spies, the armies, the aliens, and the Giant Robots, Taishi is in for an epic adventure—if he can survive it!

(Source: AnimeNfo)","Mar 25, 1993 to Aug 25, 1994",33 min. per ep.,Unknown,AIC
733,Kite Liberator,1,Finished Airing,Gore,Unknown,"Action,Drama,Sci-Fi,",OVA,42,#3838,#7734,6.24,"30,087","In the previous series ""Kite,"" a killer—Sawa—suddenly disappears after she avenges her parents' death, and no one knows where she is.

Several years later, a figure dances airily on the dark side of a big city. She is an angel of death, killing her victim gracefully and disappearing.

Monaka is a normal high school student, though this quiet and modest life has a darker side. An angel of death is Monaka's other persona.","Mar 21, 2008",58 min.,Unknown,Arms
734,Komori-san wa Kotowarenai!,12,Finished Airing,School,Unknown,"Comedy,fe,",TV,74,#2402,#7735,6.24,"71,451","Fifteen-year-old Komori Shuri is a junior high school girl who is too nice to decline requests. Constantly doing favors for other people has given her incredible strength?! But even so, she is also an adolescent junior high school girl.

An anime overflowing with the ups and downs of everyday life!

(Source: Batoto, edited)","Oct 4, 2015 to Dec 20, 2015",2 min. per ep.,Fall 2015,Artland
735,Megami Kouhosei Special Curriculum,1,Finished Airing,Unknown,Unknown,"Action,Sci-Fi,",OVA,1,#8287,#7736,6.24,"4,656","A retelling of the TV series from the point of view of one of the Goddess Pilots.

(Source: ANN)","May 25, 2002",23 min.,Unknown,Xebec
736,Miyanishi Tatsuya Gekijou: Omae Umasou da na,20,Finished Airing,Anthropomorphic,Kids,"Adventure,",TV,4,#11221,#7737,6.24,"1,677","A Tyrannosaurus called Heart was raised by a herbivorous dinosaur. As he grew up, he was scared by other dinosaurs. One day, Heart meets a baby Ankylosaurus and he names the baby ""Umasou (looks delicious)"". Umasou started to be attached to Heart and a strange family love develops between the two.","Oct 4, 2010 to Oct 29, 2010",3 min. per ep.,Fall 2010,Ajia-do
737,Monster Hunter Stories: Ride On,75,Finished Airing,Unknown,Unknown,"Fantasy,",TV,38,#5135,#7738,6.24,"15,186","This is a world where both men and monsters exist. Those who hunt the monsters are called Hunters. But in a small corner of the Hunter's world, there are those called Riders who bond with and coexist with monsters. With their Kizuna Ishi (Bonding Stones) that allow them to awaken the hidden power inside monsters, Riders live in secrecy together with their Otomon, the monsters they formed a connection with.
Ryuto, a young boy living in the Rider village of Hakum, dreams of becoming the world's best Rider. Having just turned 12, he sets out to find his own Otomon for himself before the ceremony where he is given his own Kizuna Ishi. Together with his kind-hearted childhood friend Cheval, his inquisitive childhood friend Lilia, and his partner Naville, he sets out deep into the forest, and has a miraculous encounter with a Rathalos.

(Source: ANN, edited)","Oct 2, 2016 to Apr 1, 2018",24 min. per ep.,Fall 2016,David Production
738,Muv-Luv Alternative: Total Eclipse Recap - Climax Chokuzen Special,1,Finished Airing,Unknown,Unknown,"Action,Sci-Fi,",Special,4,#6552,#7739,6.24,"8,294","A recap primarily of episodes 3-19, this special aired prior to episode 20.  It also included the new OP/ED of the series and a preview of what's to come in future episodes.","Nov 19, 2012",24 min.,Unknown,"Satelight,       ixtl"
739,My Life,1,Finished Airing,Unknown,Unknown,"Drama,fe,",ONA,5,#8555,#7740,6.24,"4,237","A high school girl, while pondering her future, sees it flash before her eyes.","Nov 10, 2012",4 min.,Unknown,"None found, add some"
740,Nozomi Witches,3,Finished Airing,Combat Sports,Unknown,"Romance,Sports,",OVA,0,#10893,#7741,6.24,"1,904","Ryoutaro Shiba and his family have just moved into a new housing neighborhood. He soon discovers he is lucky enough to be living next to a beautiful and bewitching girl named Nozomi Egawa. Nozomi is athletic, an actress, and surprisingly more than anything else, she wants Ryoutaro to become a boxer so that he can fulfil her dream. Ryoutaro isn't exactly sure what Nozomi's dream is, but he definitely does not want to become a boxer. Unfortunately for Ryoutaro, he finds himself being dragged to the high school boxing club because Nozomi has written a resume for him claiming that he is a boxing genius! It actually seems that Ryoutaro has a special gift for boxing that he has never known about before. Ryoutaro soon finds himself in the winners' circle. But for how long can he last, and can he really live up to Nozomi's expectations?

(Source: AnimeNfo)","Aug 5, 1992 to Mar 10, 1993",52 min. per ep.,Unknown,Group TAC
741,One Piece: Barto no Himitsu no Heya!,2,Finished Airing,Unknown,Unknown,"Comedy,",Special,23,#5571,#7742,6.24,"12,416","Bartolomeo and a few mysterious guests recap the adventures of the Straw Hat Crew in the Land of Wano. From Monkey D. Luffy's first encounter with Otama to even the worst generation pirates' final confrontation with Big Mom and Kaido on the roof of Onigashima. The retelling of this exciting tale is just as riveting as the first.

[Written by MAL Rewrite]
","Dec 26, 2021 to May 1, 2022",23 min. per ep.,Unknown,Toei Animation
742,Pop in Q,1,Finished Airing,Unknown,Unknown,"Fantasy,",Movie,19,#5743,#7743,6.24,"11,493","The story begins the day before the graduation ceremony. Five middle school girls each are preoccupied with their real everyday lives. These girls meet each other in a fantasy world after being sent there through a sudden occurrence. There, they learn about the impending crisis that this world is facing. The way to avert this crisis is for the five to collaborate and bring their five hearts together as one through dance.

However, the five cannot come to love the world, and cannot tell their true feelings to one another, so their hearts are unable to unite. The time limit is fast approaching. Can the dance of the five girls save the world? And will they be able to graduate?

(Source: ANN)","Dec 23, 2016",1 hr. 36 min.,Unknown,Toei Animation
743,Qing Chi Hong Xiaodou Ba!,12,Finished Airing,Unknown,Unknown,"Comedy,fe,",ONA,5,#13276,#7744,6.24,840,The main character of this show is a little red bean who dreams of being eaten.,"Jul 5, 2018 to Sep 20, 2018",3 min. per ep.,Unknown,Making Animation
744,SD Gundam Sangokuden Brave Battle Warriors,51,Finished Airing,Unknown,Unknown,"Action,",TV,3,#8240,#7745,6.24,"4,737",A Romance of the Three Kingdoms retelling using SD Gundams.,"Apr 3, 2010 to Mar 19, 2011",12 min. per ep.,Spring 2010,Sunrise
745,Shoujo☆Conto All Starlight,26,Finished Airing,Unknown,Unknown,"Comedy,",ONA,2,#9344,#7746,6.24,"3,201",Chibi shorts based on Shoujo☆Kageki Revue Starlight.,"Jul 5, 2019 to Dec 27, 2019",3 min. per ep.,Unknown,"Kinema Citrus,       IMAGICA Lab."
746,Shoujo☆Kageki Revue Starlight Re LIVE 1st Anniversary PV,1,Finished Airing,Unknown,Unknown,Unknown,ONA,3,#11383,#7747,6.24,"1,567",Special PV for the first anniversary for the mobile game Shoujo☆Kageki Revue Starlight Re LIVE.,"Oct 26, 2019",1 min.,Unknown,Kinema Citrus
747,Soreyuke! Uchuu Senkan Yamamoto Youko II,3,Finished Airing,Unknown,Unknown,"Action,Adventure,Sci-Fi,",OVA,2,#10016,#7748,6.24,"2,514","There is an ancient legend on a distant planet which states (among other things) that four goddesses will one day descend from the skies and all will be right with the world. 

Of course meanwhile, Yohko and the rest of the Terra team (with one straggler) have crashed on a backwater world, and they have to figure out a way off before their new charge... gets hungry again! 

Every so often, a celebration takes place in one of the most beautiful places in the Universe... a cosmic Sakura fest! Since the Terra Team has been doing so well, one of them is invited to join the high command as they meet their opposite numbers from NESS. It's a time of celebration and a time of peace... but it seems that someone didn't get the message.

(Source: AniDB)","Aug 6, 1997 to Dec 22, 1997",30 min. per ep.,Unknown,J.C.Staff
