,title,episodes,status,theme,demographic,genres,type,favorites,popularity,rank,score,members,synopsis,aired,duration,premiered,studios
225,Petit Clover Advance,15,Finished Airing,Unknown,Unknown,"Comedy,",Special,14,#7611,#6226,6.53,"5,722",Petit Clover Specials included in the Black Clover Blu-Ray Volumes.,"Feb 23, 2018 to Jun 25, 2021",4 min. per ep.,Unknown,"None found, add some"
226,PetoPeto-san,13,Finished Airing,Unknown,Unknown,"Comedy,Romance,",TV,11,#7022,#6227,6.53,"7,011","After centuries of antagonism and misunderstanding, the Japanese finally welcome youkai into their community. In an attempt at species integration, normal children begin attending school with paranormal creatures who are quite humanoid. Shingo Ohashi finds himself developing feelings for Hatoko ""Petoko"" Fujimura, a half-youkai half-human girl whose powers are: uncontrollable cuteness to enchant those around her (similar to a low-power succubus), get stuck to any other person who touches her bare flesh (cured by her falling asleep), and the ability to disappear even at the molecular stage (which she can for the most part control).

(Source: The Anime Encyclopedia)","Jul 9, 2005 to Oct 1, 2005",25 min. per ep.,Summer 2005,XEBEC M2
227,Princess Principal: Crown Handler Movie 2 - Revealing Reviews,1,Finished Airing,Historical,Unknown,"Mystery,",Special,8,#9536,#6228,6.53,"3,000",Short special included with the Princess Principal: Crown Handler Movie 2 Blu-ray release.,"Mar 29, 2022",7 min.,Unknown,"None found, add some"
228,Queen's Blade: Gyokuza wo Tsugu Mono,12,Finished Airing,Unknown,Unknown,"Action,Adventure,Fantasy,Ecchi,",TV,86,#2820,#6229,6.53,"53,764","After experiencing the numerous trials encountered on her journey, Reina has grown as a warrior. Determined to take part in the Queen's Blade tournament, she arrives at the capital city Gainos, where Queen Aldora awaits. There gathers a number of beautiful warriors who, like Reina, are there for the Queen's Blade.

Amongst them is Reina's sister, Claudette, determined to restore the glory of House Vance; Tomoe and Shizuka, who are both fighting for their homeland of Hinomoto; Nanael who has been ordered to participate by the Archangel; and the subordinates of the Marshland Witch.

All these beautiful fighters who gather in Gainos have been one objective, to win through the Queen's Blade, the tournament to select the strongest, most beautiful queen. Who would ascend to that glorious throne? That can only be determined via battle.

(Source: AnimeNfo)","Sep 24, 2009 to Dec 10, 2009",24 min. per ep.,Fall 2009,Arms
229,Queen's Blade: Utsukushiki Toushi-tachi,6,Finished Airing,Unknown,Unknown,"Action,Adventure,Fantasy,Ecchi,",OVA,20,#4440,#6230,6.53,"21,850",Queen's Blade OVA. Contains short stories from the lives of the warriors after the Queen's Blade competition.,"Aug 8, 2010 to Mar 14, 2011",28 min. per ep.,Unknown,Arms
230,RobiHachi,12,Finished Airing,Space,Unknown,"Adventure,Comedy,Sci-Fi,",TV,87,#3660,#6231,6.53,"32,870","Ever since they encountered aliens on the moon, humanity's technology has developed by leaps and bounds. Half a century later, even though most have it easy, Robby Yaji and Hacchi Kita cannot seem to catch a break in this advanced society. Robby—a man perpetually struck by misfortune—owes large sums of money to debt collectors due to his poor investments in shady get-rich-quick schemes, and Hacchi finds it difficult to get over the boredom of his mundane life.

The two end up on an adventure of a lifetime when loan shark boss Yang sends Hacchi to collect the money Robby owes. Rather than pay up, Robby blasts off into space and heads to Isekandar, a planet that supposedly brings happiness to anyone who visits. Seeing a chance for some much needed excitement, Hacchi tags along with Robby on this journey filled with alien encounters, giant robot battles, and all sorts of troublemaking—all the while avoiding Yang and his cronies who are desperately combing the universe to find them.

[Written by MAL Rewrite]","Apr 8, 2019 to Jun 24, 2019",24 min. per ep.,Spring 2019,Studio Comet
231,Saki Achiga-hen: Episode of Side-A - Kuro no Tanjoubi,1,Finished Airing,Unknown,Unknown,"fe,",Special,3,#9510,#6232,6.53,"3,036",Short original anime bundled with the limited edition Blu-ray Box of Saki Achiga-hen: Episode of Side-A.,"Mar 18, 2015",11 min.,Unknown,Studio Gokumi
232,Shuffle! Memories,12,Finished Airing,Unknown,Seinen,"Comedy,Drama,Fantasy,Romance,Ecchi,",TV,44,#2778,#6233,6.53,"55,036","A recap of the Shuffle world, set ten years in the future. Gods, Demons, and Humans freely visit the other worlds as if traveling overseas, and romance is in the air. Demons, Gods, And Humans together have been falling in love and creating new families, breaking down the wall that once seperated them. Past memories are visited by Rin Tsuchimi and the events that occured between him and Lisianthus, Nerine, Kaede, Asa, and Primula. 

(Source: ANN)","Jan 8, 2007 to Mar 26, 2007",24 min. per ep.,Winter 2007,asread.
233,Sore Ike! Anpanman: Yumeneko no Kuni no Nyanii,1,Finished Airing,Unknown,Kids,"Comedy,Fantasy,",Movie,1,#15966,#6234,6.53,405,"When a comet that comes back once in a hundred years, Dream Suisei, is travelling by Earth, everybody sees the same dream of a foreign world. Melonpanna saves an egg from being crushed and wakes up to find out that the egg has followed her home. 

A kitten hatches from the egg, and Melonpanna names her Nyanii and starts caring for her. But soon they find out that Nyanii is needed back on Dream Suisei, and if she doesn't return there, she will vanish. Melonpanna struggles with the upcoming hard goodbyes, but the real trouble starts when Baikinman accidentally awakens the evil monster Muuma.

(Source: ANN)","Jul 17, 2004",51 min.,Unknown,"None found, add some"
234,Soushin Shoujo Matoi: Kabushiki Gaisha Knight Busters,1,Finished Airing,Unknown,Unknown,"Supernatural,",Special,1,#9033,#6235,6.53,"3,544",An unaired thirteenth episode of Soushin Shoujo Matoi included with the second BD box set.,"Apr 21, 2017",24 min.,Unknown,White Fox
235,Stella Jogakuin Koutou-ka C³-bu,13,Finished Airing,Unknown,Unknown,"Sports,",TV,75,#2828,#6236,6.53,"53,605","Command, control, and communication: the three pillars to successfully execute missions in modern military combat. They are also the source of inspiration behind Stella Women's Academy airsoft club, aptly named the C3 Club. Due to the club's nature, the members have trouble finding newcomers, but, as the school year starts, they hope to find their next sharpshooter among a new crop of students.

Yura Yamato is a freshman at Stella; she sports an unassertive personality that makes it difficult to make friends. She soon discovers her absent roommate owns a massive collection of military memorabilia and movies, including a replica Desert Eagle. When one of the C3 Club's members catches Yura re-enacting an action movie, she drags her into the Club's airsoft practice match. Despite being on the losing side, Yura is unexpectedly drawn to the excitement of the game.

Upon her return, Yura's roommate—Sonora Kashima—reveals herself to be the C3 Club's president and invites her to join. Now with Sonora by her side, one more exhilarating match convinces Yura to sign up. Thanks to her new teammates, Yura discovers a hidden side to herself and an unexpected love for airsoft. However, as her dedication to the game slowly takes over her life, Yura finds herself on the path of great change and success—one that may easily lead to self-destruction.

[Written by MAL Rewrite]
","Jul 5, 2013 to Sep 27, 2013",24 min. per ep.,Summer 2013,Gainax
236,A.I.C.O. Incarnation,12,Finished Airing,Unknown,Unknown,"Action,Sci-Fi,",ONA,229,#1827,#6237,6.53,"110,353","In 2035, an incident known as “The Burst” occurs at a Japanese research facility,  giving birth to the rapidly expanding, consuming, and self-replicating ""Matter."" Snaking its way through the remains of dams and military facilities in the Kurobe Gorge, the hostile Matter is besieged by task forces trying to prevent it from reaching the ocean and mercenaries seeking the truth behind its existence.

Aiko Tachibana lives under constant medical surveillance after being rescued from the Matter. She spends her days waiting out her recovery by making paper planes. Soon, her daily life at school is disturbed by the arrival of transfer student Yuuya Kanzaki, who proceeds to point out a number of inconsistencies regarding her body. Why is she never injured, and why does she suddenly no longer need her wheelchair? He claims that there is more to her existence than she has been led to believe, and that she alone holds the key to ending The Burst.

With many factions now interested in Aiko, she and Yuuya must gather allies and embark on a dangerous pilgrimage into the heart of the infested gorge before the net can close around them. To escape the conspiracy moving against them, the pair must face off against the Matter—an enemy that flows like water.

[Written by MAL Rewrite]
","Mar 9, 2018",24 min. per ep.,Unknown,Bones
237,Android Ana Maico 2010,24,Finished Airing,Unknown,Seinen,"Comedy,Drama,Sci-Fi,",TV,7,#8958,#6238,6.53,"3,646","In the year 2010, the Japanese radio industry is in decline. To reverse their flagging ratings, a station staffed with perennial losers makes a daring gamble: to hire the industry's first android on-air host. Maico is cute, but it will take more than novelty to win over the fickle audience -- especially with a crew as inept as this one. ","Apr 6, 1998 to Sep 28, 1998",14 min. per ep.,Spring 1998,"Group TAC,       Animaruya"
238,Aru Hi Inu no Kuni kara Tegami ga Kite,1,Finished Airing,Pets,Shoujo,"Drama,",OVA,2,#9414,#6239,6.53,"3,135","The original novel and manga adaptation focus on letters sent from deceased dogs to their former owners. The anime adaptation stars P-chan, a dog whose owner abandoned him.

(Source: LiveChart)","Sep 3, 2015",11 min.,Unknown,"None found, add some"
239,Bakugan Battle Brawlers: New Vestroia,52,Finished Airing,Strategy Game,Unknown,"Adventure,Fantasy,",TV,197,#2551,#6240,6.53,"64,604","After the final downfall of the rogue Bakugan Naga, peace was brought back to Vestroia. With the help of Danma Kuusou, his companion Pyrus Dragonoid, and other Battle Brawlers, the Infinity and Silent Cores were combined and the realm was recreated.

However, New Vestroia will not be given any respite as humanoid alien invaders, the Vestals, arrive and conquer the Bakugan world in one fell swoop. Armed with a fearsome machine capable of restricting Bakugan into their ball forms, they aim to enslave the race as a form of entertainment.

Now, the only force standing in their way is the Bakugan Battle Brawlers Resistance—a group of humans, Bakugan, and Vestals who oppose the idea of annihilating a sentient race. Led by Danma, they must venture into enemy-occupied New Vestroia and repel the invaders, to assure the survival of the entire world.

[Written by MAL Rewrite]","Mar 2, 2010 to Mar 5, 2011",24 min. per ep.,Spring 2010,TMS Entertainment
240,Battle Spirits: Sword Eyes Gekitouden,21,Finished Airing,Strategy Game,Unknown,"Adventure,Fantasy,",TV,1,#10879,#6241,6.53,"1,915",No synopsis information has been added to this title. Help improve our database by adding a synopsis here.,"Apr 7, 2013 to Sep 8, 2013",25 min. per ep.,Spring 2013,Sunrise
241,Blood-C,12,Finished Airing,Unknown,Unknown,"Action,Horror,Mystery,Supernatural,",TV,"1,119",#619,#6242,6.53,"355,042","Peaceful schoolgirl by day, fearsome monster slayer by night, Saya Kisaragi is leading a split life. Equipped with a ceremonial sword given to her by her father for sacred tasks, she vanquishes every monster who dares threaten her quiet little village. But all too soon, Saya's reality and everything she believes to be true is tested, when she overhears the monsters speak of a broken covenant—something she knows nothing about. And then, unexpectedly, a strange dog appears; it asks her to whom she promised to protect the village, curious as to what would happen if she were to break that promise. Tormented by unexplainable visions and her world unraveling around her, we travel with Saya through her struggle to find a way to the truth in a village where nothing is as it seems.

[Written by MAL Rewrite]","Jul 8, 2011 to Sep 30, 2011",23 min. per ep.,Summer 2011,Production I.G
242,Buddy Daddies Intermission: Cherry-Pick,1,Finished Airing,Unknown,Unknown,"Action,Comedy,",Special,15,#7912,#6243,6.53,"5,251",Recap of the first 8 episodes of Buddy Daddies.,"Mar 4, 2023",24 min.,Unknown,P.A. Works
243,Busou Shinki Moon Angel,10,Finished Airing,Unknown,Unknown,"Action,Sci-Fi,",ONA,5,#5482,#6244,6.53,"12,994","The story follows the coming of age and Shinki battles of Tsubasa, a boy who dreams of becoming a Shinki Master, and his Shinki partner Arnval Mk. 2.

(Source: ANN)","Sep 7, 2011 to Jan 26, 2012",5 min. per ep.,Unknown,"TNK,       Kinema Citrus"
244,Chocchan Monogatari,1,Finished Airing,Historical,Unknown,"Drama,fe,",Movie,3,#11320,#6245,6.53,"1,609","This feature length film is based on autobiography of Cho ""Chocchan"" Kuroyanagi, who is better known as the mother of an actress Tetsuko Kuroyanagi.

The story starts in pre-World War 2 Japan when Chocchan marries violinist despite the objection of both of their families. They live in poverty, have three children and are happy together. Any misfortune they face with a smile. But new obstacle for their happiness comes when the war breaks out and Chocchan's husband must leave for the front...","Mar 20, 1996",1 hr. 15 min.,Unknown,Triangle Staff
245,Cross Fight B-Daman,52,Finished Airing,Strategy Game,Kids,Unknown,TV,41,#6616,#6246,6.53,"8,138","A rumor has spread amongst the children worldwide regarding the popular B-Daman matches: A select group will be allowed to participate in an upcoming secret competition, known as ""Cross Fight""! 

(Source: translated and adapted from official site by Cranston) ","Oct 2, 2011 to Sep 30, 2012",14 min. per ep.,Fall 2011,SynergySP
246,D.C.S.S: Da Capo Second Season Omake,2,Finished Airing,Harem,Unknown,"Comedy,Romance,",Special,2,#7090,#6247,6.53,"6,823","Based on the D.C.S.G. game/manga.

The story takes place 2 years after the happenings in the first series. A new, mysterious girl appears and attaches herself to Jun'ichi. Who is this new girl and which connection does she have to the Sakura on Hatsune Island.","Oct 5, 2005 to Apr 5, 2006",7 min. per ep.,Unknown,feel.
247,Dance in the Vampire Bund: Special Edition,1,Finished Airing,Vampire,Unknown,"Action,Supernatural,",Special,13,#5071,#6248,6.53,"15,754",A Dance in the Vampire Bund recap episode featuring re-edited footage from the first 7 episodes.,"Feb 25, 2010",24 min.,Unknown,Shaft
248,Digimon Savers: Agumon! Gaomon! Lalamon! Bakuretsu! Jougai Last Battle!,1,Finished Airing,Unknown,Unknown,"Action,Adventure,Comedy,Fantasy,Sci-Fi,Supernatural,",Special,3,#6848,#6249,6.53,"7,467","A recap of the whole Digimon Savers TV series in one episode, with original commentary by Agumon, Gaomon, and Lalamon, included in the final volume of the DVD releases.

","Aug 24, 2007",23 min.,Unknown,Toei Animation
249,Gambo,1,Finished Airing,Unknown,Unknown,"Action,",Movie,1,#6399,#6250,6.53,"8,845","Gambo is about a battle between a creature who's been killing members of a royal Japanese family, and a mysterious white bear who protects them.

(Source: Crunchyroll)","Jul 20, 2013",12 min.,Unknown,Sunrise
250,Gokuu no Daibouken,39,Finished Airing,Unknown,Unknown,"Comedy,Fantasy,",TV,3,#12665,#6251,6.53,"1,013","In this film, because of complaints from children that Goku is depicted as too much of an eager student, he is instead portrayed as a very naughty modern boy. It then received so many complaints from the PTA about its bad language that it was forced out of the show after all.

(Source: Official Site)","Jan 7, 1967 to Sep 30, 1967",25 min. per ep.,Winter 1967,Mushi Production
251,Haai Step Jun,45,Finished Airing,School,Unknown,"Action,Romance,Sci-Fi,",TV,3,#11828,#6252,6.53,"1,344","Jun is a very intelligent little girl who spends her time arranging all kinds of inventions. It goes until creating two small robots, Kichinosuke and Yukinojo, who become her best friends. Because of her intelligence, Jun gets into college at a young age and she meets and falls in love with a boy from her class who's called Zero. Zero is interested in motorbikes and not in school and is accustomed to not attending the courses. He got delayed in his schooling and thus is found much older than the other students and is there for humiliated for it. On the other hand Jun is way too young and little to be in college and is made fun of. Thanks to their common passion for mechanics, Zero will sympathize with Jun and will agree to dine with her in Harbor, the restaurant where Jun's parents live. This is long series of fun adventures and arguments that little Jun will make to allure her charming prince, who's twice older than her.

(Source: ANN)","Mar 10, 1985 to Jan 12, 1986",24 min. per ep.,Spring 1985,Toei Animation
252,Higurashi no Naku Koro ni Kira,4,Finished Airing,Parody,Unknown,"Mystery,",OVA,151,#2155,#6253,6.53,"85,375","1. Batsukoishi-hen
2. Ayakashisenshi-hen
3. Musubienishi-hen
4. Yumeutsushi-hen","Jul 21, 2011 to Jan 25, 2012",29 min. per ep.,Unknown,Studio Deen
253,Ie Naki Ko (Movie),1,Finished Airing,Unknown,Unknown,"Adventure,fe,",Movie,0,#11837,#6254,6.53,"1,337","Remi, an orphan kid gets hired out to a traveling street entertainer Vitalis when her foster parents fall on hard times.

(Source: IMDb)","Mar 15, 1980",1 hr. 36 min.,Unknown,TMS Entertainment
254,Inu to Hasami wa Tsukaiyou,12,Finished Airing,Unknown,Unknown,"Comedy,Supernatural,",TV,278,#1477,#6255,6.53,"145,305","A nonsense comical mystery. Harumi Kazuhito is a high school boy who loves books and is a fan of novelist Natsuno Kirihime. One day, he finds Kirihime writing at a cafe, about to be shot by a robber. He protects her from the attack but is killed instead. Through the supernatural power of a book-worm, he is reincarnated as a dachshund dog. Kazuhito (as a dog) writhes in a painful bookless life, when a sadistic woman carrying a pair of scissors offers him help. She is Kirihime herself.

(Source: Dog and Scissors Wiki)","Jul 2, 2013 to Sep 17, 2013",24 min. per ep.,Summer 2013,Gonzo
255,Tokkou,13,Finished Airing,Detective,Seinen,"Action,Comedy,Horror,Mystery,Supernatural,",TV,101,#3104,#6256,6.53,"44,986","""Shindou Ranmaru has just graduated from police academy and assigned to Tokko: Special Mobile Investigation Force. On the day of his graduation, he meets the half-naked girl he has been seeing in his dreams. Her name is Rokujo Sakura and she works for a secret group within Tokki, known as Tokko: Special Public Safety Task Force. Shindou ends up joining Tokko to avenge his parents' death, and solve the mysterious mass murder of residents in his hometown of Machida. Meanwhile, bottomless pits begin appearing around Japan, and mysterious creatures emerge from them. Could these events be linked to Machida Massacre?""

(Source: DVD Complete Series Back Cover)","Apr 16, 2006 to Jul 30, 2006",24 min. per ep.,Spring 2006,"AIC Spirits,       Group TAC"
256,Uchuu Kuubo Blue Noah,24,Finished Airing,Unknown,Unknown,"Action,Drama,Sci-Fi,",TV,1,#10727,#6257,6.53,"1,999","Set in the year 2052, Earth has managed to find peace until the arrival of the Death Force - ruthless aliens from a dying solar system - who are desperately searching for a new home. Attacking the Earth with a massive satellite ship called Terror Star, the aliens proceed to terraform the planet to make it their own. For mankind there is one hope: it's up to Colin Collins and a small band of his fellow surviving students to crew a top-secret submersible vessel that can fight the invaders at sea or in space.","Oct 13, 1979 to Mar 30, 1980",26 min. per ep.,Fall 1979,Academy Productions
257,Uchuu no Kishi Tekkaman Blade OVA: Burning Clock,1,Finished Airing,Mecha,Unknown,"Action,Sci-Fi,",OVA,2,#10348,#6258,6.53,"2,262","The first OVA, Burning Clock, tells the story of the Aiba family, goes into further detail about Shinya and Takaya's rivalry.","Nov 30, 1999",9 min.,Unknown,Tatsunoko Production
258,Weiß Kreuz Glühen,13,Finished Airing,Unknown,Unknown,"Action,Drama,",TV,21,#6050,#6259,6.53,"10,145","Koua is an academy that brings Japanese's most talented people and students together. The mission is to train talented people to bear the world's future leadership. However, recently, the suicide rate in the academy is increasing and there is hardly any information being released to the public. 

Fujimiya Aya is sent to infiltrate this school carrying out criminal investigation and disguise himself as a teacher. In fact, actually, there is a connection between Koua academy and the global terrorist activities that are frequently occur. Therefore Persia assigns Hidaka Ken and Kudou Youji as well into this mission to solve the truth and connection of the incident behind Koua academy. 

(Source: AniDB) ","Nov 28, 2002 to Mar 20, 2003",24 min. per ep.,Fall 2002,ufotable
259,Wonder Beat Scramble,26,Finished Airing,Space,Unknown,"Action,Sci-Fi,",TV,1,#12284,#6260,6.53,"1,144","In 2119, the spaceship Green Sleeves found 3 planets attacked by X23, a moving planet heading Earth. The Earth government ordered Green Sleeves to attack X23, but Dr. Sugita, the captain of Green Sleeves, refused because he believed they could co-exist. Then, the communication with Green Sleeves was cut abruptly... 

In 2121, Susumu, the son of Dr. Sugita, is visited by strangers. The take him to Dr. Miya, one of the few supporters to Dr. Sugita's decision, while most blamed him as a traitor. Dr. Miya recommends Susumu to join White Pegasus, a team of special medical recuers. Their Micronizer System can shrink human so that they can cure from the inside of the body. Shortly afterwards, X23 has come in visual range at last. Hues - the aliens of X23 - choose Susumu's friend as their first target. Susumu and the other members of White Pegasus manage to defeat Hues inside of his body. But Susumu finds the signals emitted from the chips within Hues are the music composed by himself and his mother, as a gift to Dr. Sugita... 

(Source: sazuma.com) ","Apr 16, 1986 to Nov 19, 1986",22 min. per ep.,Spring 1986,Mushi Production
260,Wooser no Sono Higurashi: Mugen-hen,13,Finished Airing,Unknown,Unknown,"Comedy,Fantasy,fe,",TV,5,#8183,#6261,6.53,"4,822","The zany and cute-but-crude Wooser returns for another season in Wooser’s Hand-to-Mouth Life: Phantasmagoric Arc! Wooser is a creature that only cares about three things in life: meat, money, and girls.

(Source: Crunchyroll, edited)","Jul 3, 2015 to Sep 25, 2015",7 min. per ep.,Summer 2015,SANZIGEN
261,Ta Bu Dang Nuzhu Hen Duo Nian,16,Currently Airing,Historical,Unknown,"Action,Adventure,",ONA,29,#14274,#6262,6.52,617,"Beiyi used a strategy to attack Baicheng, an important town in the northern border of Daqi Kingdom. Tang Yao, the guard of Baicheng, led his people to resist desperately, but they were outnumbered, and all sacrificed. Only the second daughter, Tang Ying, survived.

What makes Tang Ying even more indignant is that his father sacrificed his life for the country, but in return he was charged with collaborating with the enemy. In order to take the place of her father, Tang Yingyi went to the capital, but found that things were not as simple as imagined.

Is Yuan Lang, the second prince of the Daqi Kingdom who has been hostage for decades, related to Beiyi?

Why is the woman pretending to be herself so strangely similar?

What happened to the otherworldly person that Yao Niang from the movie department was talking about?

There are also those strange and familiar memories that appeared nervously... There are too many mysteries waiting for Tang Ying to answer. 

(Source: Bilibili, Google translated)","Apr 22, 2023 to ?",Unknown,Unknown,Liyu Culture
262,Teekyuu 9,12,Finished Airing,Unknown,Unknown,"Comedy,",TV,14,#5340,#6263,6.52,"13,855",Ninth season of the Teekyuu anime series.,"Jul 12, 2017 to Sep 27, 2017",2 min. per ep.,Summer 2017,Millepensee
263,The King of Fighters: Destiny,24,Finished Airing,Martial Arts,Unknown,"Action,Adventure,Drama,Romance,",ONA,19,#8274,#6264,6.52,"4,677",CG anime adaptation of The King of Fighters fighting game franchise.,"Aug 3, 2017 to Jan 4, 2018",16 min. per ep.,Unknown,iDRAGONS Creative Studio
264,Toki wa Meguru: Tokyo Station,1,Finished Airing,Unknown,Unknown,"fe,",ONA,4,#8016,#6265,6.52,"5,070","Misaki, a 25-year-old woman who is soon to be married, finds an old photo taken at Tokyo Station and an old, broken pocket watch from her late father. Her father worked at Tokyo Station during his life and was a very strict man in her memory, but she saw his smile from the old photo that she's never seen before. Misaki, in attempt to have the old pocket watch repaired, discovers that a watch store existed in Tokyo Station in the past.","Jun 24, 2014",5 min.,Unknown,A-1 Pictures
