,title,episodes,status,theme,demographic,genres,type,favorites,popularity,rank,score,members,synopsis,aired,duration,premiered,studios
0,Gift: Eternal Rainbow,12,Finished Airing,Unknown,Unknown,"Comedy,Drama,Romance,",TV,30,#3756,#6000,6.58,"31,324","Amaumi Haruhiko is a high school student who attends Shimano Academy in a town called Narasakicho. Narasakicho contains an unknown rainbow which constantly overlooks the town and is related to granting a magical wish called ""Gift."" Gift is a once-in-a-lifetime present between two people.

As a child, Haruhiko has been close with his childhood friend, Kirino, until he obtains a new non-blood sister by the name of Riko. Haruhiko develops a strong relationship with Riko until they sadly depart due to the fact Haruhiko's father could no longer support the two of them.

After some times passes by, Riko finally returns to the town of Narasakicho, and along with Kirino, starts to attend Shimano Academy with Haruhiko. The series revolves around the relationship among these main protagonists and slowly reveals the story behind both Gift and the rainbow.","Oct 6, 2006 to Dec 22, 2006",24 min. per ep.,Fall 2006,OLM
1,Hanaukyou Maid-tai,12,Finished Airing,Harem,Shounen,"Comedy,Romance,Ecchi,",TV,42,#3735,#6001,6.58,"31,612","After losing his mother, 14-year-old Taro journeys to Tokyo to live with his grandfather. But he gets the biggest surprise when he discovers that his grandfather's home is a huge mansion with hundreds of beautiful maids ready to serve him. Making matters worse (at least for Taro, but not for our viewing) is that not only does he inherit the Hanaukyo mansion, he gets the services of all of the maids 24 hours a day, 7 days a week.

(Source: ANN)","Apr 13, 2001 to Jun 29, 2001",14 min. per ep.,Spring 2001,Daume
2,Kage kara Mamoru!,12,Finished Airing,Unknown,Unknown,"Comedy,Romance,",TV,27,#4114,#6002,6.58,"25,967","Kagemori Mamoru is a dowdy boy whose hair is disheveled and who wears thick glasses, but he is actually the son of a ninja family. They have protected their neighbors, the Konnyaku family, secretly for 400 years. Mamoru has personally protected their daughter, Konnyaku Yuuna, since they were in kindergarten. When Yuuna is in trouble, Mamoru puts on ninja suit and turns into a competent ninja to help her.","Jan 8, 2006 to Mar 26, 2006",24 min. per ep.,Winter 2006,Group TAC
3,Kamen no Ninja Akakage,23,Finished Airing,Unknown,Shounen,"Action,Fantasy,",TV,0,#12630,#6003,6.58,"1,026","Red Shadow, created by Mitsuteru Yokoyama, is a ninja who wears a red-and-black costume and a stylized red mask. His adventures take place in Feudal Japan, and he and his ninja sidekicks Aokage and Shirokage fight evil warlords, wizards and daikaiju using modern high-tech gadgetry (a blatant oddity in a period setting).

(Source: Wikipedia)","Oct 13, 1987 to Mar 22, 1988",23 min. per ep.,Fall 1987,Toei Animation
4,Kanamewo,1,Finished Airing,Unknown,Unknown,"Drama,ve,Romance,Supernatural,",ONA,49,#4996,#6004,6.58,"16,465","A young, unnamed woman, while biking home from the bank she works at, happens upon a weakened tree goddess whose native shrine is being demolished for construction work. She rescues her and brings the goddess home with her. The two form a relationship, but what will happen to the goddess as the construction progresses?","Nov 4, 2015",5 min.,Unknown,"None found, add some"
5,3 Choume no Tama: Uchi no Tama Shirimasen ka?,36,Finished Airing,Pets,Unknown,"Adventure,",TV,4,#9852,#6005,6.57,"2,652","The characters are Tama, Momo, Wocket, Tiggle, Rockney, Pimmy, Bupkus, Bengpu, and Chopin. There is no consistent plot. Tama and his friends just have little, family friendly, adventures every episode. The only consistency is when a new friend is made one episode and flash backs.

(Source: ANN)","Nov 21, 1988 to Sep 25, 1994",23 min. per ep.,Fall 1988,Group TAC
6,Bakegyamon,51,Finished Airing,Unknown,Shounen,"Action,Fantasy,",TV,13,#9052,#6006,6.57,"3,523","Sanshirou's chances of having an adventure are slim to none in his tiny island hometown, until the day a mysterious stranger invites him to play a game... Without warning, Sanshirou is taken to a backwards universe to play BakéGyamon—a game pitting monsters against monsters. Along the way he meets other players who have a particular reason for being there—to obtain the wish that is granted to the winner. But how far can Sanshirou get when the monsters he's been paired with are a bunch of little mud balls?!

(Source: VIZ Media)","Apr 3, 2006 to Mar 26, 2007",25 min. per ep.,Spring 2006,Radix
7,Bari Bari Densetsu (1987),1,Finished Airing,Racing,Shounen,"Action,Drama,",Movie,10,#10033,#6007,6.57,"2,502","The film is about 4 high-schoolers who are bike racers and illegally partake in races at night on public roads.

(Source: AniDB)","Aug 1, 1987",1 hr. 25 min.,Unknown,Pierrot
8,Bear Bear Bear Kuma!,12,Finished Airing,Isekai,Unknown,"Comedy,",ONA,21,#6585,#6008,6.57,"8,212",Mini anime for Kuma Kuma Kuma Bear released weekly on the Kadokawa Anime YouTube channel.,"Oct 9, 2020 to Dec 25, 2020",30 sec. per ep.,Unknown,EMT Squared
9,Bleach KaraBuri!: Gotei Juusan Yatai Daisakusen!,1,Finished Airing,Unknown,Shounen,"Comedy,",OVA,38,#4818,#6009,6.57,"18,151","An animated adaptation of several chapters of Colourful Bleach. Release with the ""TV Animation BLEACH 5th Anniversary Box.""","Sep 21, 2008",12 min.,Unknown,Pierrot
10,Burn Up Excess,13,Finished Airing,Detective,Unknown,"Action,Adventure,Comedy,Mystery,Sci-Fi,Ecchi,",TV,19,#5813,#6010,6.57,"11,168","Follows the exploits of Team Warrior, a special anti-terror wing of the Neo-Tokyo Police force. Team Warrior is comprised of the habitually broke Rio, gun-crazy Maya, computer specialist Lillica, tech-expert Nanvel, piliot/voyeur Yuji, and is led by the enigmatic Maki. The team faces a number of missions, ranging from bodyguard duty, breaking up robbery and arms rackets, and providing security for a very powerful tank. Rio and company continually thwart the terrorist aims of Ruby, an operative for a shadowy cabal of powerful men. Before the final showdown, the circumstances behind the formation of Team Warrior, how the precocious Rio came to join it, and Maki's painful past will be revealed.

(Source: ANN)
","Dec 12, 1997 to Jul 1, 1998",25 min. per ep.,Winter 1998,Magic Bus
11,Digimon Universe: Appli Monsters,52,Finished Airing,Unknown,Kids,"Action,Adventure,Comedy,Fantasy,Sci-Fi,",TV,80,#5231,#6012,6.57,"14,487","Everyone in the world uses smartphone apps. But inside them lurks unknown creatures called ""Appli Monsters,"" or ""Appmon."" The Appmon are AI lifeforms with the ability to think and act, and exist in the boundary between the human world and digital space. In the vast sea of the internet, the ""last boss AI"" Leviathan takes control of the Appmon with a virus and begins hacking every system, thus starting to control the human world from the world of the net. Haru Shinkai is led to acquire the Appli Drive, and uses it to materialize Gatchmon, a search app monster.

(Source: ANN)","Oct 1, 2016 to Sep 30, 2017",24 min. per ep.,Fall 2016,Toei Animation
12,Dirty Pair Flash,6,Finished Airing,Detective,Unknown,"Action,Adventure,Comedy,Sci-Fi,Ecchi,",OVA,22,#6333,#6013,6.57,"9,082","Kei and Yuri were originally junior auxiliary agents in the Worlds Works and Welfare Agency (W.W.W.A. or 3WA for short) when the two were paired together under the codename ""Lovely Angels."" Kei was coming off her fourth probation for something she had done, and Yuri's dating exploits were common knowledge, not to mention the two had an instant dislike for each other when they met.

At first, Kei and Yuri refused to work with each other, and Kei even resigned from the 3WA. Afterwards, the two continued to work together, although they earned their nickname, ""the Dirty Pair"" because of all the collateral damage the two (unintentionally) cause in the completion of their cases. And even though the two now get along with one another, they continue to bicker and complain to each other.

Although it is often said that these are younger versions of the original Lovely Angels Kei and Yuri, in truth this series is an alternate universe telling of Dirty Pair, set in the years 2248-49.

(Source: Wikipedia)","Jan 21, 1994 to Jun 21, 1994",26 min. per ep.,Unknown,Sunrise
13,"Eiyuu-ou, Bu wo Kiwameru Tame Tenseisu: Soshite, Sekai Saikyou no Minarai Kishi♀",12,Finished Airing,Reincarnation,Unknown,"Action,Fantasy,",TV,569,#1697,#6014,6.57,"121,576","The hero king Inglis—who dedicated his entire life to building his country—is now approaching death. To award him for his honorable achievements, the goddess Alistia appears and grants him one wish. Having never been able to master the blade, Inglis asks to be reincarnated in order to do so.

In a blink of an eye, Inglis finds himself born in the far future as a daughter of the Eucus noble family. Six years later, Inglis is discovered to be Runeless—incapable of utilizing the runes that enable the use of magic in this era. She is therefore ineligible to become a knight. However, this fits in well with Inglis' plan: she instead decides to become the squire for her cousin, Rafinha Bilford, allowing Inglis to focus on pushing her limits.

For Inglis, the challenges this familiar yet different world has to offer are instead opportunities for her to hone her skills—and possibly become an extraordinary squire in the process.

[Written by MAL Rewrite]","Jan 10, 2023 to Mar 28, 2023",23 min. per ep.,Winter 2023,Studio Comet
14,Futoku no Guild,12,Finished Airing,Harem,Shounen,"Comedy,Fantasy,Ecchi,",TV,416,#2056,#6015,6.57,"92,132","Despite having a good reputation as one of the most seasoned guards in the local guild of Mebuki, Kikuru Madan believes he has been wasting his youth and hopes to spend the rest of it like any other person. However, his conscience prevents him from retiring at present, as he worries about the guild's future without him.

Coincidentally—as if to help him find his successor—the guild's receptionist, Enome, assigns Kikuru four fresh recruits: the energetic beastwoman Hitamu ""Hitamuki"" Kyan, the prodigy Maidena Ange, the laid-back Toxico Dannar, and the stalwart Hanabata Nohkins. Although each of them possesses significant talents, they also display characteristics that detract from their potential—including Hitamu's extreme clumsiness and Hanabata's unintentional perverseness.

As if there was not enough to deal with, the monsters outside Mebuki's walls start exhibiting odd behavior by targeting women salaciously, causing the party endless problems in more ways than one. Nevertheless, Kikuru is committed to retiring early; to achieve his goal, the guidance he gives the trainees will be absolutely essential.

[Written by MAL Rewrite]","Oct 5, 2022 to Dec 21, 2022",24 min. per ep.,Fall 2022,TNK
15,Getsuyoubi no Tawawa Specials,2,Finished Airing,Unknown,Unknown,"fe,Ecchi,",Special,37,#3227,#6016,6.57,"42,069","Two special episodes of Getsuyoubi no Tawawa included on Blu-ray.
1. Ukkarimono daga Aisare Jouzu no Kawaii Kouhai
2. Ai-chan to Private Film","Dec 29, 2016",5 min. per ep.,Unknown,PINE JAM
16,Getter Robo G,39,Finished Airing,Mecha,Shounen,"Action,Sci-Fi,",TV,7,#9452,#6017,6.57,"3,086","Takes place after the final defeat of the Dinosaur Empire and the death of Musashi Tomoe in the original Getter Robo series.

Dr. Saotome, creator of Getter Robo, fears that the peace the Getter Robo team has won will be short lived and that an even greater enemies would appear. Dr. Saotome's fears are justified when the militaristic Hyakki (or ""Hundred demons"") Empire appears, but Dr. Saotome is prepared with the creation of an even more powerful Getter Robo, Getter Robo G and a new Getter Robo base. Also with Musashi Tomoe dead, Dr. Saotome needs a third pilot which he finds in baseball player Benkei Kuruma.

(Source: Wikipedia)

","May 15, 1975 to Mar 25, 1976",24 min. per ep.,Spring 1975,Toei Animation
17,Girls & Panzer Heartful Tank Disc Picture Drama,4,Finished Airing,Unknown,Unknown,Unknown,Special,3,#7750,#6018,6.57,"5,489","Picture drama episodes bundled with the Girls & Panzer ""Heartful Tank Disc.""","Sep 25, 2013",10 min. per ep.,Unknown,Actas
18,Gregory Horror Show,25,Finished Airing,Mythology,Unknown,"Comedy,Horror,Mystery,Supernatural,",TV,53,#8576,#6019,6.57,"4,193","The first series is a set of 25 stories about a male businessman arriving at the hotel after taking a train home from work. He encounters the mysterious owner of the hotel, an old mouse known as Gregory, who suggests that he stay a while. Soon, the man becomes drawn into a bizarre series of events taking place within Gregory House as he tries desperately to escape from this bizarre purgatory.

(Source: Wikipedia)",Oct 1999 to Jun 2001,2 min. per ep.,Fall 1999,Milky Cartoon
19,Hakugei Densetsu,26,Finished Airing,Space,Unknown,"Adventure,Sci-Fi,",TV,26,#8349,#6020,6.57,"4,569",A courageous young man tries to find the only person who can save his planet from the most terrifying beast in the universe—the great white whale Moby Dick—in this futuristic anime adventure set in 4699. But locating the outlaw Captain Ahab and his illusory crew of whale hunters and persuading them to put an end to the leviathan's long reign of terror won't be easy. Will Ahab take up the challenge one more time? ,"Apr 9, 1997 to May 12, 1999",23 min. per ep.,Spring 1997,"Studio Junio,       Annapuru"
20,Hakuouki: Otogisoushi,12,Finished Airing,Unknown,Josei,"Fantasy,",TV,10,#7323,#6021,6.57,"6,319","Features the characters from the games in chibi form with a completely new story with the theme: ""A normal everyday that might have existed.""","Apr 5, 2016 to Jun 28, 2016",3 min. per ep.,Spring 2016,DLE
21,Happy☆Lesson: Hoka Hoka★Kanna to Futari Kiri,1,Finished Airing,Harem,Unknown,"Comedy,Romance,",Special,0,#8898,#6022,6.57,"3,703","Special episode.

Kanna strikes back with her plan to capture Chitose, this time getting rid off all the obstacles (mothers, sisters, Fumitsuki) - sending them off on trip to hot springs. Now, what will happen to Chitose when he is alone in home with Kanna?",2002,25 min.,Unknown,"None found, add some"
22,Ikkitousen: Shuugaku Toushi Keppuuroku,1,Finished Airing,Unknown,Unknown,"Action,Ecchi,",OVA,7,#4715,#6023,6.57,"19,042","Nanyo Academy along with the other Kanto schools hold class trips to Kyoto. Old rivalries break out, between the schools, but as if that wasn't bad enough, Kyoto's fighters also show up in full force to challenge the Kanto schools' fighters. 

(Source: ANN)","Nov 12, 2011",43 min.,Unknown,Arms
23,Sword Art Online: Sword Art Offline - Extra Edition,1,Finished Airing,Unknown,Unknown,"Comedy,",Special,90,#2548,#6024,6.57,"64,640",Extra episode of Sword Art Offline included in the Sword Art Online: Extra Edition Blu-ray and DVD.,"Apr 23, 2014",13 min.,Unknown,I was a Ballerina
24,Tennis no Ouji-sama: Message in a Bottle,1,Finished Airing,School,Shounen,"Comedy,",Special,0,#9944,#6025,6.57,"2,586","The Rikkai University-Affiliated Middle School's Boys' Tennis Team stumbles upon a strange bottle. Inside, a cryptic message asks for the recipient to add another item to the bottle and toss it back into the river. Having broken the container to read the note, the team puts it back together with tape and includes a few extra items before sending it on the long journey back to its owner. However, the bottle ends up washing ashore elsewhere, and the tennis team from Seishun Academy finds it instead.

[Written by MAL Rewrite]","Dec 22, 2009",11 min.,Unknown,Production I.G
25,The Hakkenden,6,Finished Airing,Unknown,Shounen,"Action,Adventure,",OVA,14,#6359,#6026,6.57,"9,008","""During the blood-soaked feudal wars of Japan, the Awa clan faced certain extinction from a rival clan backed by demonic forces. Their clan's salvation becomes a curse when the family dog brings back the head of the enemy warlord but insists upon marrying the lord's daughter! This unnatural union bears fruit, but they are killed; and their eight unborn pups reincarnate as the eight Dog Warriors - The Hakkenden. The eight reincarnated souls travel their separate paths of violence and retribution, but slowly they come together as a formidable group representing the eight virtues of the bushido to slay the demons and redeem their clan!""

(Source: DVD Complete Series Back Cover)","Oct 25, 1990 to Mar 25, 1991",30 min. per ep.,Unknown,"AIC,       Artmic"
26,Toriko: Barbarian Ivy wo Hokaku Seyo!,1,Finished Airing,Super Power,Shounen,"Action,Adventure,Comedy,Gourmet,",Special,0,#9241,#6027,6.57,"3,315",Special shown at the Jump Super Anime Tour in 2010.,"Oct 23, 2010",40 min.,Unknown,"None found, add some"
27,Tottoko Hamtarou Movie 2: Ham-Ham Hamuuja! Maboroshi no Princess,1,Finished Airing,Unknown,Kids,"Adventure,Comedy,",Movie,4,#10421,#6028,6.57,"2,207","Lately, Hamtaro has been having a strange dream. In the dream, a beautiful princess hamster tearfully asks for help. Hamtaro can’t forget about her, even when he’s awake. One winter day, Laura talks to Hamtaro. She tells him that everyone in the family is going home to her father’s hometown. When Hamtaro tells his friends about it, Maxwell pulls out a Ham-Ham source book. It’s a book on old hamster history. 

According to the book, there is a “homeland” for hamsters called “Hamja Kingdom”. When the Ham-Hams build a sand castle and recite a spell exactly the way it is written in the book, they are whooshed to the Kingdom. When at last the hamsters reach the bustling Hamja Kingdom of hamsters, the popular King Hamja, the Mini-Hams that they’ve met before in Ham-Ham Land, and many jar spirits called the Mo-Hams appear. A parade begins merrily with singing and dancing! But, the bad magic cat “Sabakunya” appears suddenly, riding the giant sheep monster “Mee Mee”, and starts to trample the town. What a disaster! 

The Ham-Hams flee underground. The Ham-Hams are told of the state of the Kingdom and find that Sabakunya has snatched the King’s daughter, Princess Shera, and is pressing her into marriage on the Kingdom’s Founding Day. Sabakunya is trying to take over the country. Something clicks in Hamtaro’s mind. Princess Shera is without a doubt the princess who appeared in his dreams! Hamtaro wants very much to run to the castle where Sabakunya is, and so he and the Ham-Hams enter the castle. In the castle, they encounter danger after danger, and Hamtaro, pursued by Sabakunya’s henchmen, is separated from others. ","Dec 14, 2002",54 min.,Unknown,TMS Entertainment
28,Uma Musume: Pretty Derby PV,1,Finished Airing,Music,Unknown,"Sports,",ONA,17,#6308,#6029,6.57,"9,180","A promotional video by Cygames for their newest game project. The concept of the game seems to involve a mash-up of an idol-raising simulator with a horse-racing mechanic, except the idols and horses in question are moe, anthropomorphic horse girls.

(Source: Crunchyroll)","Mar 25, 2016",1 min.,Unknown,P.A. Works
29,Vampire Hunter,4,Finished Airing,Vampire,Unknown,"Action,Adventure,Drama,Fantasy,Supernatural,",OVA,47,#4793,#6030,6.57,"18,413","The world is a dark, brooding place populated by humans, but ruled in reality by powerful beings known as the Darkstalkers, and there is constant conflict between them as they try to determine who is the most powerful of them all. Zombies, vampires, werewolves - all of them compete in contests of strength and sheer will to attain their own personal goals. 

All of this becomes moot when a race of Aztec robots called the Huitzil decide that humanity isn't worth saving, and start waging war on the world, while in the sky, a solar god from outer space plots the conquest of Earth. And the Darkstalkers must become unwilling allies in order to save the world. 

(Source: AnimeNfo)","Mar 21, 1997 to Mar 27, 1998",43 min. per ep.,Unknown,Madhouse
30,Wuxian Shijie,16,Finished Airing,Unknown,Unknown,"Action,Fantasy,Supernatural,",ONA,4,#12907,#6031,6.57,939,"An affluent white-collar worker receives a mysterious invitation: ""Would you like to know what life is about?"" ""Would you like to live your life fully?"" It is sent into the unpredictable space of the Lord God, and future human beings will invite and challenge the present world, and the different challenges that humans face during the era of great universe development will be simulated as copies as well. The ""copies"" will guide the selected people to overcome many traps, meet life-and-death comrades, and become leaders. All of this is in the interest of human evolution, survival, and infinite futures!

(Source: Bilibili)","Nov 25, 2022 to Mar 17, 2023",18 min. per ep.,Unknown,Wonder Cat Animation
31,X/1999,1,Finished Airing,Unknown,Shoujo,"Action,Drama,Fantasy,Horror,Sci-Fi,Supernatural,",Movie,120,#3457,#6032,6.57,"37,134","At the millennial edge, the concluding battle for humanity's future is staged. Kamui Shirou's destiny has been decided as he returns to Tokyo to face his ultimate challenge. The Dragon of Heaven, defenders of the Earth, stand ready to protect the world from the Dragon of Earth, the seven angels of legend, who embrace the devastation of the planet to bring about its purification. Now Kamui must decide which side to fight for although he finds the idea utterly unappealing. It isn't until realizing that his two childhood friends, Fuma and Kotori Monou, are in grievous peril that Kamui decides to step into his fated position in the climactic struggle of the Year of Destiny: 1999. 

(Source: AnimeNfo) ","Aug 3, 1996",1 hr. 37 min.,Unknown,Madhouse
32,Youjo Shachou,13,Finished Airing,Workplace,Unknown,"Comedy,",ONA,9,#9037,#6033,6.57,"3,541","Najimu Mujina is just your average five-year-old girl—who also happens to be the CEO of Mujina company. While she leaves most of the important work to her secretary Yuki Karuizawa, she often tries to act like a CEO with her inadequate business jargon. But, although her innocent efforts can be unexpectedly kind and uplifting, it just usually adds to the troubles of those around her, such as diligent employee Mayu Warito and her fellow colleagues at Mujina Company.

[Written by MAL Rewrite]","Jan 1, 2021",3 min. per ep.,Unknown,Project No.9
33,Youkai Watch,214,Finished Airing,Mythology,Kids,"Comedy,Supernatural,",TV,216,#3815,#6034,6.57,"30,401","Primary school student Keita Amano's curiosity is as innocent as any other child's his age. But when one day he decides to venture deeper into the forest, he encounters a small and mysterious capsule. Out from its depths comes Whisper. After 190 years of imprisonment, this ghost-like creature is glad that someone has been kind enough to set him free. He decides to reward Keita by becoming his guardian against supernatural forces. Whisper is one of many Youkai that exist in the world, and provides Keita with a special Youkai Watch, which enables him to see and interact with all the other Youkai.

Youkai Watch follows Keita, Whisper and the cat spirit Jibanyan as they encounter Youkai, befriend them, fix all the trouble that they so often cause, and, with the help of the watch, use the powers of previously encountered Youkai to aid them. Young Keita may have been just an ordinary primary school student when he first encountered the Youkai, but the many adventures that follow his discovery provide him with invaluable experiences and precious life lessons that help him grow.","Jan 8, 2014 to Mar 30, 2018",23 min. per ep.,Winter 2014,OLM
34,Zuihou de Zhaohuan Shi,12,Finished Airing,Harem,Unknown,"Action,Adventure,Drama,Fantasy,",ONA,234,#2814,#6035,6.57,"53,925","A talented young cook's encounter with a hungry girl who popped up in his kitchen changes his ordinary life forever. Dora, a summoned spirit and a truly cute goddess, now calls him master. However, he is not interested at all and trying everything he could to get away from the ghostly figure. As fate would have it, when he becomes a summoner by accident, there is no turn back in life.

(Source: MU)","Apr 26, 2022 to Jul 5, 2022",22 min. per ep.,Unknown,ASK Animation Studio
35,Kinkyuu Hasshin Saver Kids,50,Finished Airing,Mecha,Unknown,"Action,Adventure,Comedy,Sci-Fi,",TV,2,#13119,#6036,6.57,882,"Matsugorou is a vile doctor who plots out a plan to take over the world by commanding his own robotic army. The only chance the world has is a group of three brothers that make up a team called the Emergency Departure Saver Kids.

(Source: ANN)","Feb 19, 1991 to Feb 18, 1992",25 min. per ep.,Winter 1991,Tokyo Movie Shinsha
