,title,episodes,status,theme,demographic,genres,type,favorites,popularity,rank,score,members,synopsis,aired,duration,premiered,studios
715,Clockwork Planet,12,Finished Airing,Unknown,Unknown,"Fantasy,Sci-Fi,",TV,419,#1409,#6716,6.44,"154,851","Legend tells that when the Earth was destroyed, the great clockmaker Y made a replacement from cogs and gears. Naoto Miura is a young boy who aspires to be a great clockmaker. However, despite his unique talent—sensitive hearing that can immediately understand clockwork mechanics from noise alone—he has made little progress. But this changes when a coffin falls from the sky into his apartment, revealing RyuZU, a female automaton forged by Y himself.

News of RyuZU's arrival brings Marie Bell Breguet, the gifted heir of a distinguished line of clockmakers, and her cyborg bodyguard Vainney Halter into Naoto's life as well. When she and Naoto both become embroiled in an action-packed battle for their lives, they discover an uncomfortable truth: the clockwork planet that humanity has lived on for over a millennium is beginning to break down—a secret that many people will kill to protect.

[Written by MAL Rewrite]","Apr 7, 2017 to Jun 23, 2017",24 min. per ep.,Spring 2017,Xebec
716,Computer Kakumei: Saikyou x Saisoku no Zunou Tanjou,1,Finished Airing,Unknown,Unknown,"Sci-Fi,",Special,3,#7051,#6717,6.44,"6,920","The anime short Computer Kakumei was aired by the Japanese public broadcaster NHK as part of a TV special. The near-future anime was conceived by Parasite Eve author Hideaki Sena, and it depicts how ubiquitous computers have transformed life's various aspects in 2020 Tokyo. The story is told through the eyes of a high school senior named Mako.","Jun 3, 2012",10 min.,Unknown,Production I.G
717,Corpse Party: Tortured Souls - Bougyakusareta Tamashii no Jukyou,4,Finished Airing,Gore,Unknown,"Horror,Mystery,Supernatural,",OVA,"1,650",#592,#6718,6.44,"369,355","Nine students gather in their high school at night to bid farewell to a friend. As is customary among many high school students, they perform a sort of ritual for them to remain friends forever, using small paper charms shaped like dolls.

However, the students do not realize that these charms are connected to Heavenly Host Academy—an elementary school that was destroyed years ago after a series of gruesome murders took place, a school that rests under the foundation of their very own Kisaragi Academy. Now, trapped in an alternate dimension with vengeful ghosts of the past, the students must work together to escape—or join the spirits of the damned forever.

A feast for mystery fanatics, gore-hounds, and horror fans alike, Corpse Party: Tortured Souls - Bougyakusareta Tamashii no Jukyou shows a sobering look at redemption, sacrifice, and how the past is always right behind, sometimes a little too close for comfort.

[Written by MAL Rewrite]","Jul 24, 2013",29 min. per ep.,Unknown,asread.
718,Digimon Survive: Prologue Movie,1,Finished Airing,School,Unknown,"Fantasy,Mystery,",ONA,5,#7517,#6719,6.44,"5,902","A prologue movie released on Bandai Namco's official YouTube channels for the eventual 2020 release of the Digimon Survive game. The movie was first shown at the Anime Expo's panel ""The Future of Digimon"" and then later posted online.","Jul 22, 2019",3 min.,Unknown,Toei Animation
719,Dog Days'': Limone Resort Tenbou Onsen!,1,Finished Airing,Isekai,Unknown,"Fantasy,Ecchi,",Special,5,#6481,#6720,6.44,"8,535",Special episode delivered to customers who pre-order all six Blu-ray and DVD volumes of Dog Days''.,"Aug 26, 2015",11 min.,Unknown,Seven Arcs Pictures
720,Doraemon: Time Machine de Oshougatsu,1,Finished Airing,Unknown,Unknown,"Adventure,Comedy,Sci-Fi,",Special,1,#11185,#6721,6.44,"1,697",No synopsis information has been added to this title. Help improve our database by adding a synopsis here.,"Jan 3, 1980",22 min.,Unknown,"None found, add some"
721,Eiyuu Densetsu: Sora no Kiseki The Animation,2,Finished Airing,Unknown,Unknown,"Action,Adventure,Fantasy,",OVA,38,#4961,#6722,6.44,"16,792","Ten years ago, a massive invasion by the Erebonian Empire almost shattered the Kingdom of Liberl, piercing to the heart of Capital City before being driven back by a determined counteroffensive led by Cassius Bright. Now, as the invaders pace behind the northern borders, coveting the small kingdom's magic and high technology, Liberl slowly rebuilds with the aid of the Bracer's Guild, whose mystical use of ""Craft"" is even more intrinsic to the nation's defense than its own army. For young Estelle Bright, daughter of Cassius, this is all just ancient history that she and her adopted brother Joshua learned as kids. But history has a way of repeating itself, and as they prepare to join the Bracers Guild themselves, sinister forces are preparing to thrust them into the familiar family situation of being in the worst possible place when mayhem breaks out. Because when their father's airship goes suddenly missing, of course it only makes sense to two green, but extraordinarily capable, young teenagers to strike out on a rescue mission of their own! 

(Source: Sentai Filmworks) ","Oct 10, 2011 to Jan 28, 2012",42 min. per ep.,Unknown,Kinema Citrus
722,Fushigi no Umi no Nadia Omake Gekijou,10,Finished Airing,Unknown,Unknown,"Adventure,Sci-Fi,",Special,5,#8475,#6723,6.44,"4,361","While Nadia has been licensed by ADV, the Omake ""extra"" episodes were not. These short Omake ""extra"" episodes were included as a bonus on the Japanese LD set. They were never released on any other format.

(Source: AnimeSuki)","Feb 18, 2003",4 min. per ep.,Unknown,Gainax
723,Futakoi,13,Finished Airing,School,Unknown,"Comedy,Romance,",TV,23,#3564,#6724,6.44,"34,734","With his mother dead and his father working abroad, Futami Nozomu returns to the town where he lived as a child, to attend high school and work part-time at a local shrine. He soon finds himself caught up in a local legend of twin girls loving the same man. And there are many twin girls in this town....

(Source: ANN)","Oct 7, 2004 to Dec 30, 2004",24 min. per ep.,Fall 2004,Telecom Animation Film
724,Gal to Kyouryuu,12,Finished Airing,Unknown,Seinen,"Comedy,fe,",TV,82,#3755,#6725,6.44,"31,334","Wasted from the night before, Kaede wakes up the next morning to find herself at home with a dinosaur she had brought along with her. The two start living together as an odd pair consisting of a typical gal girl and a mute dinosaur going about daily lives. Although not the most experienced paleontologist, Kaede begins to learn more about her new prehistoric roommate through a series of comedic gags and adventures.

[Written by MAL Rewrite]","Apr 5, 2020 to Dec 20, 2020",11 min. per ep.,Spring 2020,"Kamikaze Douga,       Space Neko Company"
725,Gekiganger 3: The Movie,1,Finished Airing,Unknown,Shounen,"Action,Comedy,Sci-Fi,",OVA,6,#8372,#6726,6.44,"4,524","Ken, Joe, and Akira, three high school students, must combine their three mecha into Gekiganger III to defeat the evil Prince Akara and Emperor Hyperion. The OAV is a compilation of the scenes from Nadesico, a new ""movie"", and is a parody of many mecha series from the 80s. 

(Source: ANN)","Feb 21, 1998",30 min.,Unknown,Xebec
726,Godzilla 1: Kaijuu Wakusei,1,Finished Airing,Unknown,Unknown,"Action,Adventure,Sci-Fi,",Movie,64,#2651,#6727,6.44,"60,545","Twenty thousand years after the fall of humanity, Earth succumbed to legions of ravenous creatures who now freely roam the planet. Far away in the depths of space, the last surviving members of humanity float aimlessly in the same ship they escaped Earth with so many years ago. With the spacecraft running dangerously low on resources, the survivors' leading council must decide on their path forward: should they continue to gamble on finding another Earth-like planet to inhabit, or take to heart an anonymous essay theorizing what may be the only weakness of the ""Godzilla,"" who forced the last remnants of humanity off their home world?

The author of the controversial essay is Haruo Sakaki, a man who witnessed the death of his parents to Godzilla at a young age, which has led him to harbor an obsessive hatred for the monster. Now, he spearheads the operation aimed at reclaiming humanity's birthright from the king of monsters and slaying him once and for all. But, alongside humanity, Earth has undergone drastic change since their departure; Godzilla and its numerous spawns may pale in comparison to the darkness lurking within the hearts of this close-knit community of survivors.

[Written by MAL Rewrite]","Nov 17, 2017",1 hr. 27 min.,Unknown,Polygon Pictures
727,Idol Tenshi Youkoso Youko,43,Finished Airing,Unknown,Shoujo,"Comedy,Drama,",TV,4,#11235,#6728,6.44,"1,665","A young girl and her flying squirrel goes to Tokyo in hopes of becoming an idol singer. On the way, she meets another girl who wants to become an actress, and together they work to achieve their dreams. (Source: ANN)","Apr 2, 1990 to Feb 4, 1991",22 min. per ep.,Spring 1990,"None found, add some"
728,Ie Naki Ko Remy Specials (2001),2,Finished Airing,Unknown,Unknown,"Adventure,Drama,fe,",Special,0,#12692,#6729,6.44,"1,004",A summary of the Ie Naki Ko Remy full series aired as a TV specials. ,"Jul 14, 2001 to Jul 15, 2001",45 min. per ep.,Unknown,Nippon Animation
729,Inakappe Taishou,104,Finished Airing,Unknown,Unknown,"Comedy,Sports,",TV,2,#13478,#6730,6.44,795,"A comedy about a country boy that travels to the city to study judo. He ends up meeting the daughter of a prominent dojo and her judo skilled cat. Each episode features 2 stories. 

(Source: AniDB)","Oct 4, 1970 to Sep 24, 1972",24 min. per ep.,Fall 1970,Tatsunoko Production
730,Inugami-san to Nekoyama-san: Nekoyama-san to Onsen Ryokou,1,Finished Airing,School,Unknown,"Comedy,ve,",Special,5,#5067,#6731,6.44,"15,818",Unaired episode bundled with the Blu-ray/DVD Box-Set.,"Jul 18, 2014",4 min.,Unknown,Seven
731,Isekai wa Smartphone to Tomo ni. 2,12,Finished Airing,Unknown,Unknown,"Adventure,Comedy,Fantasy,Romance,",TV,984,#1913,#6732,6.44,"102,676","Touya Mochizuki grows accustomed to his new life in another world. Armed with his trusty smartphone, the teenager accepts small quests at his leisure while spending time with his new fiancées: Yumina Urnea Belfast, Yae Kokonoe, and twin sisters Linse and Elze Shileska. But even in a relaxing environment, Touya is only beginning to understand the responsibilities that come with these engagements.

In addition to his romantic woes, the elder fairy Lean wishes to locate the remaining pieces of Babylon, the floating island that the mysterious Professor Regina Babylon created five thousand years ago. Touya reluctantly accepts her request and seeks out the teleportation circles that will lead to the islands. However, strange monsters have emerged—possibly powerful enough to destroy the world. In order to save the second life he was given, Touya must weaponize ancient technologies to fight these monsters—all while balancing his overwhelming number of relationships.

[Written by MAL Rewrite]","Apr 3, 2023 to Jun 19, 2023",23 min. per ep.,Spring 2023,J.C.Staff
732,Superflat Monogram,1,Finished Airing,Unknown,Unknown,"Adventure,Fantasy,",Special,4,#6711,#6733,6.44,"7,885","Murakami made this movie in cooperation with Louis Vuitton, the handbag producer. It is more a commercial for Louis Vuitton than it is an anime movie, however the animation is quite special. ",2003,5 min.,Unknown,Toei Animation
733,Tantei Kageki Milky Holmes TD,12,Finished Airing,Super Power,Unknown,"Comedy,Mystery,",TV,10,#6362,#6734,6.44,"8,992","There have been many cases of stolen songs happening among the idols in Yokohama District recently. Even super idol Marine Amagi's hit song ""Kiseki no Uta"" was taken away. At the request of Marine, the Milky Holmes team starts investigating the case.

(Source: Crunchyroll)","Jan 3, 2015 to Mar 28, 2015",22 min. per ep.,Winter 2015,"J.C.Staff,       Nomad"
734,Time Bokan Series: Time Patroltai Otasukeman,53,Finished Airing,Unknown,Unknown,"Action,Adventure,Comedy,Sci-Fi,",TV,0,#12137,#6735,6.44,"1,206","Burning with ambitions to become the most beautiful woman, the most renowned scientist, and the greatest hero the world has ever known, three villains, Atasha, Sekobitchi and Duwarusuki, unite. The trio are Time Patrollers, the keepers and protectors of the annals of history. But, this is only a cover for the trio, as the villains are league with a nefarious leader, who is trying to alter the course of history to suit his desires, and, under his instructions, the trio travel in time with the aim of tampering with recorded history. Only Hikaru and Nana, disguised as the Otasukemen, stand between the villains and their goals. 

(Source: Wikipedia) ","Feb 2, 1980 to Jan 31, 1981",25 min. per ep.,Winter 1980,Tatsunoko Production
735,Toaru Majutsu no Index-tan III,2,Finished Airing,Unknown,Unknown,"Comedy,",Special,6,#5764,#6736,6.44,"11,386",New series of shorts featuring Index-tan.,"Dec 26, 2018 to Apr 30, 2019",9 min. per ep.,Unknown,J.C.Staff
736,Vividred Operation,12,Finished Airing,Unknown,Unknown,"Action,Sci-Fi,Ecchi,",TV,101,#2532,#6737,6.44,"65,472","Situated on Blue Island, the Manifestation Engine has been the answer to the world's energy problem for five years. On the neighboring island of Izu Ooshima reside the cheerful Akane Isshiki, her dependable little sister Momo, and her grandfather Kenjirou, one of the inventors of the Manifestation Engine.

As they live peacefully alongside the powerful creation, it all seems like a dream until mysterious entities known as the ""Alone"" appear seeking to destroy it. With military forces failing to repel the invaders, Kenjirou grants Akane a special key containing the ""Vivid System""—empowering her to fight the Alone.

Joined by Aoi Futaba, Wakaba Saegusa, and Himawari Shinomiya, Akane and her friends stand together in the battle against the unforeseen enemy as the last hope for humanity.

[Written by MAL Rewrite]
","Jan 11, 2013 to Mar 29, 2013",24 min. per ep.,Winter 2013,A-1 Pictures
737,World Witches Hasshin Shimasu!,12,Finished Airing,Unknown,Unknown,"Comedy,",TV,15,#5800,#6738,6.44,"11,230","Countries all over the world formed an alliance to counter the emerging enemy of mankind ""Neuroi,"" whom only girls with special powers could counter. However, the Neuroi never appeared. Instead of fighting, the witches spend their days idly. This time following not only unit 501, but also unit 502 known as ""Brave Witches!"" The 2nd volume of the comical daily drama of the witches who do not fight Neuroi begins!

(Source: MAL News)","Jan 13, 2021 to Mar 31, 2021",15 min. per ep.,Winter 2021,"Acca effe,       Giga Production"
738,Youjuu Toshi,1,Finished Airing,Unknown,Unknown,"Action,Adventure,Drama,Horror,",Movie,212,#2885,#6739,6.44,"51,688","There is Earth, our familiar world, and then there is the Black World, a parallel dimension that very few people are aware of. For centuries, a pact between the two worlds has been observed to maintain peace, and terms must be negotiated and renewed soon to continue relative harmony.

This time around, there is a militant faction that will stop at nothing to prevent the signing of a new treaty for inter-dimensional peace. Two agents of the elite organization known as the Black guards—defenders of the balance between the two worlds—are charged with ensuring the success of the treaty.

Director Yoshiaki Kawajiri (Ninja Scroll) blends stylish eroticism, graphic horror and pulse-pounding action as these two race to consummate the peace treaty in time.

(Source: AniDB)","Apr 25, 1987",1 hr. 22 min.,Unknown,Madhouse
739,Zhongguo Qi Tan,8,Finished Airing,Unknown,Unknown,"Fantasy,",ONA,6,#12421,#6740,6.44,"1,092","A collection of eight short stories about Chinese folklore ""monsters.""","Jan 1, 2023 to Feb 12, 2023",18 min. per ep.,Unknown,Shanghai Animation Film Studio
740,Takarajima Memorial: Yuunagi to Yobareta Otoko,1,Finished Airing,Historical,Unknown,"Adventure,Drama,Mystery,Supernatural,",OVA,0,#11484,#6741,6.43,"1,509","A short story during Jim's adventure at sea. He encounters a man at a bar who told a tail about a one-legged man. Thinking it's Silver who the man is referring too, Jim later asked him for details. The man told Jim that, near the coast Maratoran, Silver left the ship they were on  went to the island on a small boat. Jim, who couldn't go at the time, left for Maratoran six years later. He met Silver's wife and son there.","Dec 21, 1992",7 min.,Unknown,Tokyo Movie Shinsha
741,Tamako Market Specials,6,Finished Airing,Unknown,Unknown,"Comedy,",Special,8,#3654,#6742,6.43,"32,973","Dera's Bar
Dera's Bar is a friendly establishment that welcomes only female patrons. Home to mellow music and captivating conversations, the owner—Dera Mochimazzi—serves up dashing compliments and inspiring wisdom to his customers. However, in reality, the bar allows Dera to talk about his ludicrous whims to Tamako Kitashirakawa and her friends, whose responses often lead the discussion into comical off-topic banter.    

Otchoko Choi-chan 
Exploring the world outside the tropical islands, Choi Mochimazzi passionately journals her experiences for the Prince. Choi's interest in her new friends' lifestyles spurs fruitful learning opportunities, yet growing accustomed to the different environment may be unexpectedly fascinating. 

[Written by MAL Rewrite]
","Mar 20, 2013 to Aug 21, 2013",4 min. per ep.,Unknown,Kyoto Animation
742,Time Bokan,61,Finished Airing,Mecha,Unknown,"Adventure,Comedy,",TV,2,#9945,#6743,6.43,"2,581","Dr. Kieta, the inventor of a time-travel machine, is lost on a test run of his machine to the prehistoric past. When the time-space craft returns to the present, his young assistants are surprised to find only a parrot in the cockpit. In their hurry to find the missing scientist before it is too late, the youngsters set out on a time-space hunt without any clear destination.

(Source: Official Site)","Oct 4, 1975 to Dec 25, 1976",24 min. per ep.,Fall 1975,Tatsunoko Production
743,Tokyo Ghoul:re 2nd Season,12,Finished Airing,Unknown,Seinen,"Action,Fantasy,Horror,",TV,"2,714",#191,#6744,6.43,"834,420","After the conclusion of the Tsukiyama Family Extermination Operation, the members of the Commission of Counter Ghouls (CCG) have grown exponentially in power and continue to pursue their goal of exterminating every ghoul in Japan. Having resigned from Quinx Squad, the now seemingly emotionless Haise Sasaki begins taking on more and more tasks from the CCG with no regard to the difficulty. Despite his vacant expressions, Ken Kaneki's memories are resurfacing in Haise, leaving him in a state of internal conflict. Meanwhile, his new coldhearted behavior is affecting the people around him. Quinx Squad are left in shambles, having to cope with the death of one of their members without the support of their former mentor.

Amidst this turmoil, both Quinx Squad and Haise must continue to fulfill their duties to the CCG, whether willingly or not. However, the presence of a mysterious group behind the CCG has been made known to Haise, and certain whispers of corruption have not gone unheard by the Quinx Squad as well.

[Written by MAL Rewrite]","Oct 9, 2018 to Dec 25, 2018",24 min. per ep.,Fall 2018,Pierrot
744,Yoku Wakaru Gendai Mahou,12,Finished Airing,Mahou Shoujo,Unknown,"Comedy,",TV,29,#4174,#6745,6.43,"25,191","Life hasn't been fair to Koyomi Morishita. Even though she's in high school, she's so short that everyone assumes she's still in grade school. The boys and girls in her school tease her mercilessly, and she's not exactly graceful either. On the other hand, she's still better off than Yumiko, who has a magician trying to kill her. Or at least Koyomi was until their paths crossed!

Fortunately, salvation arrives in the form of master mage and graduate student Misa Anehara, who agrees to take Koyomi under her wing in learning the new style of magic, which breaks enchantment down into sequences of code. That'll be quite a task, given that so far Koyomi's talent seems to consist of making washbasins randomly fall out of the sky. But if it was easy, it wouldn't be magic, would it?

(Source: Sentai Filmworks)","Jul 12, 2009 to Sep 27, 2009",24 min. per ep.,Summer 2009,Nomad
745,Yumedamaya Kidan,1,Finished Airing,Unknown,Unknown,"Drama,Fantasy,",Special,2,#9464,#6746,6.43,"3,074","Naho, an eleven-year-old girl, lives with her father and her two-year-old brother Jun. Her mother died after giving birth to Jun, so Naho has to take care of young Jun at home. Understandingly, this situation is frustrating to little Naho. A girl of her age would be dying to go out and play with friends, but because of Jun, she has to give priority to her duties.

One day, a bizarre man, wearing a long coat and with a big suitcase in his hand, turns up in front of Naho. He introduces himself as ""Kotaro the Dreamball Dealer"" and tells Naho he can take her to a dreamland away from her everyday life. But after this encounter, strange phenomena begin to happen to Naho.

Now Naho is having fun with her friends, and several different worlds come and go before her eyes. Then she finds herself with his father and mother, only the three of them again... But as she starts feeling anxious, the next moment she finds herself wandering into Jun's dream!

Naho is confused. What would she ask to Kotaro? What does she really desire from the deep of her heart?

(Source: Production I.G.)","Nov 25, 2007",24 min.,Unknown,Production I.G
746,Kenka Banchou Otome: Girl Beats Boys,12,Finished Airing,Unknown,Shoujo,"Action,",TV,215,#2246,#6747,6.43,"79,998","Kenka Banchou Otome - Girl Beats Boys, Hinako Nakayama has spent all of her life being raised in state-run orphanages, without ever knowing her family. As she's about to enter high school, Hinako is approached by Hikaru, a boy who claims to be her twin brother.

According to Hikaru, Hikaru and Hinako are the children of the head of the powerful Onigashima yakuza family, and Hikaru wants Hinako to switches places with him at Shishiku Academy, an all-boys school overrun with the nation's toughest delinquents. Can Hinako save her brother, find romance, and become the new boss of the school?

(Source: Crunchyroll)","Apr 12, 2017 to Jun 28, 2017",8 min. per ep.,Spring 2017,"Project No.9,       A-Real"
747,Midnight Eye: Gokuu,1,Finished Airing,Unknown,Seinen,"Action,Mystery,Sci-Fi,",OVA,16,#5667,#6748,6.43,"11,883","Furinji Goku is a detective who has an ""eye of god"".

While he was investigating the murder case of his colleague when he had been an officer, he was pressured to stop it by the police executives. However, he continue investigating, and he lost his left eye. When he was about to be killed, a mysterious group helped him and transplant an artificial eye. The eye was a super technological device that connected to the whole computer network in the world, and enabled him to control any computers.

(Source: AnimeNfo)","Jan 27, 1989",50 min.,Unknown,Madhouse
748,Momotarou Densetsu,51,Finished Airing,Unknown,Unknown,"Adventure,Comedy,",TV,1,#14033,#6749,6.43,664,"No synopsis has been added for this series yet.

Click here to update this information.","Oct 2, 1989 to Oct 1, 1990",22 min. per ep.,Fall 1989,Knack Productions
749,Muteki Robo Trider G7,50,Finished Airing,Unknown,Unknown,"Comedy,Sci-Fi,",TV,1,#11676,#6750,6.43,"1,412","Takeo Watta inherits a company upon his father's death. The company focuses on space travel, and the transformable robot Trider-G7 is their greatest creation. When an evil space organization lead by Lord Zakuron starts attacking Earth, Watta has to use Trider in a more combat-oriented way.

(Source: ANN)","Feb 2, 1980 to Jan 3, 1981",24 min. per ep.,Winter 1980,Sunrise
750,Nanatsu no Taizai: Tsumi no Kokuhaku Dennou Grimoire!,10,Finished Airing,Parody,Unknown,"Comedy,",ONA,3,#7432,#6751,6.43,"6,088",Animated audio-dramas released online.,"Sep 30, 2016 to Mar 3, 2017",5 min. per ep.,Unknown,KIZAWA Studio
751,Nekojiru Gekijou Jirujiru Original,27,Finished Airing,Anthropomorphic,Unknown,"Action,Comedy,",TV,80,#5797,#6752,6.43,"11,234","Based on the comics by the late Nekojiru. Contains 23 animated shorts aired TV Asahi Network's show ""Bokusho Mondai Boss Chara Ou."" and 4 unbroadcast episodes.

(Source: AniDB)","Jul 9, 1999 to Oct 1, 1999",1 min. per ep.,Summer 1999,Kent House
752,Ni no Kuni,1,Finished Airing,Isekai,Unknown,"Action,Adventure,Fantasy,",Movie,59,#2696,#6753,6.43,"58,612","Best friends Yuu, Haru, and Kotona enjoy a tranquil high school life together. One day, however, a suspicious man pursues and stabs Kotona—a catastrophe that Yuu and Haru fail to prevent. While hastily carrying the girl to the hospital, the two boys are nearly hit by a truck but miraculously remain unharmed. Instead, they find themselves in a fairy-tale-like kingdom with an exotic diversity of people and wonderful creatures.

To their surprise, the boys discover that Yuu, who has been confined to a wheelchair since childhood, can now walk! Yet they have no time to ponder the puzzling situation, as their friend is gone. Setting off to find Kotona, Yuu and Haru stop at a local pub to inquire about her. But upon inspecting a picture of Asha, the kingdom's princess, the two have a shocking revelation.

Narrating an extraordinary adventure in a magical world, Ni no Kuni demonstrates the special connection between two separate yet parallel worlds and its manifestation of the bonds between individuals.

[Written by MAL Rewrite]","Aug 23, 2019",1 hr. 46 min.,Unknown,OLM
